(this.webpackJsonpscheduler=this.webpackJsonpscheduler||[]).push([[0],{100:function(e){e.exports=JSON.parse('{"daysOfWeek":[2,6],"courseStartIndex":0,"totalCourseDays":97,"courseType":"Bootcamp PT","days":{"16-11-2021":{"courseDate":"16-11-2021","courseWeek":1,"weekDay":1,"dayNumber":2,"meetingDateTimeUTC":"2021-11-16T11:30:00.000Z","courseDay":0,"dateTypes":{"module":"Module 1: Frontend Basics","general":{"type":"general","preClass":{},"inClass":{"items":[{"name":"Day 1 Photo!","url":""},{"name":"Course and Student Introductions","url":""}]},"postClass":{},"dayIndex":0},"css":{"type":"css","preClass":{},"inClass":{},"postClass":{}},"algos":{"type":"algos","preClass":{},"inClass":{},"postClass":{}},"ux":{"type":"ux","preClass":{},"inClass":{},"postClass":{}},"ip":{"type":"ip","ipDue":{},"preClass":{},"inClass":{},"postClass":{}},"projects":{"type":"projects","projectStart":{},"projectDue":{},"preClass":{},"inClass":{},"postClass":{}}}},"20-11-2021":{"courseDate":"20-11-2021","courseWeek":1,"weekDay":2,"dayNumber":6,"meetingDateTimeUTC":"2021-11-20T02:00:00.000Z","courseDay":1,"dateTypes":{"module":"Module 1: Frontend Basics","general":{"type":"general","preClass":{"items":[{"name":"1.0: Module 1 Overview","url":"https://bootcamp.rocketacademy.co/1-frontend-basics/1.0-module-1-overview"},{"name":"1.1: HTML","url":"https://bootcamp.rocketacademy.co/1-frontend-basics/1.1-html"},{"name":"1.1.0: Wireframes","url":"https://bootcamp.rocketacademy.co/1-frontend-basics/1.1-html/1.1.0-wireframes"},{"name":"1.1.1: HTML Basics","url":"https://bootcamp.rocketacademy.co/1-frontend-basics/1.1-html/1.1.1-basic-html"},{"name":"0.0: Module 0 Overview","url":"https://bootcamp.rocketacademy.co/0-language-and-tooling/0.0-module-0-overview"},{"name":"0.1: New JS Syntax","url":"https://bootcamp.rocketacademy.co/0-language-and-tooling/0.1-new-js-syntax"},{"name":"0.2: ES6","url":"https://bootcamp.rocketacademy.co/0-language-and-tooling/0.2-es6"},{"name":"0.2.1: ES6 Basics","url":"https://bootcamp.rocketacademy.co/0-language-and-tooling/0.2-es6/0.2.1-es6-basics"},{"name":"1.2: DOM Review","url":"https://bootcamp.rocketacademy.co/1-frontend-basics/1.2-dom-review"},{"name":"1.2.1: DOM Review - Creating Elements","url":"https://bootcamp.rocketacademy.co/1-frontend-basics/1.2-dom-review/1.2.1-creating-elements"},{"name":"1.2.2: DOM Review - Events","url":"https://bootcamp.rocketacademy.co/1-frontend-basics/1.2-dom-review/1.2.2-events"}]},"inClass":{"items":[{"name":"1.ICE.1: Drawing DOM","url":"https://bootcamp.rocketacademy.co/1-frontend-basics/1.ice-in-class-exercises/1.ice.1-drawing-dom"}]},"postClass":{"items":[{"name":"1.POCE.1: Noodle Recipe Website","url":"https://bootcamp.rocketacademy.co/1-frontend-basics/1.poce-post-class-exercises/1.poce.1-noodles"}]},"dayIndex":1},"css":{"type":"css","preClass":{},"inClass":{},"postClass":{}},"algos":{"type":"algos","preClass":{},"inClass":{},"postClass":{}},"ux":{"type":"ux","preClass":{},"inClass":{},"postClass":{}},"ip":{"type":"ip","ipDue":{},"preClass":{},"inClass":{},"postClass":{}},"projects":{"type":"projects","projectStart":{},"projectDue":{},"preClass":{},"inClass":{},"postClass":{}}}},"23-11-2021":{"courseDate":"23-11-2021","courseWeek":2,"weekDay":1,"dayNumber":2,"meetingDateTimeUTC":"2021-11-23T11:30:00.000Z","courseDay":2,"dateTypes":{"module":"Module 1: Frontend Basics","general":{"type":"general","preClass":{"items":[{"name":"0.3: Reading Documentation","url":"https://bootcamp.rocketacademy.co/0-language-and-tooling/0.3-reading-documentation"},{"name":"1.3: High Card DOM","url":"https://bootcamp.rocketacademy.co/1-frontend-basics/1.3-high-card-dom"},{"name":"1.4: setTimeout","url":"https://bootcamp.rocketacademy.co/1-frontend-basics/1.4-settimeout"}]},"inClass":{"items":[{"name":"Review 1 student\'s 1.POCE.1: Noodle Recipe Website"},{"name":"1.ICE.1: Drawing DOM (continued)","url":"https://bootcamp.rocketacademy.co/1-frontend-basics/1.ice-in-class-exercises/1.ice.1-drawing-dom"}]},"postClass":{"items":[{"name":"1.POCE.2: High Card DOM","url":"https://bootcamp.rocketacademy.co/1-frontend-basics/1.poce-post-class-exercises/1.poce.2-high-card-dom"}]},"dayIndex":2},"css":{"type":"css","preClass":{"items":[{"name":"CSS.1: Basic CSS (Exercises Part 1)","url":"https://bootcamp.rocketacademy.co/css/css-1-basic-css"}]},"inClass":{},"postClass":{},"dayIndex":2},"algos":{"type":"algos","preClass":{},"inClass":{},"postClass":{}},"ux":{"type":"ux","preClass":{},"inClass":{},"postClass":{}},"ip":{"type":"ip","ipDue":{},"preClass":{},"inClass":{},"postClass":{}},"projects":{"type":"projects","projectStart":{},"projectDue":{},"preClass":{},"inClass":{},"postClass":{}}}},"27-11-2021":{"courseDate":"27-11-2021","courseWeek":2,"weekDay":2,"dayNumber":6,"meetingDateTimeUTC":"2021-11-27T02:00:00.000Z","courseDay":3,"dateTypes":{"module":"Module 1: Frontend Basics","general":{"type":"general","preClass":{"items":[{"name":"1.5: High Card setTimeout","url":"https://bootcamp.rocketacademy.co/1-frontend-basics/1.5-high-card-settimeout"},{"name":"1.6: Match Game","url":"https://bootcamp.rocketacademy.co/1-frontend-basics/1.6-match-game"},{"name":"0.2.4: Reference vs. Value","url":"https://bootcamp.rocketacademy.co/0-language-and-tooling/0.2-es6/0.2.4-reference-vs.-value"}]},"inClass":{"items":[{"name":"Review 1 student\'s 1.POCE.2: High Card","url":""},{"name":"1.ICE.2: Timeout / High Card Redux","url":"https://bootcamp.rocketacademy.co/1-frontend-basics/1.ice-in-class-exercises/1.ice.2-high-card-redux"}]},"postClass":{"items":[{"name":"1.POCE.3: Match Game","url":"https://bootcamp.rocketacademy.co/1-frontend-basics/1.poce-post-class-exercises/1.poce.3-match-game"}]},"dayIndex":3},"css":{"type":"css","preClass":{"items":[{"name":"CSS.1: Basic CSS (Exercises Part 2)","url":"https://bootcamp.rocketacademy.co/css/css-1-basic-css"}]},"inClass":{},"postClass":{},"dayIndex":3},"algos":{"type":"algos","preClass":{},"inClass":{},"postClass":{}},"ux":{"type":"ux","preClass":{},"inClass":{},"postClass":{}},"ip":{"type":"ip","ipDue":{},"preClass":{},"inClass":{},"postClass":{}},"projects":{"type":"projects","projectStart":{},"projectDue":{},"preClass":{},"inClass":{},"postClass":{}}}},"30-11-2021":{"courseDate":"30-11-2021","courseWeek":3,"weekDay":1,"dayNumber":2,"meetingDateTimeUTC":"2021-11-30T11:30:00.000Z","courseDay":4,"dateTypes":{"module":"Module 1: Frontend Basics","general":{"type":"general","preClass":{"items":[{"name":"1.7: setInterval","url":"https://bootcamp.rocketacademy.co/1-frontend-basics/1.7-setinterval"},{"name":"1.8: Timer","url":"https://bootcamp.rocketacademy.co/1-frontend-basics/1.8-timer"}]},"inClass":{"items":[{"name":"Review 1 student\'s 1.POCE.3: Match Game"},{"name":"1.ICE.3: setInterval","url":"https://bootcamp.rocketacademy.co/1-frontend-basics/1.ice-in-class-exercises/1.ice.3-setinterval"}]},"postClass":{"items":[{"name":"1.POCE.4: Timer","url":"https://bootcamp.rocketacademy.co/1-frontend-basics/1.poce-post-class-exercises/1.poce.4-timer"}]},"dayIndex":4},"css":{"type":"css","preClass":{"items":[{"name":"CSS.2.1 No Layout","url":"https://bootcamp.rocketacademy.co/css/css.2-layout/css.2.1-no-layout"},{"name":"CSS.2.2 Display Inline Block","url":"https://bootcamp.rocketacademy.co/css/css.2-layout/css.2.2-display-inline-and-block"}]},"inClass":{},"postClass":{},"dayIndex":4},"algos":{"type":"algos","preClass":{},"inClass":{},"postClass":{}},"ux":{"type":"ux","preClass":{},"inClass":{},"postClass":{}},"ip":{"type":"ip","ipDue":{},"preClass":{},"inClass":{},"postClass":{}},"projects":{"type":"projects","projectStart":{},"projectDue":{},"preClass":{},"inClass":{},"postClass":{}}}},"04-12-2021":{"courseDate":"04-12-2021","courseWeek":3,"weekDay":2,"dayNumber":6,"meetingDateTimeUTC":"2021-12-04T02:00:00.000Z","courseDay":5,"dateTypes":{"module":"Module 1: Frontend Basics","general":{"type":"general","preClass":{"items":[{"name":"1.9: Tic Tac Toe","url":"https://bootcamp.rocketacademy.co/1-frontend-basics/1.9-tic-tac-toe"},{"name":"1.10: Multi File Refactor","url":"https://bootcamp.rocketacademy.co/1-frontend-basics/1.10-multi-file-refactor"}]},"inClass":{"items":[{"name":"Review 1 student\'s 1.POCE.4: Timer","url":""}]},"postClass":{"items":[{"name":"1.POCE.5: Tic Tac Toe","url":"https://bootcamp.rocketacademy.co/1-frontend-basics/1.poce-post-class-exercises/1.poce.5-tic-tac-toe"}]},"dayIndex":5},"css":{"type":"css","preClass":{"items":[{"name":"CSS.2.3: Box Model","url":"https://bootcamp.rocketacademy.co/css/css.2-layout/css.2.3-box-model"},{"name":"CSS.2.4: Layout Width","url":"https://bootcamp.rocketacademy.co/css/css.2-layout/css.2.4-layout-fixed-width-and-max-width"}]},"inClass":{},"postClass":{},"dayIndex":5},"algos":{"type":"algos","preClass":{},"inClass":{},"postClass":{}},"ux":{"type":"ux","preClass":{},"inClass":{},"postClass":{}},"ip":{"type":"ip","ipDue":{},"preClass":{},"inClass":{},"postClass":{}},"projects":{"type":"projects","projectStart":{},"projectDue":{},"preClass":{},"inClass":{},"postClass":{}}}},"07-12-2021":{"courseDate":"07-12-2021","courseWeek":4,"weekDay":1,"dayNumber":2,"meetingDateTimeUTC":"2021-12-07T11:30:00.000Z","courseDay":6,"dateTypes":{"module":"Module 1: Frontend Basics","general":{"type":"general","preClass":{"items":[{"name":"1.11: CSS Control with DOM","url":"https://bootcamp.rocketacademy.co/1-frontend-basics/1.11-css-control-with-dom"},{"name":"0.4: JS Object as Tally","url":"https://bootcamp.rocketacademy.co/0-language-and-tooling/0.4-js-object-as-tally"}]},"inClass":{"items":[{"name":"Review 1 student\'s 1.POCE.5: Tic Tac Toe"}]},"postClass":{},"dayIndex":6},"css":{"type":"css","preClass":{"items":[{"name":"CSS.2.5: Display Inline Block","url":"https://bootcamp.rocketacademy.co/css/css.2-layout/css.2.5-display-inline-block"},{"name":"CSS.2.6: Layout Col / Card","url":"https://bootcamp.rocketacademy.co/css/css.2-layout/css.2.6-layout-columns-and-cards"}]},"inClass":{},"postClass":{},"dayIndex":6},"algos":{"type":"algos","preClass":{},"inClass":{},"postClass":{}},"ux":{"type":"ux","preClass":{},"inClass":{},"postClass":{}},"ip":{"type":"ip","ipDue":{},"preClass":{},"inClass":{},"postClass":{}},"projects":{"type":"projects","projectStart":{"items":[{"name":"Start: Project 1 Video Poker","url":"https://bootcamp.rocketacademy.co/projects/project-1-video-poker"}]},"projectDue":{},"preClass":{},"inClass":{},"postClass":{"items":[{"name":"Project 1 Implementation","url":"https://bootcamp.rocketacademy.co/projects/project-1-video-poker"}]},"dayIndex":6}}},"11-12-2021":{"courseDate":"11-12-2021","courseWeek":4,"weekDay":2,"dayNumber":6,"meetingDateTimeUTC":"2021-12-11T02:00:00.000Z","courseDay":7,"dateTypes":{"module":"Module 1: Frontend Basics","general":{"type":"general","preClass":{},"inClass":{},"postClass":{}},"css":{"type":"css","preClass":{"items":[{"name":"CSS.2.7: Position","url":"https://bootcamp.rocketacademy.co/css/css.2-layout/css.2.7-position"},{"name":"CSS.2.8: Float","url":"https://bootcamp.rocketacademy.co/css/css.2-layout/css.2.8-float"}]},"inClass":{"items":[{"name":"1.ICE.CSS.1: Straits Times","url":"https://bootcamp.rocketacademy.co/css/1.ice.css-in-class-css-exercises/1.ice.css.1-straits-times-css"}]},"postClass":{},"dayIndex":7},"algos":{"type":"algos","preClass":{},"inClass":{},"postClass":{}},"ux":{"type":"ux","preClass":{},"inClass":{},"postClass":{}},"ip":{"type":"ip","ipDue":{},"preClass":{},"inClass":{},"postClass":{}},"projects":{"type":"projects","projectStart":{},"projectDue":{},"preClass":{},"inClass":{"items":[{"name":"Project 1 Scrum","url":"https://bootcamp.rocketacademy.co/course-logistics/course-methodology#project-scrums"}]},"postClass":{"items":[{"name":"Project 1 Implementation","url":"https://bootcamp.rocketacademy.co/projects/project-1-video-poker"}]},"dayIndex":7}}},"14-12-2021":{"courseDate":"14-12-2021","courseWeek":5,"weekDay":1,"dayNumber":2,"meetingDateTimeUTC":"2021-12-14T11:30:00.000Z","courseDay":8,"dateTypes":{"module":"Module 1: Frontend Basics","general":{"type":"general","preClass":{"items":[{"name":"2.0: Module 2 Setup","url":"https://bootcamp.rocketacademy.co/2-backend-basics/2.0-module-2-overview"}]},"inClass":{},"postClass":{},"dayIndex":8},"css":{"type":"css","preClass":{"items":[{"name":"CSS.3 Flexbox","url":"https://bootcamp.rocketacademy.co/css/css.3-flexbox"}]},"inClass":{"items":[{"name":"1.ICE.CSS.2: Wikipedia","url":"https://bootcamp.rocketacademy.co/css/1.ice.css-in-class-css-exercises/1.ice.css.2-css-practice-6-wikipedia"}]},"postClass":{},"dayIndex":8},"algos":{"type":"algos","preClass":{},"inClass":{},"postClass":{}},"ux":{"type":"ux","preClass":{},"inClass":{},"postClass":{}},"ip":{"type":"ip","ipDue":{},"preClass":{},"inClass":{},"postClass":{}},"projects":{"type":"projects","projectStart":{},"projectDue":{},"preClass":{},"inClass":{"items":[{"name":"Project 1 Scrum","url":"https://bootcamp.rocketacademy.co/course-logistics/course-methodology#project-scrums"}]},"postClass":{"items":[{"name":"Project 1 Implementation","url":"https://bootcamp.rocketacademy.co/projects/project-1-video-poker"}]},"dayIndex":8}}},"18-12-2021":{"courseDate":"18-12-2021","courseWeek":5,"weekDay":2,"dayNumber":6,"meetingDateTimeUTC":"2021-12-18T02:00:00.000Z","courseDay":9,"dateTypes":{"module":"Module 1: Frontend Basics","general":{"type":"general","preClass":{},"inClass":{},"postClass":{}},"css":{"type":"css","preClass":{"items":[{"name":"CSS.3.1: Flexbox Columns","url":"https://bootcamp.rocketacademy.co/css/css.3-flexbox/css.3.1-flexbox-layout"}]},"inClass":{"items":[{"name":"1.ICE.CSS.4: Etsy","url":"https://bootcamp.rocketacademy.co/css/1.ice.css-in-class-css-exercises/1.ice.css.4-etsy-css"}]},"postClass":{},"dayIndex":9},"algos":{"type":"algos","preClass":{},"inClass":{},"postClass":{}},"ux":{"type":"ux","preClass":{},"inClass":{},"postClass":{}},"ip":{"type":"ip","ipDue":{},"preClass":{},"inClass":{},"postClass":{}},"projects":{"type":"projects","projectStart":{},"projectDue":{},"preClass":{},"inClass":{"items":[{"name":"Project 1 Scrum","url":"https://bootcamp.rocketacademy.co/course-logistics/course-methodology#project-scrums"}]},"postClass":{"items":[{"name":"Project 1 Implementation","url":"https://bootcamp.rocketacademy.co/projects/project-1-video-poker"}]},"dayIndex":9}}},"21-12-2021":{"courseDate":"21-12-2021","courseWeek":6,"weekDay":1,"dayNumber":2,"meetingDateTimeUTC":"2021-12-21T11:30:00.000Z","courseDay":10,"dateTypes":{"module":"Module 1: Frontend Basics","general":{"type":"general","preClass":{},"inClass":{},"postClass":{}},"css":{"type":"css","preClass":{"items":[{"name":"CSS.4 Responsive Design","url":"https://bootcamp.rocketacademy.co/css/css.4-responsive-design"},{"name":"CSS.5: Web Design Basics","url":"https://bootcamp.rocketacademy.co/css/css.5-web-design-basics"}]},"inClass":{},"postClass":{},"dayIndex":10},"algos":{"type":"algos","preClass":{},"inClass":{},"postClass":{}},"ux":{"type":"ux","preClass":{},"inClass":{},"postClass":{}},"ip":{"type":"ip","ipDue":{},"preClass":{},"inClass":{},"postClass":{}},"projects":{"type":"projects","projectStart":{},"projectDue":{},"preClass":{},"inClass":{"items":[{"name":"Project 1 Scrum","url":"https://bootcamp.rocketacademy.co/course-logistics/course-methodology#project-scrums"}]},"postClass":{"items":[{"name":"Project 1 Implementation","url":"https://bootcamp.rocketacademy.co/projects/project-1-video-poker"},{"name":"Project 1: Deploy to GitHub Pages","url":"https://basics.rocketacademy.co/12-next-steps/12.3-deployment"}]},"dayIndex":10}}},"25-12-2021":{"courseDay":null,"courseDate":"25-12-2021","courseWeek":6,"dayNumber":6,"dateTypes":{"holidayType":"public holiday","date":"25-12-2021","location":"SG","name":"Christmas Day"}},"28-12-2021":{"courseDay":null,"courseDate":"28-12-2021","courseWeek":null,"dayNumber":2,"dateTypes":{"holidayType":"company holiday","date":"28-12-2021","location":"SG","name":"winter break"}},"01-01-2022":{"courseDay":null,"courseDate":"01-01-2022","courseWeek":null,"dayNumber":6,"dateTypes":{"holidayType":"company holiday","date":"01-01-2022","location":"SG","name":"winter break"}},"04-01-2022":{"courseDate":"04-01-2022","courseWeek":7,"weekDay":1,"dayNumber":2,"meetingDateTimeUTC":"2022-01-04T11:30:00.000Z","courseDay":11,"dateTypes":{"module":"Module 1: Frontend Basics","general":{"type":"general","preClass":{},"inClass":{},"postClass":{}},"css":{"type":"css","preClass":{},"inClass":{},"postClass":{}},"algos":{"type":"algos","preClass":{},"inClass":{},"postClass":{}},"ux":{"type":"ux","preClass":{},"inClass":{},"postClass":{}},"ip":{"type":"ip","ipDue":{},"preClass":{},"inClass":{},"postClass":{}},"projects":{"type":"projects","projectStart":{},"projectDue":{"items":[{"name":"Due: Project 1 Video Poker","url":"https://bootcamp.rocketacademy.co/projects/project-1-video-poker"}]},"preClass":{"items":[{"name":"Project 1 Implementation","url":"https://bootcamp.rocketacademy.co/projects/project-1-video-poker"}]},"inClass":{"items":[{"name":"Project 1 Presentations","url":"https://bootcamp.rocketacademy.co/projects/project-1-video-poker"}]},"postClass":{"items":[{"name":"Project 1 Post-Mortems","url":"https://bootcamp.rocketacademy.co/course-logistics/course-methodology#project-post-mortem-meeting"}]},"dayIndex":11}}},"08-01-2022":{"courseDate":"08-01-2022","courseWeek":7,"weekDay":2,"dayNumber":6,"meetingDateTimeUTC":"2022-01-08T02:00:00.000Z","courseDay":12,"dateTypes":{"module":"Module 2: Backend Basics","general":{"type":"general","preClass":{"items":[{"name":"2.0: Module 2 Overview","url":"https://bootcamp.rocketacademy.co/2-backend-basics/2.0-module-2-overview"},{"name":"2.1: My First Node.js Program","url":"https://bootcamp.rocketacademy.co/2-backend-basics/2.1-my-first-node-program"},{"name":"2.2: Command Line Programs","url":"https://bootcamp.rocketacademy.co/2-backend-basics/2.2-command-line-programs"}]},"inClass":{"items":[{"name":"2.ICE.1: Conversions","url":"https://bootcamp.rocketacademy.co/2-backend-basics/2.ice-in-class-exercises/2.ice.1-conversions"}]},"postClass":{"items":[{"name":"2.POCE.1: Command Line Colour Converter","url":"https://bootcamp.rocketacademy.co/2-backend-basics/2.poce-post-class-exercises/2.poce.1-command-line-colour-converter"}]},"dayIndex":12},"css":{"type":"css","preClass":{},"inClass":{},"postClass":{"items":[{"name":"1.POCE.6: CSS Flexbox","url":"https://bootcamp.rocketacademy.co/css/1.poce.css-post-class-css-exercises/1.poce.css.1-technical-documentation-page-flexbox-responsive"}]},"dayIndex":12},"algos":{"type":"algos","preClass":{},"inClass":{},"postClass":{}},"ux":{"type":"ux","preClass":{},"inClass":{},"postClass":{}},"ip":{"type":"ip","ipDue":{},"preClass":{},"inClass":{},"postClass":{}},"projects":{"type":"projects","projectStart":{},"projectDue":{},"preClass":{},"inClass":{},"postClass":{}}}},"11-01-2022":{"courseDate":"11-01-2022","courseWeek":8,"weekDay":1,"dayNumber":2,"meetingDateTimeUTC":"2022-01-11T11:30:00.000Z","courseDay":13,"dateTypes":{"module":"Module 2: Backend Basics","general":{"type":"general","preClass":{"items":[{"name":"2.3: Modules","url":"https://bootcamp.rocketacademy.co/2-backend-basics/2.3-modules"},{"name":"2.4: Disk Reading","url":"https://bootcamp.rocketacademy.co/2-backend-basics/2.4-disk-reading"}]},"inClass":{"items":[{"name":"2.ICE.2: Modules, Disk Reading","url":"https://bootcamp.rocketacademy.co/2-backend-basics/2.ice-in-class-exercises/2.ice.2-modules-disk-reading"}]},"postClass":{"items":[{"name":"2.POCE.2: CSS Reader","url":"https://bootcamp.rocketacademy.co/2-backend-basics/2.poce-post-class-exercises/2.poce.2-css-reader"}]},"dayIndex":13},"css":{"type":"css","preClass":{},"inClass":{},"postClass":{}},"algos":{"type":"algos","preClass":{},"inClass":{},"postClass":{}},"ux":{"type":"ux","preClass":{},"inClass":{},"postClass":{}},"ip":{"type":"ip","ipDue":{},"preClass":{},"inClass":{},"postClass":{}},"projects":{"type":"projects","projectStart":{},"projectDue":{},"preClass":{},"inClass":{},"postClass":{}}}},"15-01-2022":{"courseDate":"15-01-2022","courseWeek":8,"weekDay":2,"dayNumber":6,"meetingDateTimeUTC":"2022-01-15T02:00:00.000Z","courseDay":14,"dateTypes":{"module":"Module 2: Backend Basics","general":{"type":"general","projectStart":{},"projectDue":{},"preClass":{"items":[{"name":"2.5: Disk Writing","url":"https://bootcamp.rocketacademy.co/2-backend-basics/2.5-disk-writing"},{"name":"2.6: Disk Altering","url":"https://bootcamp.rocketacademy.co/2-backend-basics/2.6-disk-altering"},{"name":"2.7: Internet 101","url":"https://bootcamp.rocketacademy.co/2-backend-basics/2.7-internet-101"},{"name":"2.8: Chrome Networking","url":"https://bootcamp.rocketacademy.co/2-backend-basics/2.8-chrome-networking"}]},"inClass":{"items":[{"name":"2.ICE.3: Disk Altering","url":"https://bootcamp.rocketacademy.co/2-backend-basics/2.ice-in-class-exercises/2.ice.3-disk-altering"}]},"postClass":{"items":[{"name":"2.POCE.3: CSS Processor","url":"https://bootcamp.rocketacademy.co/2-backend-basics/2.poce-post-class-exercises/2.poce.3-css-processor"}]},"dayIndex":14},"css":{"type":"css","preClass":{},"inClass":{},"postClass":{"items":[{"name":"1.POCE.8: Flexbox Personal Page","url":"https://bootcamp.rocketacademy.co/css/1.poce.css-post-class-css-exercises/1.poce.css.2-flexbox-personal-page"}]},"dayIndex":14},"algos":{"type":"algos","preClass":{},"inClass":{},"postClass":{}},"ux":{"type":"ux","preClass":{},"inClass":{},"postClass":{}},"ip":{"type":"ip","ipDue":{},"preClass":{},"inClass":{},"postClass":{}},"projects":{"type":"projects","projectStart":{},"projectDue":{},"preClass":{},"inClass":{},"postClass":{}}}},"18-01-2022":{"courseDate":"18-01-2022","courseWeek":9,"weekDay":1,"dayNumber":2,"meetingDateTimeUTC":"2022-01-18T11:30:00.000Z","courseDay":15,"dateTypes":{"module":"Module 2: Backend Basics","general":{"type":"general","preClass":{"items":[{"name":"2.9: HTTP Requests and Responses","url":"https://bootcamp.rocketacademy.co/2-backend-basics/2.9-http"},{"name":"2.10: HTTP File Server","url":"https://bootcamp.rocketacademy.co/2-backend-basics/2.10-http-file-server"},{"name":"Install ngrok. We will use it in 2.ICE.4.","url":"https://bootcamp.rocketacademy.co/2-backend-basics/2.0-module-2-overview#ngrok"}]},"inClass":{"items":[{"name":"Review 2.POCE.3: CSS Processor","url":"https://bootcamp.rocketacademy.co/course-logistics/course-methodology#peer-code-review"},{"name":"2.ICE.4: Servers and Requests","url":"https://bootcamp.rocketacademy.co/2-backend-basics/2.ice-in-class-exercises/2.ice.4-servers-and-requests"}]},"postClass":{"items":[{"name":"2.POCE.4: File Server","url":"https://bootcamp.rocketacademy.co/2-backend-basics/2.poce-post-class-exercises/2.poce.4-file-server"}]},"dayIndex":15},"css":{"type":"css","preClass":{"items":[{"name":"CSS.6 Bootstrap","url":"https://bootcamp.rocketacademy.co/css/css.6-bootstrap"}]},"inClass":{},"postClass":{"items":[{"name":"1.POCE.9: Bootstrap","url":"https://bootcamp.rocketacademy.co/css/1.poce.css-post-class-css-exercises/1.poce.css.3-bootstrap-columns"}]},"dayIndex":15},"algos":{"type":"algos","preClass":{},"inClass":{},"postClass":{}},"ux":{"type":"ux","preClass":{},"inClass":{},"postClass":{}},"ip":{"type":"ip","ipDue":{},"preClass":{},"inClass":{},"postClass":{}},"projects":{"type":"projects","projectStart":{},"projectDue":{},"preClass":{},"inClass":{},"postClass":{}}}},"22-01-2022":{"courseDate":"22-01-2022","courseWeek":9,"weekDay":2,"dayNumber":6,"meetingDateTimeUTC":"2022-01-22T02:00:00.000Z","courseDay":16,"dateTypes":{"module":"Module 2: Backend Basics","general":{"type":"general","preClass":{"items":[{"name":"2.11: Deploy Server to Cloud","url":"https://bootcamp.rocketacademy.co/2-backend-basics/2.11-deploy-server-to-cloud"},{"name":"2.12: Domain Names","url":"https://bootcamp.rocketacademy.co/2-backend-basics/2.12-domain-names"},{"name":"2.13: JSON","url":"https://bootcamp.rocketacademy.co/2-backend-basics/2.13-json"},{"name":"2.13.1: JSON File Storage Module - Add, Read, Write","url":"https://bootcamp.rocketacademy.co/2-backend-basics/2.13-json/2.13.1-json-file-storage-module-add-read-write"}]},"inClass":{"items":[{"name":"2.ICE.5: Reading and Writing to JSON","url":"https://bootcamp.rocketacademy.co/2-backend-basics/2.ice-in-class-exercises/2.ice.5-json-cards"}]},"postClass":{"items":[{"name":"2.POCE.5: Responsive Noodle Site","url":"https://bootcamp.rocketacademy.co/2-backend-basics/2.poce-post-class-exercises/2.poce.5-responsive-noodle-site"}]},"dayIndex":16},"css":{"type":"css","preClass":{},"inClass":{},"postClass":{}},"algos":{"type":"algos","preClass":{},"inClass":{},"postClass":{}},"ux":{"type":"ux","preClass":{},"inClass":{},"postClass":{}},"ip":{"type":"ip","ipDue":{},"preClass":{},"inClass":{},"postClass":{}},"projects":{"type":"projects","projectStart":{},"projectDue":{},"preClass":{},"inClass":{},"postClass":{}}}},"25-01-2022":{"courseDate":"25-01-2022","courseWeek":10,"weekDay":1,"dayNumber":2,"meetingDateTimeUTC":"2022-01-25T11:30:00.000Z","courseDay":17,"dateTypes":{"module":"Module 2: Backend Basics","general":{"type":"general","preClass":{"items":[{"name":"2.13.2: JSON File Storage Module - Passing Callbacks","url":"https://bootcamp.rocketacademy.co/2-backend-basics/2.13-json/2.13.2-json-file-storage-module-passing-callbacks"},{"name":"2.13.3: JSON File Storage Module - Summary","url":"https://bootcamp.rocketacademy.co/2-backend-basics/2.13-json/2.13.3-json-file-storage-module-summary"},{"name":"2.14: NPM","url":"https://bootcamp.rocketacademy.co/2-backend-basics/2.14-npm"}]},"inClass":{"items":[{"name":"2.ICE.6: NPM, JSON File Storage","url":"https://bootcamp.rocketacademy.co/2-backend-basics/2.ice-in-class-exercises/2.ice.6-npm-json-file-storage"}]},"postClass":{"items":[{"name":"2.POCE.6: To-Do List - JSON","url":"https://bootcamp.rocketacademy.co/2-backend-basics/2.poce-post-class-exercises/2.poce.6-todo-list-json"}]},"dayIndex":17},"css":{"type":"css","preClass":{},"inClass":{},"postClass":{"items":[{"name":"1.POCE.10: Bootstrap Adobe","url":"https://bootcamp.rocketacademy.co/css/1.poce.css-post-class-css-exercises/1.poce.css.4-bootstrap-adobe"}]},"dayIndex":17},"algos":{"type":"algos","preClass":{},"inClass":{},"postClass":{}},"ux":{"type":"ux","preClass":{},"inClass":{},"postClass":{}},"ip":{"type":"ip","ipDue":{},"preClass":{},"inClass":{},"postClass":{}},"projects":{"type":"projects","projectStart":{},"projectDue":{},"preClass":{},"inClass":{},"postClass":{}}}},"29-01-2022":{"courseDate":"29-01-2022","courseWeek":10,"weekDay":2,"dayNumber":6,"meetingDateTimeUTC":"2022-01-29T02:00:00.000Z","courseDay":18,"dateTypes":{"module":"Module 2: Backend Basics","general":{"type":"general","preClass":{"items":[{"name":"0.2.2: ES6 Array Iterators","url":"https://bootcamp.rocketacademy.co/0-language-and-tooling/0.2-es6/0.2.2-es6-array-iterators"},{"name":"0.5.1: Git Pull","url":"https://bootcamp.rocketacademy.co/0-language-and-tooling/0.5-advanced-git/0.5.1-git-pull"},{"name":"0.5.2: Git Branches","url":"https://bootcamp.rocketacademy.co/0-language-and-tooling/0.5-advanced-git/0.5.2-git-branches"}]},"inClass":{"items":[{"name":"0.ICE.1: Git Branches","url":"https://bootcamp.rocketacademy.co/0-language-and-tooling/0.ice-in-class-exercises/0.ice.1-git-branches"}]},"postClass":{"items":[{"name":"2.POCE.6: To-Do List - JSON","url":"https://bootcamp.rocketacademy.co/2-backend-basics/2.poce-post-class-exercises/2.poce.6-todo-list-json"}]},"dayIndex":18},"css":{"type":"css","preClass":{},"inClass":{"items":[{"name":"1.POCE.10: Bootstrap Adobe","url":"https://bootcamp.rocketacademy.co/css/1.poce.css-post-class-css-exercises/1.poce.css.4-bootstrap-adobe"}]},"postClass":{},"dayIndex":18},"algos":{"type":"algos","preClass":{},"inClass":{},"postClass":{}},"ux":{"type":"ux","preClass":{},"inClass":{},"postClass":{}},"ip":{"type":"ip","ipDue":{},"preClass":{},"inClass":{},"postClass":{}},"projects":{"type":"projects","projectStart":{},"projectDue":{},"preClass":{},"inClass":{},"postClass":{}}}},"01-02-2022":{"courseDay":null,"courseDate":"01-02-2022","courseWeek":11,"dayNumber":2,"dateTypes":{"holidayType":"public holiday","date":"01-02-2022","location":"SG","name":"Chinese New Year Day 1"}},"05-02-2022":{"courseDate":"05-02-2022","courseWeek":11,"weekDay":1,"dayNumber":6,"meetingDateTimeUTC":"2022-02-05T02:00:00.000Z","courseDay":19,"dateTypes":{"module":"Module 3: Backend Applications","general":{"type":"general","projectStart":{},"projectDue":{},"preClass":{"items":[{"name":"3.0: Overview","url":"https://bootcamp.rocketacademy.co/3-backend-applications/3.0-module-3-overview"},{"name":"3.1: Express.js","url":"https://bootcamp.rocketacademy.co/3-backend-applications/3.1-express-js"},{"name":"3.1.1: Express with JSON DB","url":"https://bootcamp.rocketacademy.co/3-backend-applications/3.1-express-js/3.1.1-express-with-json-db"}]},"inClass":{"items":[{"name":"3.ICE.1: Bigfoot","url":"https://bootcamp.rocketacademy.co/3-backend-applications/3.ice-in-class-exercises/3.ice.1-bigfoot"}]},"postClass":{"items":[{"name":"3.POCE.1: Express Noodle App","url":"https://bootcamp.rocketacademy.co/3-backend-applications/3.poce-post-class-exercises/3.poce.1-express-noodle-app"}]},"dayIndex":19},"css":{"type":"css","preClass":{},"inClass":{},"postClass":{}},"algos":{"type":"algos","preClass":{},"inClass":{},"postClass":{}},"ux":{"type":"ux","preClass":{},"inClass":{},"postClass":{}},"ip":{"type":"ip","ipDue":{},"preClass":{},"inClass":{},"postClass":{}},"projects":{"type":"projects","projectStart":{},"projectDue":{},"preClass":{},"inClass":{},"postClass":{}}}},"08-02-2022":{"courseDate":"08-02-2022","courseWeek":12,"weekDay":1,"dayNumber":2,"meetingDateTimeUTC":"2022-02-08T11:30:00.000Z","courseDay":20,"dateTypes":{"module":"Module 3: Backend Applications","general":{"type":"general","projectStart":{},"projectDue":{},"preClass":{"items":[{"name":"0.2.3: ES6 Destructuring, Spread Operators","url":"https://bootcamp.rocketacademy.co/0-language-and-tooling/0.2-es6/0.2.3-es6-destructuring-spread-operators"},{"name":"0.6: Nodemon","url":"https://bootcamp.rocketacademy.co/0-language-and-tooling/0.6-nodemon"},{"name":"3.2: EJS","url":"https://bootcamp.rocketacademy.co/3-backend-applications/3.2-ejs"}]},"inClass":{"items":[{"name":"3.ICE.2: Bigfoot EJS","url":"https://bootcamp.rocketacademy.co/3-backend-applications/3.ice-in-class-exercises/3.ice.2-bigfoot-ejs"}]},"postClass":{"items":[{"name":"3.POCE.2: Express, EJS Noodle App","url":"https://bootcamp.rocketacademy.co/3-backend-applications/3.poce-post-class-exercises/3.poce.2-express-ejs-noodle-app"}]},"dayIndex":20},"css":{"type":"css","preClass":{},"inClass":{},"postClass":{}},"algos":{"type":"algos","preClass":{},"inClass":{},"postClass":{}},"ux":{"type":"ux","preClass":{},"inClass":{},"postClass":{}},"ip":{"type":"ip","ipDue":{},"preClass":{},"inClass":{},"postClass":{}},"projects":{"type":"projects","projectStart":{},"projectDue":{},"preClass":{},"inClass":{},"postClass":{}}}},"12-02-2022":{"courseDate":"12-02-2022","courseWeek":12,"weekDay":2,"dayNumber":6,"meetingDateTimeUTC":"2022-02-12T02:00:00.000Z","courseDay":21,"dateTypes":{"module":"Module 3: Backend Applications","general":{"type":"general","projectStart":{},"projectDue":{},"preClass":{"items":[{"name":"3.1.2: HTML Forms","url":"https://bootcamp.rocketacademy.co/3-backend-applications/3.1-express-js/3.1.2-html-forms"},{"name":"3.1.3: Handling POST Requests","url":"https://bootcamp.rocketacademy.co/3-backend-applications/3.1-express-js/3.1.3-handling-post-requests"},{"name":"3.2.2: EJS Conditionals","url":"https://bootcamp.rocketacademy.co/3-backend-applications/3.2-ejs/3.2.2-ejs-conditionals"},{"name":"0.7: Thunder Client","url":"https://bootcamp.rocketacademy.co/0-language-and-tooling/0.7-postman"}]},"inClass":{"items":[{"name":"3.ICE.3: Bigfoot POST","url":"https://bootcamp.rocketacademy.co/3-backend-applications/3.ice-in-class-exercises/3.ice.3-bigfoot-post"}]},"postClass":{"items":[{"name":"3.POCE.3: UFO Sightings","url":"https://bootcamp.rocketacademy.co/3-backend-applications/3.poce-post-class-exercises/3.poce.3-express-ufos"}]},"dayIndex":21},"css":{"type":"css","preClass":{},"inClass":{},"postClass":{}},"algos":{"type":"algos","preClass":{},"inClass":{},"postClass":{}},"ux":{"type":"ux","preClass":{},"inClass":{},"postClass":{}},"ip":{"type":"ip","ipDue":{},"preClass":{},"inClass":{},"postClass":{}},"projects":{"type":"projects","projectStart":{},"projectDue":{},"preClass":{},"inClass":{},"postClass":{}}}},"15-02-2022":{"courseDate":"15-02-2022","courseWeek":13,"weekDay":1,"dayNumber":2,"meetingDateTimeUTC":"2022-02-15T11:30:00.000Z","courseDay":22,"dateTypes":{"module":"Module 3: Backend Applications","general":{"type":"general","preClass":{"items":[{"name":"3.1.4: PUT, DELETE Requests","url":"https://bootcamp.rocketacademy.co/3-backend-applications/3.1-express-js/3.1.4-put-delete-requests"}]},"inClass":{"items":[{"name":"Scrum","url":"https://bootcamp.rocketacademy.co/course-logistics/course-methodology#project-scrums"}]},"postClass":{"items":[{"name":"3.POCE.3: UFO Sightings","url":"https://bootcamp.rocketacademy.co/3-backend-applications/3.poce-post-class-exercises/3.poce.3-express-ufos"}]},"dayIndex":22},"css":{"type":"css","preClass":{},"inClass":{},"postClass":{}},"algos":{"type":"algos","preClass":{},"inClass":{},"postClass":{}},"ux":{"type":"ux","preClass":{},"inClass":{},"postClass":{}},"ip":{"type":"ip","ipDue":{},"preClass":{},"inClass":{},"postClass":{}},"projects":{"type":"projects","projectStart":{},"projectDue":{},"preClass":{},"inClass":{},"postClass":{}}}},"19-02-2022":{"courseDate":"19-02-2022","courseWeek":13,"weekDay":2,"dayNumber":6,"meetingDateTimeUTC":"2022-02-19T02:00:00.000Z","courseDay":23,"dateTypes":{"module":"Module 3: Backend Applications","general":{"type":"general","projectStart":{},"projectDue":{},"preClass":{"items":[{"name":"3.2.3: EJS Partials","url":"https://bootcamp.rocketacademy.co/3-backend-applications/3.2-ejs/3.2.3-advanced-ejs"}]},"inClass":{"items":[{"name":"Scrum","url":"https://bootcamp.rocketacademy.co/course-logistics/course-methodology#project-scrums"},{"name":"1.ICE.7: CSS Practice 1 - MyTunes","url":"https://bootcamp.rocketacademy.co/1-frontend-basics/1.ice-in-class-exercises/1.ice.7-css-practice-1-mytunes"}]},"postClass":{"items":[{"name":"3.POCE.3: UFO Sightings","url":"https://bootcamp.rocketacademy.co/3-backend-applications/3.poce-post-class-exercises/3.poce.3-express-ufos"}]},"dayIndex":23},"css":{"type":"css","preClass":{},"inClass":{"items":[{"name":"1.ICE.CSS.4: MyTunes","url":"https://bootcamp.rocketacademy.co/css/1.ice.css-in-class-css-exercises/1.ice.css.3-mytunes"}]},"postClass":{},"dayIndex":23},"algos":{"type":"algos","preClass":{},"inClass":{},"postClass":{}},"ux":{"type":"ux","preClass":{},"inClass":{},"postClass":{}},"ip":{"type":"ip","ipDue":{},"preClass":{},"inClass":{},"postClass":{}},"projects":{"type":"projects","projectStart":{},"projectDue":{},"preClass":{},"inClass":{},"postClass":{}}}},"22-02-2022":{"courseDate":"22-02-2022","courseWeek":14,"weekDay":1,"dayNumber":2,"meetingDateTimeUTC":"2022-02-22T11:30:00.000Z","courseDay":24,"dateTypes":{"module":"Module 3: Backend Applications","general":{"type":"general","preClass":{"items":[{"name":"3.3: SQL Language","url":"https://bootcamp.rocketacademy.co/3-backend-applications/3.3-sql-language"},{"name":"3.3.1: Basic SQL Commands","url":"https://bootcamp.rocketacademy.co/3-backend-applications/3.3-sql-language/3.3.1-basic-sql-commands"},{"name":"3.5.1: Cookies","url":"https://bootcamp.rocketacademy.co/3-backend-applications/3.5-authentication/3.5.1-cookies"}]},"inClass":{"items":[{"name":"Scrum","url":"https://bootcamp.rocketacademy.co/course-logistics/course-methodology#project-scrums"},{"name":"3.ICE.4: Cookies","url":"https://bootcamp.rocketacademy.co/3-backend-applications/3.ice-in-class-exercises/3.ice.4-cookies"}]},"postClass":{"items":[{"name":"3.POCE.3: UFO Sightings","url":"https://bootcamp.rocketacademy.co/3-backend-applications/3.poce-post-class-exercises/3.poce.3-express-ufos"}]},"dayIndex":24},"css":{"type":"css","preClass":{},"inClass":{"items":[{"name":"1.ICE.CSS.4: MyTunes","url":"https://bootcamp.rocketacademy.co/css/1.ice.css-in-class-css-exercises/1.ice.css.3-mytunes"}]},"postClass":{},"dayIndex":24},"algos":{"type":"algos","preClass":{},"inClass":{},"postClass":{}},"ux":{"type":"ux","preClass":{},"inClass":{},"postClass":{}},"ip":{"type":"ip","ipDue":{},"preClass":{},"inClass":{},"postClass":{}},"projects":{"type":"projects","projectStart":{},"projectDue":{},"preClass":{},"inClass":{},"postClass":{}}}},"26-02-2022":{"courseDate":"26-02-2022","courseWeek":14,"weekDay":2,"dayNumber":6,"meetingDateTimeUTC":"2022-02-26T02:00:00.000Z","courseDay":25,"dateTypes":{"module":"Module 3: Backend Applications","general":{"type":"general","preClass":{"items":[{"name":"3.4: SQL Applications","url":"https://bootcamp.rocketacademy.co/3-backend-applications/3.4-sql-applications"},{"name":"3.4.1: PostgreSQL, psql","url":"https://bootcamp.rocketacademy.co/3-backend-applications/3.4-sql-applications/3.4.1-postgresql-psql"},{"name":"3.4.2: PostgreSQL Node App","url":"https://bootcamp.rocketacademy.co/3-backend-applications/3.4-sql-applications/3.4.2-postgresql-node-app"}]},"inClass":{"items":[{"name":"Project Presentation: 3.POCE.3","url":"https://bootcamp.rocketacademy.co/course-logistics/course-methodology#project-presentations"}]},"postClass":{"items":[{"name":"3.POCE.4: Meal Tracker","url":"https://bootcamp.rocketacademy.co/3-backend-applications/3.poce-post-class-exercises/3.poce.4-sql-meal-keeper"}]},"dayIndex":25},"css":{"type":"css","preClass":{},"inClass":{},"postClass":{}},"algos":{"type":"algos","preClass":{},"inClass":{},"postClass":{}},"ux":{"type":"ux","preClass":{},"inClass":{},"postClass":{}},"ip":{"type":"ip","ipDue":{},"preClass":{},"inClass":{},"postClass":{}},"projects":{"type":"projects","projectStart":{},"projectDue":{},"preClass":{},"inClass":{},"postClass":{}}}},"01-03-2022":{"courseDate":"01-03-2022","courseWeek":15,"weekDay":1,"dayNumber":2,"meetingDateTimeUTC":"2022-03-01T11:30:00.000Z","courseDay":26,"dateTypes":{"module":"Module 3: Backend Applications","general":{"type":"general","preClass":{"items":[{"name":"3.3.2: SQL Relationships (One to Many)","url":"https://bootcamp.rocketacademy.co/3-backend-applications/3.3-sql-language/3.3.2-sql-relationships-one-to-many"},{"name":"3.4.3: Nested SQL Queries","url":"https://bootcamp.rocketacademy.co/3-backend-applications/3.4-sql-applications/3.4.3-nested-sql-queries"},{"name":"3.4.4: PostgreSQL Express App","url":"https://bootcamp.rocketacademy.co/3-backend-applications/3.4-sql-applications/3.4.4-postgresql-express-app"}]},"inClass":{"items":[{"name":"3.ICE.5: One to Many","url":"https://bootcamp.rocketacademy.co/3-backend-applications/3.ice-in-class-exercises/3.ice.5-one-to-many"}]},"postClass":{"items":[{"name":"3.POCE.5: Bird Watching","url":"https://bootcamp.rocketacademy.co/3-backend-applications/3.poce-post-class-exercises/3.poce.5-bird-watching"}]},"dayIndex":26},"css":{"type":"css","preClass":{},"inClass":{},"postClass":{}},"algos":{"type":"algos","preClass":{},"inClass":{},"postClass":{}},"ux":{"type":"ux","preClass":{},"inClass":{},"postClass":{}},"ip":{"type":"ip","ipDue":{},"preClass":{},"inClass":{},"postClass":{}},"projects":{"type":"projects","projectStart":{},"projectDue":{},"preClass":{},"inClass":{},"postClass":{}}}},"05-03-2022":{"courseDate":"05-03-2022","courseWeek":15,"weekDay":2,"dayNumber":6,"meetingDateTimeUTC":"2022-03-05T02:00:00.000Z","courseDay":27,"dateTypes":{"module":"Module 3: Backend Applications","general":{"type":"general","preClass":{"items":[{"name":"3.3.4: Inner Join","url":"https://bootcamp.rocketacademy.co/3-backend-applications/3.3-sql-language/3.3.4-inner-join"},{"name":"3.5.2: User Auth","url":"https://bootcamp.rocketacademy.co/3-backend-applications/3.5-authentication/3.5.2-user-auth"}]},"inClass":{"items":[{"name":"3.ICE.6: Inner Joins","url":"https://bootcamp.rocketacademy.co/3-backend-applications/3.ice-in-class-exercises/3.ice.6-inner-join"}]},"postClass":{"items":[{"name":"3.POCE.6: Bird Watching Users","url":"https://bootcamp.rocketacademy.co/3-backend-applications/3.poce-post-class-exercises/3.poce.6-bird-watching-users"}]},"dayIndex":27},"css":{"type":"css","preClass":{},"inClass":{},"postClass":{}},"algos":{"type":"algos","preClass":{},"inClass":{},"postClass":{}},"ux":{"type":"ux","preClass":{},"inClass":{},"postClass":{}},"ip":{"type":"ip","ipDue":{},"preClass":{},"inClass":{},"postClass":{}},"projects":{"type":"projects","projectStart":{},"projectDue":{},"preClass":{},"inClass":{},"postClass":{}}}},"08-03-2022":{"courseDate":"08-03-2022","courseWeek":16,"weekDay":1,"dayNumber":2,"meetingDateTimeUTC":"2022-03-08T11:30:00.000Z","courseDay":28,"dateTypes":{"module":"Module 3: Backend Applications","general":{"type":"general","preClass":{"items":[{"name":"3.3.3: SQL Relationships (Many to Many)","url":"https://bootcamp.rocketacademy.co/3-backend-applications/3.3-sql-language/3.3.3-sql-relationships-many-to-many"},{"name":"3.4.5: Forms for One-to-Many Relationships","url":"https://bootcamp.rocketacademy.co/3-backend-applications/3.4-sql-applications/3.4.5-forms-for-one-to-many-relationships"},{"name":"3.5.3: Password Hashing","url":"https://bootcamp.rocketacademy.co/3-backend-applications/3.5-authentication/3.5.3-password-hashing"}]},"inClass":{"items":[{"name":"3.ICE.7: Many-to-Many","url":"https://bootcamp.rocketacademy.co/3-backend-applications/3.ice-in-class-exercises/3.ice.7-many-to-many"}]},"postClass":{"items":[{"name":"3.POCE.7: Bird Watching Species","url":"https://bootcamp.rocketacademy.co/3-backend-applications/3.poce-post-class-exercises/3.poce.7-bird-watching-species"}]},"dayIndex":28},"css":{"type":"css","preClass":{},"inClass":{},"postClass":{}},"algos":{"type":"algos","preClass":{},"inClass":{},"postClass":{}},"ux":{"type":"ux","preClass":{},"inClass":{},"postClass":{}},"ip":{"type":"ip","ipDue":{},"preClass":{},"inClass":{},"postClass":{}},"projects":{"type":"projects","projectStart":{},"projectDue":{},"preClass":{},"inClass":{},"postClass":{}}}},"12-03-2022":{"courseDate":"12-03-2022","courseWeek":16,"weekDay":2,"dayNumber":6,"meetingDateTimeUTC":"2022-03-12T02:00:00.000Z","courseDay":29,"dateTypes":{"module":"Module 3: Backend Applications","general":{"type":"general","preClass":{"items":[{"name":"3.3.5: Non-FK Relationship Data in Join Table","url":"https://bootcamp.rocketacademy.co/3-backend-applications/3.3-sql-language/3.3.5-non-fk-relationship-data-in-join-table"},{"name":"3.4.6: Forms for Many-to-Many Relationships","url":"https://bootcamp.rocketacademy.co/3-backend-applications/3.4-sql-applications/3.4.6-forms-for-many-to-many-relationships"},{"name":"3.5.4: Session Hashing","url":"https://bootcamp.rocketacademy.co/3-backend-applications/3.5-authentication/3.5.4-session-hashing"}]},"inClass":{"items":[{"name":"3.ICE.8: Multiple Foreign Keys","url":"https://bootcamp.rocketacademy.co/3-backend-applications/3.ice-in-class-exercises/3.ice.8-multi-foreign-key"}]},"postClass":{"items":[{"name":"3.POCE.8: Bird Watching Behaviour","url":"https://bootcamp.rocketacademy.co/3-backend-applications/3.poce-post-class-exercises/3.poce.8-bird-watching-behaviour"}]},"dayIndex":29},"css":{"type":"css","preClass":{},"inClass":{},"postClass":{}},"algos":{"type":"algos","preClass":{},"inClass":{},"postClass":{}},"ux":{"type":"ux","preClass":{},"inClass":{},"postClass":{}},"ip":{"type":"ip","ipDue":{},"preClass":{},"inClass":{},"postClass":{}},"projects":{"type":"projects","projectStart":{},"projectDue":{},"preClass":{},"inClass":{},"postClass":{}}}},"15-03-2022":{"courseDate":"15-03-2022","courseWeek":17,"weekDay":1,"dayNumber":2,"meetingDateTimeUTC":"2022-03-15T11:30:00.000Z","courseDay":30,"dateTypes":{"module":"Module 3: Backend Applications","general":{"type":"general","preClass":{"items":[{"name":"3.3.6: SQL Schema Design","url":"https://bootcamp.rocketacademy.co/3-backend-applications/3.3-sql-language/3.3.6-sql-schema-design"}]},"inClass":{"items":[{"name":"3.ICE.9: DB Schema Design - Carousell","url":"https://bootcamp.rocketacademy.co/3-backend-applications/3.ice-in-class-exercises/3.ice.9-db-schema-design-carousell"}]},"postClass":{"items":[{"name":"3.POCE.9: Bird Watching Comments","url":"https://bootcamp.rocketacademy.co/3-backend-applications/3.poce-post-class-exercises/3.poce.9-bird-watching-comments"},{"name":"3.POCE.10: EC2 Deployment with Postgres","url":"https://bootcamp.rocketacademy.co/3-backend-applications/3.poce-post-class-exercises/3.poce.10-ec2-deployment-with-postgres"}]},"dayIndex":30},"css":{"type":"css","preClass":{},"inClass":{},"postClass":{}},"algos":{"type":"algos","preClass":{},"inClass":{},"postClass":{}},"ux":{"type":"ux","preClass":{},"inClass":{},"postClass":{}},"ip":{"type":"ip","ipDue":{},"preClass":{},"inClass":{},"postClass":{}},"projects":{"type":"projects","projectStart":{},"projectDue":{},"preClass":{},"inClass":{},"postClass":{"items":[{"name":"Project 2 Ideation Phase 1","url":"https://bootcamp.rocketacademy.co/projects/project-2-server-side-app#ideation-phase-1"}]},"dayIndex":30}}},"19-03-2022":{"courseDate":"19-03-2022","courseWeek":17,"weekDay":2,"dayNumber":6,"meetingDateTimeUTC":"2022-03-19T02:00:00.000Z","courseDay":31,"dateTypes":{"module":"Module 3: Backend Applications","general":{"type":"general","preClass":{"items":[{"name":"0.8: JS Promises","url":"https://bootcamp.rocketacademy.co/0-language-and-tooling/0.8-js-promises"},{"name":"0.8.1: Promise.prototype.catch, Promise.all","url":"https://bootcamp.rocketacademy.co/0-language-and-tooling/0.8-js-promises/0.8.1-promise.prototype.catch-promise.all"},{"name":"3.4.7: pg Promises","url":"https://bootcamp.rocketacademy.co/3-backend-applications/3.4-sql-applications/3.4.7-pg-promises"},{"name":"3.4.8: SQL Clients","url":"https://bootcamp.rocketacademy.co/3-backend-applications/3.4-sql-applications/3.4.8-sql-clients"}]},"inClass":{"items":[{"name":"3.ICE.10: Bird Watching Redux","url":"https://bootcamp.rocketacademy.co/3-backend-applications/3.ice-in-class-exercises/3.ice.10-bird-watching-redux"}]},"postClass":{},"dayIndex":31},"css":{"type":"css","preClass":{},"inClass":{},"postClass":{}},"algos":{"type":"algos","preClass":{},"inClass":{},"postClass":{}},"ux":{"type":"ux","preClass":{},"inClass":{},"postClass":{}},"ip":{"type":"ip","ipDue":{},"preClass":{},"inClass":{},"postClass":{}},"projects":{"type":"projects","projectStart":{},"projectDue":{},"preClass":{},"inClass":{},"postClass":{"items":[{"name":"Project 2 Ideation Phase 1","url":"https://bootcamp.rocketacademy.co/projects/project-2-server-side-app#ideation-phase-1"}]},"dayIndex":31}}},"22-03-2022":{"courseDate":"22-03-2022","courseWeek":18,"weekDay":1,"dayNumber":2,"meetingDateTimeUTC":"2022-03-22T11:30:00.000Z","courseDay":32,"dateTypes":{"module":"Module 3: Backend Applications","general":{"type":"general","preClass":{"items":[{"name":"3.4.9: Database Setup Files","url":"https://bootcamp.rocketacademy.co/3-backend-applications/3.4-sql-applications/3.4.9-database-setup-files"},{"name":"3.5.5: Custom Middleware for Authentication","url":"https://bootcamp.rocketacademy.co/3-backend-applications/3.5-authentication/3.5.5-custom-middleware-for-authentication"}]},"inClass":{},"postClass":{},"dayIndex":32},"css":{"type":"css","preClass":{},"inClass":{},"postClass":{}},"algos":{"type":"algos","preClass":{},"inClass":{},"postClass":{}},"ux":{"type":"ux","preClass":{},"inClass":{},"postClass":{}},"ip":{"type":"ip","ipDue":{},"preClass":{},"inClass":{},"postClass":{}},"projects":{"type":"projects","projectStart":{"items":[{"name":"Start: Project 2 Ideation Phase 2","url":"https://bootcamp.rocketacademy.co/projects/project-2-server-side-app#ideation-phase-2"}]},"projectDue":{},"preClass":{},"inClass":{},"postClass":{"items":[{"name":"Project 2 Ideation Phase 2","url":"https://bootcamp.rocketacademy.co/projects/project-2-server-side-app#ideation-phase-2"}]},"dayIndex":32}}},"26-03-2022":{"courseDate":"26-03-2022","courseWeek":18,"weekDay":2,"dayNumber":6,"meetingDateTimeUTC":"2022-03-26T02:00:00.000Z","courseDay":33,"dateTypes":{"module":"Module 3: Backend Applications","general":{"type":"general","preClass":{"items":[{"name":"3.4.10: Dates in SQL and JS","url":"https://bootcamp.rocketacademy.co/3-backend-applications/3.4-sql-applications/3.4.10-dates-in-sql-and-js"}]},"inClass":{"items":[{"name":"3.ICE.11: DB Schema Design - Uber","url":"https://bootcamp.rocketacademy.co/3-backend-applications/3.ice-in-class-exercises/3.ice.11-db-schema-design-uber"}]},"postClass":{},"dayIndex":33},"css":{"type":"css","preClass":{},"inClass":{},"postClass":{}},"algos":{"type":"algos","preClass":{},"inClass":{},"postClass":{}},"ux":{"type":"ux","preClass":{},"inClass":{},"postClass":{}},"ip":{"type":"ip","ipDue":{},"preClass":{},"inClass":{},"postClass":{}},"projects":{"type":"projects","projectStart":{},"projectDue":{},"preClass":{},"inClass":{},"postClass":{"items":[{"name":"Project 2 Ideation Phase 2","url":"https://bootcamp.rocketacademy.co/projects/project-2-server-side-app#ideation-phase-2"}]},"dayIndex":33}}},"29-03-2022":{"courseDate":"29-03-2022","courseWeek":19,"weekDay":1,"dayNumber":2,"meetingDateTimeUTC":"2022-03-29T11:30:00.000Z","courseDay":34,"dateTypes":{"module":"Module 3: Backend Applications","general":{"type":"general","projectStart":{},"projectDue":{},"preClass":{"items":[{"name":"3.4.11: File Uploads","url":"https://bootcamp.rocketacademy.co/3-backend-applications/3.4-sql-applications/3.4.11-file-uploads"}]},"inClass":{"items":[{"name":"3.ICE.12: DB Schema Design - Instagram","url":"https://bootcamp.rocketacademy.co/3-backend-applications/3.ice-in-class-exercises/3.ice.12-db-schema-design-instagram"}]},"postClass":{},"dayIndex":34},"css":{"type":"css","preClass":{},"inClass":{},"postClass":{}},"algos":{"type":"algos","preClass":{},"inClass":{},"postClass":{}},"ux":{"type":"ux","preClass":{},"inClass":{},"postClass":{}},"ip":{"type":"ip","ipDue":{},"preClass":{},"inClass":{},"postClass":{}},"projects":{"type":"projects","projectStart":{"items":[{"name":"Start: Project 2 Start","url":"https://bootcamp.rocketacademy.co/projects/project-2-server-side-app"}]},"projectDue":{"items":[{"name":"Due: Project 2 Ideation Phase 2","url":"https://bootcamp.rocketacademy.co/projects/project-2-server-side-app#ideation-phase-2"}]},"preClass":{},"inClass":{"items":[{"name":"Project 2 Peer Planning Review","url":"https://bootcamp.rocketacademy.co/projects/project-2-server-side-app#ideation-phase-2"}]},"postClass":{},"dayIndex":34}}},"02-04-2022":{"courseDate":"02-04-2022","courseWeek":19,"weekDay":2,"dayNumber":6,"meetingDateTimeUTC":"2022-04-02T02:00:00.000Z","courseDay":35,"dateTypes":{"module":"Module 3: Backend Applications","general":{"type":"general","preClass":{},"inClass":{},"postClass":{}},"css":{"type":"css","preClass":{},"inClass":{"items":[{"name":"1.ICE.CSS.5: Restaurant","url":"https://bootcamp.rocketacademy.co/css/1.ice.css-in-class-css-exercises/1.ice.css.5-trombones"}]},"postClass":{},"dayIndex":35},"algos":{"type":"algos","preClass":{},"inClass":{},"postClass":{}},"ux":{"type":"ux","preClass":{},"inClass":{},"postClass":{}},"ip":{"type":"ip","ipDue":{},"preClass":{},"inClass":{},"postClass":{}},"projects":{"type":"projects","projectStart":{},"projectDue":{},"preClass":{},"inClass":{"items":[{"name":"Project 2 Scrum","url":"https://bootcamp.rocketacademy.co/course-logistics/course-methodology#project-scrums"}]},"postClass":{"items":[{"name":"Project 2 Instructor 1-1s","url":"https://bootcamp.rocketacademy.co/projects/project-2-server-side-app#ideation-phase-2"},{"name":"Project 2 Implementation","url":"https://bootcamp.rocketacademy.co/projects/project-2-server-side-app#recommended-order-of-implementation"}]},"dayIndex":35}}},"05-04-2022":{"courseDate":"05-04-2022","courseWeek":20,"weekDay":1,"dayNumber":2,"meetingDateTimeUTC":"2022-04-05T11:30:00.000Z","courseDay":36,"dateTypes":{"module":"Module 3: Backend Applications","general":{"type":"general","preClass":{},"inClass":{},"postClass":{}},"css":{"type":"css","preClass":{},"inClass":{},"postClass":{}},"algos":{"type":"algos","preClass":{},"inClass":{},"postClass":{}},"ux":{"type":"ux","preClass":{},"inClass":{},"postClass":{}},"ip":{"type":"ip","ipDue":{},"preClass":{},"inClass":{},"postClass":{}},"projects":{"type":"projects","projectStart":{},"projectDue":{},"preClass":{},"inClass":{"items":[{"name":"Project 2 Scrum","url":"https://bootcamp.rocketacademy.co/course-logistics/course-methodology#project-scrums"}]},"postClass":{"items":[{"name":"Project 2 Implementation","url":"https://bootcamp.rocketacademy.co/projects/project-2-server-side-app#recommended-order-of-implementation"}]},"dayIndex":36}}},"09-04-2022":{"courseDate":"09-04-2022","courseWeek":20,"weekDay":2,"dayNumber":6,"meetingDateTimeUTC":"2022-04-09T02:00:00.000Z","courseDay":37,"dateTypes":{"module":"Module 3: Backend Applications","general":{"type":"general","preClass":{},"inClass":{},"postClass":{}},"css":{"type":"css","preClass":{},"inClass":{"items":[{"name":"1.ICE.CSS.6: NTU","url":"https://bootcamp.rocketacademy.co/css/1.ice.css-in-class-css-exercises/1.ice.css.6-ntu"}]},"postClass":{},"dayIndex":37},"algos":{"type":"algos","preClass":{},"inClass":{},"postClass":{}},"ux":{"type":"ux","preClass":{},"inClass":{},"postClass":{}},"ip":{"type":"ip","ipDue":{},"preClass":{},"inClass":{},"postClass":{}},"projects":{"type":"projects","projectStart":{},"projectDue":{"items":[{"name":"Due: Project 2 MVP deadline","url":"https://bootcamp.rocketacademy.co/projects/project-2-server-side-app#mvp-deadline"}]},"preClass":{},"inClass":{"items":[{"name":"Project 2 Scrum","url":"https://bootcamp.rocketacademy.co/course-logistics/course-methodology#project-scrums"},{"name":"Project 2 Mid-Point Peer Review","url":"https://bootcamp.rocketacademy.co/projects/project-2-server-side-app#mid-point-peer-review-in-class"}]},"postClass":{"items":[{"name":"Project 2 Mid-Point Instructor Meeting (30 minutes)","url":"https://bootcamp.rocketacademy.co/projects/project-2-server-side-app#project-timeline"},{"name":"Project 2 Implementation","url":"https://bootcamp.rocketacademy.co/projects/project-2-server-side-app#recommended-order-of-implementation"}]},"dayIndex":37}}},"12-04-2022":{"courseDate":"12-04-2022","courseWeek":21,"weekDay":1,"dayNumber":2,"meetingDateTimeUTC":"2022-04-12T11:30:00.000Z","courseDay":38,"dateTypes":{"module":"Module 3: Backend Applications","general":{"type":"general","preClass":{},"inClass":{},"postClass":{}},"css":{"type":"css","preClass":{},"inClass":{"items":[{"name":"1.ICE.CSS.7: Zillow","url":"https://bootcamp.rocketacademy.co/css/1.ice.css-in-class-css-exercises/1.ice.css.7-zillow"}]},"postClass":{},"dayIndex":38},"algos":{"type":"algos","preClass":{},"inClass":{},"postClass":{}},"ux":{"type":"ux","preClass":{},"inClass":{},"postClass":{}},"ip":{"type":"ip","ipDue":{},"preClass":{},"inClass":{},"postClass":{}},"projects":{"type":"projects","projectStart":{},"projectDue":{},"preClass":{},"inClass":{"items":[{"name":"Project 2 Scrum","url":"https://bootcamp.rocketacademy.co/course-logistics/course-methodology#project-scrums"}]},"postClass":{"items":[{"name":"Project 2 Implementation","url":"https://bootcamp.rocketacademy.co/projects/project-2-server-side-app#recommended-order-of-implementation"}]},"dayIndex":38}}},"16-04-2022":{"courseDate":"16-04-2022","courseWeek":21,"weekDay":2,"dayNumber":6,"meetingDateTimeUTC":"2022-04-16T02:00:00.000Z","courseDay":39,"dateTypes":{"module":"Module 3: Backend Applications","general":{"type":"general","preClass":{},"inClass":{},"postClass":{}},"css":{"type":"css","preClass":{},"inClass":{"items":[{"name":"1.ICE.CSS.8: Chase Bank","url":"https://bootcamp.rocketacademy.co/css/1.ice.css-in-class-css-exercises/1.ice.css.8-chase-bank"}]},"postClass":{},"dayIndex":39},"algos":{"type":"algos","preClass":{},"inClass":{},"postClass":{}},"ux":{"type":"ux","preClass":{},"inClass":{},"postClass":{}},"ip":{"type":"ip","ipDue":{},"preClass":{},"inClass":{},"postClass":{}},"projects":{"type":"projects","projectStart":{},"projectDue":{},"preClass":{},"inClass":{"items":[{"name":"Project 2 Scrum","url":"https://bootcamp.rocketacademy.co/course-logistics/course-methodology#project-scrums"}]},"postClass":{"items":[{"name":"Project 2 Implementation","url":"https://bootcamp.rocketacademy.co/projects/project-2-server-side-app#recommended-order-of-implementation"}]},"dayIndex":39}}},"19-04-2022":{"courseDate":"19-04-2022","courseWeek":22,"weekDay":1,"dayNumber":2,"meetingDateTimeUTC":"2022-04-19T11:30:00.000Z","courseDay":40,"dateTypes":{"module":"Module 3: Backend Applications","general":{"type":"general","preClass":{},"inClass":{},"postClass":{}},"css":{"type":"css","preClass":{},"inClass":{},"postClass":{}},"algos":{"type":"algos","preClass":{},"inClass":{},"postClass":{}},"ux":{"type":"ux","preClass":{},"inClass":{},"postClass":{}},"ip":{"type":"ip","ipDue":{},"preClass":{},"inClass":{},"postClass":{}},"projects":{"type":"projects","projectStart":{},"projectDue":{"items":[{"name":"Due: Project 2 Feature Freeze","url":"https://bootcamp.rocketacademy.co/projects/project-2-server-side-app#feature-freeze"}]},"preClass":{},"inClass":{"items":[{"name":"Project 2 Scrum","url":"https://bootcamp.rocketacademy.co/course-logistics/course-methodology#project-scrums"}]},"postClass":{"items":[{"name":"Project 2 Implementation","url":"https://bootcamp.rocketacademy.co/projects/project-2-server-side-app#recommended-order-of-implementation"}]},"dayIndex":40}}},"23-04-2022":{"courseDate":"23-04-2022","courseWeek":22,"weekDay":2,"dayNumber":6,"meetingDateTimeUTC":"2022-04-23T02:00:00.000Z","courseDay":41,"dateTypes":{"module":"Module 3: Backend Applications","general":{"type":"general","preClass":{},"inClass":{},"postClass":{}},"css":{"type":"css","preClass":{},"inClass":{},"postClass":{}},"algos":{"type":"algos","preClass":{},"inClass":{},"postClass":{}},"ux":{"type":"ux","preClass":{},"inClass":{},"postClass":{}},"ip":{"type":"ip","ipDue":{},"preClass":{},"inClass":{},"postClass":{}},"projects":{"type":"projects","projectStart":{},"projectDue":{},"preClass":{},"inClass":{},"postClass":{"items":[{"name":"Project 2 Demo Video","url":"https://bootcamp.rocketacademy.co/projects/project-2-server-side-app#video-demo"}]},"dayIndex":41}}},"26-04-2022":{"courseDate":"26-04-2022","courseWeek":23,"weekDay":1,"dayNumber":2,"meetingDateTimeUTC":"2022-04-26T11:30:00.000Z","courseDay":42,"dateTypes":{"module":"Module 3: Backend Applications","general":{"type":"general","preClass":{"items":[{"name":"3.6: Heroku","url":"https://bootcamp.rocketacademy.co/3-backend-applications/3.6-heroku"},{"name":"3.6.1: Heroku Deploy","url":"https://bootcamp.rocketacademy.co/3-backend-applications/3.6-heroku/3.6.1-heroku-deploy"},{"name":"3.6.2: Heroku Postgres","url":"https://bootcamp.rocketacademy.co/3-backend-applications/3.6-heroku/3.6.2-heroku-postgres"},{"name":"3.6.3: Heroku S3","url":"https://bootcamp.rocketacademy.co/3-backend-applications/3.6-heroku/3.6.3-heroku-s3"},{"name":"0.10: Introduction to Classes","url":"https://bootcamp.rocketacademy.co/0-language-and-tooling/0.10-introduction-to-classes"}]},"inClass":{},"postClass":{"items":[{"name":"3.POCE.11: Heroku Deployment","url":"https://bootcamp.rocketacademy.co/3-backend-applications/3.poce-post-class-exercises/3.poce.11-heroku-deployment"}]},"dayIndex":42},"css":{"type":"css","preClass":{},"inClass":{},"postClass":{}},"algos":{"type":"algos","preClass":{},"inClass":{},"postClass":{}},"ux":{"type":"ux","preClass":{},"inClass":{},"postClass":{}},"ip":{"type":"ip","ipDue":{},"preClass":{},"inClass":{},"postClass":{}},"projects":{"type":"projects","projectStart":{},"projectDue":{},"preClass":{},"inClass":{},"postClass":{}}}},"30-04-2022":{"courseDate":"30-04-2022","courseWeek":23,"weekDay":2,"dayNumber":6,"meetingDateTimeUTC":"2022-04-30T02:00:00.000Z","courseDay":43,"dateTypes":{"module":"Module 4: Backend Structure","general":{"type":"general","preClass":{"items":[{"name":"4.0: Module 4 Overview","url":"https://bootcamp.rocketacademy.co/4-backend-structure/4.0-module-4-overview"},{"name":"4.1: ORM, Sequelize","url":"https://bootcamp.rocketacademy.co/4-backend-structure/4.1-orm-sequelize"},{"name":"4.1.1: Intro to Sequelize","url":"https://bootcamp.rocketacademy.co/4-backend-structure/4.1-orm-sequelize/4.1.1-intro-to-sequelize"},{"name":"4.1.2: Sequelize One-to-Many","url":"https://bootcamp.rocketacademy.co/4-backend-structure/4.1-orm-sequelize/4.1.2-sequelize-one-to-many-relationships"}]},"inClass":{"items":[{"name":"3.ICE.13: DB Schema Design - Airbnb","url":"https://bootcamp.rocketacademy.co/3-backend-applications/3.ice-in-class-exercises/3.ice.13-db-schema-design-airbnb"}]},"postClass":{"items":[{"name":"4.POCE.1: Sequelize CLI App - Travel Itinerary","url":"https://bootcamp.rocketacademy.co/4-backend-structure/4.poce-post-class-exercises/4.poce.1-sequelize-cli-app-travel-itinerary"}]},"dayIndex":43},"css":{"type":"css","preClass":{},"inClass":{},"postClass":{}},"algos":{"type":"algos","preClass":{},"inClass":{},"postClass":{}},"ux":{"type":"ux","preClass":{},"inClass":{},"postClass":{}},"ip":{"type":"ip","ipDue":{},"preClass":{},"inClass":{},"postClass":{}},"projects":{"type":"projects","projectStart":{},"projectDue":{},"preClass":{},"inClass":{},"postClass":{}}}},"03-05-2022":{"courseDay":null,"courseDate":"03-05-2022","courseWeek":24,"dayNumber":2,"dateTypes":{"holidayType":"public holiday","date":"03-05-2022","location":"SG","name":"Labour Day (observed)"}},"07-05-2022":{"courseDate":"07-05-2022","courseWeek":24,"weekDay":1,"dayNumber":6,"meetingDateTimeUTC":"2022-05-07T02:00:00.000Z","courseDay":44,"dateTypes":{"module":"Module 4: Backend Structure","general":{"type":"general","preClass":{"items":[{"name":"0.8.2: Try Catch","url":"https://bootcamp.rocketacademy.co/0-language-and-tooling/0.8-js-promises/0.8.2-try-catch"},{"name":"0.8.3: Async/Await","url":"https://bootcamp.rocketacademy.co/0-language-and-tooling/0.8-js-promises/0.8.3-async-await"},{"name":"4.1.3: Async/Await with Sequelize","url":"https://bootcamp.rocketacademy.co/4-backend-structure/4.1-orm-sequelize/4.1.3-async-await-with-sequelize"}]},"inClass":{"items":[{"name":"4.POCE.1: Sequelize CLI App - Travel Itinerary (Pair Programming)","url":"https://bootcamp.rocketacademy.co/4-backend-structure/4.poce-post-class-exercises/4.poce.1-sequelize-cli-app-travel-itinerary"}]},"postClass":{"items":[{"name":"4.POCE.1: Sequelize CLI App - Travel Itinerary","url":"https://bootcamp.rocketacademy.co/4-backend-structure/4.poce-post-class-exercises/4.poce.1-sequelize-cli-app-travel-itinerary"}]},"dayIndex":44},"css":{"type":"css","preClass":{},"inClass":{},"postClass":{}},"algos":{"type":"algos","preClass":{},"inClass":{},"postClass":{}},"ux":{"type":"ux","preClass":{},"inClass":{},"postClass":{}},"ip":{"type":"ip","ipDue":{},"preClass":{},"inClass":{},"postClass":{}},"projects":{"type":"projects","projectStart":{},"projectDue":{},"preClass":{},"inClass":{},"postClass":{}}}},"10-05-2022":{"courseDate":"10-05-2022","courseWeek":25,"weekDay":1,"dayNumber":2,"meetingDateTimeUTC":"2022-05-10T11:30:00.000Z","courseDay":45,"dateTypes":{"module":"Module 4: Backend Structure","general":{"type":"general","preClass":{"items":[{"name":"4.2: MVC","url":"https://bootcamp.rocketacademy.co/4-backend-structure/4.2-mvc"},{"name":"4.2.1: RESTful Routes","url":"https://bootcamp.rocketacademy.co/4-backend-structure/4.2-mvc/4.2.1-restful-routes"}]},"inClass":{"items":[{"name":"4.POCE.2: Drummers for Hire","url":"https://bootcamp.rocketacademy.co/4-backend-structure/4.poce-post-class-exercises/4.poce.2-drummers-for-hire"}]},"postClass":{"items":[{"name":"4.POCE.2: Drummers for Hire","url":"https://bootcamp.rocketacademy.co/4-backend-structure/4.poce-post-class-exercises/4.poce.2-drummers-for-hire"}]},"dayIndex":45},"css":{"type":"css","preClass":{},"inClass":{},"postClass":{}},"algos":{"type":"algos","preClass":{},"inClass":{},"postClass":{}},"ux":{"type":"ux","preClass":{},"inClass":{},"postClass":{"items":[{"name":"UX.1: Overview","url":"https://bootcamp.rocketacademy.co/user-experience/ux.1-overview"},{"name":"UX.2: The UX Process","url":"https://bootcamp.rocketacademy.co/user-experience/ux.2-the-ux-process"}]},"dayIndex":45},"ip":{"type":"ip","ipDue":{},"preClass":{},"inClass":{},"postClass":{}},"projects":{"type":"projects","projectStart":{},"projectDue":{},"preClass":{},"inClass":{},"postClass":{}}}},"14-05-2022":{"courseDate":"14-05-2022","courseWeek":25,"weekDay":2,"dayNumber":6,"meetingDateTimeUTC":"2022-05-14T02:00:00.000Z","courseDay":46,"dateTypes":{"module":"Module 4: Backend Structure","general":{"type":"general","preClass":{"items":[{"name":"4.1.4: Sequelize Many-to-Many","url":"https://bootcamp.rocketacademy.co/4-backend-structure/4.1-orm-sequelize/4.1.4-sequelize-many-to-many"}]},"inClass":{"items":[{"name":"4.POCE.3: Project 2 MVC Refactor","url":"https://bootcamp.rocketacademy.co/4-backend-structure/4.poce-post-class-exercises/4.poce.3-project-2-mvc-refactor"}]},"postClass":{"items":[{"name":"4.POCE.2: Drummers for Hire","url":"https://bootcamp.rocketacademy.co/4-backend-structure/4.poce-post-class-exercises/4.poce.2-drummers-for-hire"}]},"dayIndex":46},"css":{"type":"css","preClass":{},"inClass":{},"postClass":{}},"algos":{"type":"algos","preClass":{},"inClass":{},"postClass":{}},"ux":{"type":"ux","preClass":{},"inClass":{},"postClass":{"items":[{"name":"UX.3: How to Design Your App","url":"https://bootcamp.rocketacademy.co/user-experience/ux.3-how-to-design-your-app"}]},"dayIndex":46},"ip":{"type":"ip","ipDue":{},"preClass":{},"inClass":{},"postClass":{}},"projects":{"type":"projects","projectStart":{},"projectDue":{},"preClass":{},"inClass":{},"postClass":{}}}},"17-05-2022":{"courseDate":"17-05-2022","courseWeek":26,"weekDay":1,"dayNumber":2,"meetingDateTimeUTC":"2022-05-17T11:30:00.000Z","courseDay":47,"dateTypes":{"module":"Module 5: Full Stack Application","general":{"type":"general","preClass":{"items":[{"name":"4.1.5: Sequelize Many-to-Many with Non-FK Attributes in \\"Through Table\\"","url":"https://bootcamp.rocketacademy.co/4-backend-structure/4.1-orm-sequelize/4.1.5-sequelize-many-to-many-with-non-fk-attributes-in-through-table"},{"name":"5.0: Module 5 Overview","url":"https://bootcamp.rocketacademy.co/5-full-stack-applications/5.0-module-5-overview"},{"name":"5.1: DOM Manipulation with Express App","url":"https://bootcamp.rocketacademy.co/5-full-stack-applications/5.1-dom-manipulation-with-express-app"}]},"inClass":{"items":[{"name":"5.ICE.1: Full-Stack Modal","url":"https://bootcamp.rocketacademy.co/5-full-stack-applications/5.ice-in-class-exercises/5.ice.1-full-stack-modal"}]},"postClass":{"items":[{"name":"4.POCE.3: Project 2 MVC Refactor","url":"https://bootcamp.rocketacademy.co/4-backend-structure/4.poce-post-class-exercises/4.poce.3-project-2-mvc-refactor"}]},"dayIndex":47},"css":{"type":"css","preClass":{},"inClass":{},"postClass":{}},"algos":{"type":"algos","preClass":{},"inClass":{},"postClass":{}},"ux":{"type":"ux","preClass":{},"inClass":{},"postClass":{}},"ip":{"type":"ip","ipDue":{},"preClass":{},"inClass":{},"postClass":{}},"projects":{"type":"projects","projectStart":{},"projectDue":{},"preClass":{},"inClass":{},"postClass":{}}}},"21-05-2022":{"courseDate":"21-05-2022","courseWeek":26,"weekDay":2,"dayNumber":6,"meetingDateTimeUTC":"2022-05-21T02:00:00.000Z","courseDay":48,"dateTypes":{"module":"Module 5: Full Stack Application","general":{"type":"general","preClass":{"items":[{"name":"4.1.6 Sequelize Validations","url":"https://bootcamp.rocketacademy.co/4-backend-structure/4.1-orm-sequelize/4.1.6-sequelize-validations"},{"name":"5.2: AJAX","url":"https://bootcamp.rocketacademy.co/5-full-stack-applications/5.2-ajax"}]},"inClass":{"items":[{"name":"5.ICE.2: AJAX","url":"https://bootcamp.rocketacademy.co/5-full-stack-applications/5.ice-in-class-exercises/5.ice.2-ajax"}]},"postClass":{"items":[{"name":"4.POCE.3: Project 2 MVC Refactor","url":"https://bootcamp.rocketacademy.co/4-backend-structure/4.poce-post-class-exercises/4.poce.3-project-2-mvc-refactor"}]},"dayIndex":48},"css":{"type":"css","preClass":{},"inClass":{},"postClass":{}},"algos":{"type":"algos","preClass":{},"inClass":{},"postClass":{}},"ux":{"type":"ux","preClass":{},"inClass":{},"postClass":{}},"ip":{"type":"ip","ipDue":{},"preClass":{},"inClass":{},"postClass":{}},"projects":{"type":"projects","projectStart":{},"projectDue":{},"preClass":{},"inClass":{},"postClass":{}}}},"24-05-2022":{"courseDate":"24-05-2022","courseWeek":27,"weekDay":1,"dayNumber":2,"meetingDateTimeUTC":"2022-05-24T11:30:00.000Z","courseDay":49,"dateTypes":{"module":"Module 5: Full Stack Application","general":{"type":"general","preClass":{"items":[{"name":"4.1.7: Sequelize Eager Loading","url":"https://bootcamp.rocketacademy.co/4-backend-structure/4.1-orm-sequelize/4.1.7-sequelize-eager-loading"},{"name":"5.2.1: AJAX POST Requests","url":"https://bootcamp.rocketacademy.co/5-full-stack-applications/5.2-ajax/5.2.1-ajax-post-requests"}]},"inClass":{"items":[{"name":"5.ICE.3: Bug Reports AJAX","url":"https://bootcamp.rocketacademy.co/5-full-stack-applications/5.ice-in-class-exercises/5.ice.3-bug-reports-ajax"}]},"postClass":{"items":[{"name":"5.POCE.1: Bug Reports AJAX","url":"https://bootcamp.rocketacademy.co/5-full-stack-applications/5.poce-post-class-exercises/5.poce.1-bug-reports-ajax"}]},"dayIndex":49},"css":{"type":"css","preClass":{},"inClass":{},"postClass":{}},"algos":{"type":"algos","preClass":{"items":[{"name":"A.0: Algorithms Overview","url":"https://bootcamp.rocketacademy.co/algorithms/a.0-algorithms-overview"},{"name":"A.1: Intro to SWE Interviews","url":"https://bootcamp.rocketacademy.co/algorithms/a.1-intro-to-swe-interviews"},{"name":"A.2: Intro to Python (Exercises 1-8)","url":"https://bootcamp.rocketacademy.co/algorithms/a.2-intro-to-python"}]},"inClass":{},"postClass":{},"dayIndex":49},"ux":{"type":"ux","preClass":{},"inClass":{},"postClass":{}},"ip":{"type":"ip","ipDue":{},"preClass":{},"inClass":{},"postClass":{}},"projects":{"type":"projects","projectStart":{},"projectDue":{},"preClass":{},"inClass":{},"postClass":{}}}},"28-05-2022":{"courseDate":"28-05-2022","courseWeek":27,"weekDay":2,"dayNumber":6,"meetingDateTimeUTC":"2022-05-28T02:00:00.000Z","courseDay":50,"dateTypes":{"module":"Module 5: Full Stack Application","general":{"type":"general","preClass":{"items":[{"name":"4.1.8: Multiple FK Columns Referencing Same Table","url":"https://bootcamp.rocketacademy.co/4-backend-structure/4.1-orm-sequelize/4.1.8-multiple-foreign-key-columns-referencing-same-table"}]},"inClass":{"items":[{"name":"5.ICE.4: Cross-Domain AJAX","url":"https://bootcamp.rocketacademy.co/5-full-stack-applications/5.ice-in-class-exercises/5.ice.4-cross-domain-ajax"}]},"postClass":{"items":[{"name":"5.POCE.2: Bug Reports AJAX Users","url":"https://bootcamp.rocketacademy.co/5-full-stack-applications/5.poce-post-class-exercises/5.poce.2-bug-reports-ajax-users"}]},"dayIndex":50},"css":{"type":"css","preClass":{},"inClass":{},"postClass":{}},"algos":{"type":"algos","preClass":{"items":[{"name":"A.2: Intro to Python (Exercises 9-11)","url":"https://bootcamp.rocketacademy.co/algorithms/a.2-intro-to-python"}]},"inClass":{},"postClass":{},"dayIndex":50},"ux":{"type":"ux","preClass":{},"inClass":{},"postClass":{}},"ip":{"type":"ip","ipDue":{},"preClass":{},"inClass":{},"postClass":{}},"projects":{"type":"projects","projectStart":{},"projectDue":{},"preClass":{},"inClass":{},"postClass":{}}}},"31-05-2022":{"courseDate":"31-05-2022","courseWeek":28,"weekDay":1,"dayNumber":2,"meetingDateTimeUTC":"2022-05-31T11:30:00.000Z","courseDay":51,"dateTypes":{"module":"Module 6: Frontend Infrastructure","general":{"type":"general","preClass":{"items":[{"name":"6.1: Webpack","url":"https://bootcamp.rocketacademy.co/6-frontend-infrastructure/6.1-webpack"},{"name":"5.2.2: AJAX Cards","url":"https://bootcamp.rocketacademy.co/5-full-stack-applications/5.2-ajax/5.2.2-ajax-cards"},{"name":"6.1.1: Webpack with Local Modules","url":"https://bootcamp.rocketacademy.co/6-frontend-infrastructure/6.1-webpack/6.1.1-webpack-with-local-modules"},{"name":"6.0: Module 6 Overview","url":"https://bootcamp.rocketacademy.co/6-frontend-infrastructure/6.0-module-6-overview"}]},"inClass":{"items":[{"name":"Bug Reports (5.POCE.1, 5.POCE.2) Redux ","url":"https://bootcamp.rocketacademy.co/course-logistics/course-methodology#peer-code-review"}]},"postClass":{"items":[{"name":"5.POCE.3: AJAX Cards","url":"https://bootcamp.rocketacademy.co/5-full-stack-applications/5.poce-post-class-exercises/5.poce.3-ajax-cards"}]},"dayIndex":51},"css":{"type":"css","preClass":{},"inClass":{},"postClass":{}},"algos":{"type":"algos","preClass":{"items":[{"name":"A.3: Complexity Analysis, Big-O Notation","url":"https://bootcamp.rocketacademy.co/algorithms/a.3-complexity-analysis-big-o-notation"},{"name":"A.4: Interview Strategies","url":"https://bootcamp.rocketacademy.co/algorithms/a.4-interview-strategies"},{"name":"A.4.1 Introduction to Algorithm Problems","url":"https://bootcamp.rocketacademy.co/algorithms/a.4-interview-strategies/a.4.1-introduction-to-algorithm-problems#pre-class"}]},"inClass":{},"postClass":{},"dayIndex":51},"ux":{"type":"ux","preClass":{},"inClass":{},"postClass":{}},"ip":{"type":"ip","ipDue":{},"preClass":{},"inClass":{},"postClass":{}},"projects":{"type":"projects","projectStart":{"items":[{"name":"Start: Project 3 Ideation Phase 1","url":"https://bootcamp.rocketacademy.co/projects/project-3-full-stack-game#ideation-phase-1"}]},"projectDue":{},"preClass":{},"inClass":{},"postClass":{"items":[{"name":"Project 3 Ideation Phase 1","url":"https://bootcamp.rocketacademy.co/projects/project-3-full-stack-game#ideation-phase-1"}]},"dayIndex":51}}},"04-06-2022":{"courseDate":"04-06-2022","courseWeek":28,"weekDay":2,"dayNumber":6,"meetingDateTimeUTC":"2022-06-04T02:00:00.000Z","courseDay":52,"dateTypes":{"module":"Module 6: Frontend Infrastructure","general":{"type":"general","preClass":{"items":[{"name":"6.1.2: Webpack with NPM Modules","url":"https://bootcamp.rocketacademy.co/6-frontend-infrastructure/6.1-webpack/6.1.2-webpack-with-npm-modules"}]},"inClass":{"items":[{"name":"6.ICE.1: NPM Webpack","url":"https://bootcamp.rocketacademy.co/6-frontend-infrastructure/6.ice-in-class-exercises/6.ice.1-npm-webpack"}]},"postClass":{"items":[{"name":"5.POCE.3: AJAX Cards","url":"https://bootcamp.rocketacademy.co/5-full-stack-applications/5.poce-post-class-exercises/5.poce.3-ajax-cards"}]},"dayIndex":52},"css":{"type":"css","preClass":{},"inClass":{},"postClass":{}},"algos":{"type":"algos","preClass":{"items":[{"name":"A.5.1: Arrays - Pre-Class","url":"https://bootcamp.rocketacademy.co/algorithms/a.5-data-structures/a.5.1-arrays#pre-class"}]},"inClass":{},"postClass":{},"dayIndex":52},"ux":{"type":"ux","preClass":{},"inClass":{},"postClass":{}},"ip":{"type":"ip","ipDue":{},"preClass":{},"inClass":{},"postClass":{}},"projects":{"type":"projects","projectStart":{},"projectDue":{},"preClass":{},"inClass":{},"postClass":{"items":[{"name":"Project 3 Ideation Phase 1","url":"https://bootcamp.rocketacademy.co/projects/project-3-full-stack-game#ideation-phase-1"}]},"dayIndex":52}}},"07-06-2022":{"courseDate":"07-06-2022","courseWeek":29,"weekDay":1,"dayNumber":2,"meetingDateTimeUTC":"2022-06-07T11:30:00.000Z","courseDay":53,"dateTypes":{"module":"Module 6: Frontend Infrastructure","general":{"type":"general","preClass":{"items":[{"name":"6.1.3: Webpack with Babel","url":"https://bootcamp.rocketacademy.co/6-frontend-infrastructure/6.1-webpack/6.1.3-webpack-with-babel"},{"name":"6.1.4: Webpack with SASS","url":"https://bootcamp.rocketacademy.co/6-frontend-infrastructure/6.1-webpack/6.1.4-webpack-with-sass"}]},"inClass":{},"postClass":{"items":[{"name":"5.POCE.3: AJAX Cards","url":"https://bootcamp.rocketacademy.co/5-full-stack-applications/5.poce-post-class-exercises/5.poce.3-ajax-cards"}]},"dayIndex":53},"css":{"type":"css","preClass":{},"inClass":{},"postClass":{}},"algos":{"type":"algos","preClass":{},"inClass":{"items":[{"name":"A.5.1: Arrays - Part 1","url":"https://bootcamp.rocketacademy.co/algorithms/a.5-data-structures/a.5.1-arrays#part-1"}]},"postClass":{"items":[{"name":"A.5.1: Arrays - Part 1","url":"https://bootcamp.rocketacademy.co/algorithms/a.5-data-structures/a.5.1-arrays#part-1"}]},"dayIndex":53},"ux":{"type":"ux","preClass":{},"inClass":{},"postClass":{}},"ip":{"type":"ip","ipDue":{},"preClass":{},"inClass":{},"postClass":{}},"projects":{"type":"projects","projectStart":{"items":[{"name":"Start: Project 3 Ideation Phase 2","url":"https://bootcamp.rocketacademy.co/projects/project-3-full-stack-game#ideation-phase-2"}]},"projectDue":{},"preClass":{},"inClass":{},"postClass":{"items":[{"name":"Project 3 Ideation Phase 2","url":"https://bootcamp.rocketacademy.co/projects/project-3-full-stack-game#ideation-phase-2"}]},"dayIndex":53}}},"11-06-2022":{"courseDate":"11-06-2022","courseWeek":29,"weekDay":2,"dayNumber":6,"meetingDateTimeUTC":"2022-06-11T02:00:00.000Z","courseDay":54,"dateTypes":{"module":"Module 6: Frontend Infrastructure","general":{"type":"general","preClass":{"items":[{"name":"6.1.5: Webpack with Express","url":"https://bootcamp.rocketacademy.co/6-frontend-infrastructure/6.1-webpack/6.1.5-webpack-with-express"}]},"inClass":{"items":[{"name":"AJAX Cards Redux"}]},"postClass":{},"dayIndex":54},"css":{"type":"css","preClass":{},"inClass":{},"postClass":{}},"algos":{"type":"algos","preClass":{},"inClass":{"items":[{"name":"A.5.1: Arrays - Part 2","url":"https://bootcamp.rocketacademy.co/algorithms/a.5-data-structures/a.5.1-arrays#part-2"}]},"postClass":{"items":[{"name":"A.5.1: Arrays - Part 2","url":"https://bootcamp.rocketacademy.co/algorithms/a.5-data-structures/a.5.1-arrays#part-2"}]},"dayIndex":54},"ux":{"type":"ux","preClass":{},"inClass":{},"postClass":{}},"ip":{"type":"ip","ipDue":{},"preClass":{},"inClass":{},"postClass":{}},"projects":{"type":"projects","projectStart":{},"projectDue":{},"preClass":{},"inClass":{},"postClass":{"items":[{"name":"Project 3 Ideation Phase 2","url":"https://bootcamp.rocketacademy.co/projects/project-3-full-stack-game#ideation-phase-2"}]},"dayIndex":54}}},"14-06-2022":{"courseDate":"14-06-2022","courseWeek":30,"weekDay":1,"dayNumber":2,"meetingDateTimeUTC":"2022-06-14T11:30:00.000Z","courseDay":55,"dateTypes":{"module":"Module 6: Frontend Infrastructure","general":{"type":"general","preClass":{"items":[{"name":"Group Work (for project management)","url":"https://bootcamp.rocketacademy.co/course-logistics/group-work"}]},"inClass":{},"postClass":{},"dayIndex":55},"css":{"type":"css","preClass":{},"inClass":{},"postClass":{}},"algos":{"type":"algos","preClass":{"items":[{"name":"A.5.2: Hash Tables - Pre-Class","url":"https://bootcamp.rocketacademy.co/algorithms/a.5-data-structures/a.5.2-hash-tables"}]},"inClass":{"items":[{"name":"A.5.2: Hash Tables - Part 1","url":"https://bootcamp.rocketacademy.co/algorithms/a.5-data-structures/a.5.2-hash-tables#part-1"}]},"postClass":{"items":[{"name":"A.5.2: Hash Tables - Part 1","url":"https://bootcamp.rocketacademy.co/algorithms/a.5-data-structures/a.5.2-hash-tables#part-1"}]},"dayIndex":55},"ux":{"type":"ux","preClass":{},"inClass":{},"postClass":{}},"ip":{"type":"ip","ipDue":{},"preClass":{},"inClass":{},"postClass":{}},"projects":{"type":"projects","projectStart":{"items":[{"name":"Start: Project 3","url":"https://bootcamp.rocketacademy.co/projects/project-3-full-stack-game#ideation-phase-2"}]},"projectDue":{"items":[{"name":"Due: Project 3 Ideation Phase 2","url":"https://bootcamp.rocketacademy.co/projects/project-3-full-stack-game#ideation-phase-2"}]},"preClass":{},"inClass":{"items":[{"name":"Peer Planning Review","url":"https://bootcamp.rocketacademy.co/projects/project-3-full-stack-game#ideation-phase-2"}]},"postClass":{"items":[{"name":"Project 3 Implementation","url":"https://bootcamp.rocketacademy.co/projects/project-3-full-stack-game"}]},"dayIndex":55}}},"18-06-2022":{"courseDate":"18-06-2022","courseWeek":30,"weekDay":2,"dayNumber":6,"meetingDateTimeUTC":"2022-06-18T02:00:00.000Z","courseDay":56,"dateTypes":{"module":"Module 6: Frontend Infrastructure","general":{"type":"general","preClass":{},"inClass":{},"postClass":{}},"css":{"type":"css","preClass":{},"inClass":{},"postClass":{}},"algos":{"type":"algos","preClass":{},"inClass":{"items":[{"name":"A.5.2: Hash Tables - Part 2","url":"https://bootcamp.rocketacademy.co/algorithms/a.5-data-structures/a.5.2-hash-tables#part-2"}]},"postClass":{"items":[{"name":"A.5.2: Hash Tables - Part 2","url":"https://bootcamp.rocketacademy.co/algorithms/a.5-data-structures/a.5.2-hash-tables#part-2"}]},"dayIndex":56},"ux":{"type":"ux","preClass":{},"inClass":{},"postClass":{}},"ip":{"type":"ip","ipDue":{},"preClass":{},"inClass":{},"postClass":{}},"projects":{"type":"projects","projectStart":{},"projectDue":{},"preClass":{},"inClass":{"items":[{"name":"Project 3 Scrum","url":"https://bootcamp.rocketacademy.co/course-logistics/course-methodology#project-scrums"}]},"postClass":{"items":[{"name":"Project 3 Implementation","url":"https://bootcamp.rocketacademy.co/projects/project-3-full-stack-game"}]},"dayIndex":56}}},"21-06-2022":{"courseDate":"21-06-2022","courseWeek":31,"weekDay":1,"dayNumber":2,"meetingDateTimeUTC":"2022-06-21T11:30:00.000Z","courseDay":57,"dateTypes":{"module":"Module 6: Frontend Infrastructure","general":{"type":"general","preClass":{"items":[{"name":"4.1.10: Deploy Sequelize App to Heroku","url":"https://bootcamp.rocketacademy.co/4-backend-structure/4.1-orm-sequelize/4.1.10-deploy-sequelize-app-to-heroku"},{"name":"6.1.6: Deploy Webpack App to Heroku","url":"https://bootcamp.rocketacademy.co/6-frontend-infrastructure/6.1-webpack/6.1.6-express-mvc-webpack-and-heroku"}]},"inClass":{},"postClass":{},"dayIndex":57},"css":{"type":"css","preClass":{},"inClass":{},"postClass":{}},"algos":{"type":"algos","preClass":{"items":[{"name":"A.6: Object-Oriented Programming","url":"https://bootcamp.rocketacademy.co/algorithms/a.6-intro-to-object-oriented-programming"}]},"inClass":{"items":[{"name":"A.8: Object-Oriented Programming","url":"https://bootcamp.rocketacademy.co/algorithms/a.8-intro-to-object-oriented-programming#in-class-exercise"}]},"postClass":{},"dayIndex":57},"ux":{"type":"ux","preClass":{},"inClass":{},"postClass":{}},"ip":{"type":"ip","ipDue":{},"preClass":{},"inClass":{},"postClass":{}},"projects":{"type":"projects","projectStart":{},"projectDue":{},"preClass":{},"inClass":{"items":[{"name":"Project 3 Scrum","url":"https://bootcamp.rocketacademy.co/course-logistics/course-methodology#project-scrums"}]},"postClass":{"items":[{"name":"Project 3 Implementation","url":"https://bootcamp.rocketacademy.co/projects/project-3-full-stack-game"}]},"dayIndex":57}}},"25-06-2022":{"courseDate":"25-06-2022","courseWeek":31,"weekDay":2,"dayNumber":6,"meetingDateTimeUTC":"2022-06-25T02:00:00.000Z","courseDay":58,"dateTypes":{"module":"Module 6: Frontend Infrastructure","general":{"type":"general","preClass":{},"inClass":{},"postClass":{}},"css":{"type":"css","preClass":{},"inClass":{},"postClass":{}},"algos":{"type":"algos","preClass":{"items":[{"name":"A.5.3: Stacks - Pre-Class","url":"https://bootcamp.rocketacademy.co/algorithms/a.5-data-structures/a.5.3-stacks#pre-class"}]},"inClass":{"items":[{"name":"A.5.3: Stacks - Part 1","url":"https://bootcamp.rocketacademy.co/algorithms/a.5-data-structures/a.5.3-stacks#part-1"}]},"postClass":{"items":[{"name":"A.5.3: Stacks - Part 1","url":"https://bootcamp.rocketacademy.co/algorithms/a.5-data-structures/a.5.3-stacks#part-1"}]},"dayIndex":58},"ux":{"type":"ux","preClass":{},"inClass":{},"postClass":{}},"ip":{"type":"ip","ipDue":{},"preClass":{},"inClass":{},"postClass":{}},"projects":{"type":"projects","projectStart":{},"projectDue":{},"preClass":{},"inClass":{"items":[{"name":"Project 3 Scrum","url":"https://bootcamp.rocketacademy.co/course-logistics/course-methodology#project-scrums"}]},"postClass":{"items":[{"name":"Project 3 Implementation","url":"https://bootcamp.rocketacademy.co/projects/project-3-full-stack-game"}]},"dayIndex":58}}},"28-06-2022":{"courseDate":"28-06-2022","courseWeek":32,"weekDay":1,"dayNumber":2,"meetingDateTimeUTC":"2022-06-28T11:30:00.000Z","courseDay":59,"dateTypes":{"module":"Module 6: Frontend Infrastructure","general":{"type":"general","preClass":{},"inClass":{},"postClass":{}},"css":{"type":"css","preClass":{},"inClass":{},"postClass":{}},"algos":{"type":"algos","preClass":{},"inClass":{"items":[{"name":"A.5.3: Stacks - Part 2","url":"https://bootcamp.rocketacademy.co/algorithms/a.5-data-structures/a.5.3-stacks#part-2"}]},"postClass":{"items":[{"name":"A.5.3: Stacks - Part 2","url":"https://bootcamp.rocketacademy.co/algorithms/a.5-data-structures/a.5.3-stacks#part-2"}]},"dayIndex":59},"ux":{"type":"ux","preClass":{},"inClass":{},"postClass":{}},"ip":{"type":"ip","ipDue":{},"preClass":{},"inClass":{},"postClass":{}},"projects":{"type":"projects","projectStart":{},"projectDue":{},"preClass":{},"inClass":{"items":[{"name":"Project 3 Scrum","url":"https://bootcamp.rocketacademy.co/course-logistics/course-methodology#project-scrums"}]},"postClass":{"items":[{"name":"Project 3 Implementation","url":"https://bootcamp.rocketacademy.co/projects/project-3-full-stack-game"}]},"dayIndex":59}}},"02-07-2022":{"courseDate":"02-07-2022","courseWeek":32,"weekDay":2,"dayNumber":6,"meetingDateTimeUTC":"2022-07-02T02:00:00.000Z","courseDay":60,"dateTypes":{"module":"Module 6: Frontend Infrastructure","general":{"type":"general","preClass":{},"inClass":{},"postClass":{}},"css":{"type":"css","preClass":{},"inClass":{},"postClass":{}},"algos":{"type":"algos","preClass":{"items":[{"name":"A.5.5: Linked Lists - Pre-Class","url":"https://bootcamp.rocketacademy.co/algorithms/a.5-data-structures/a.5.5-linked-lists#pre-class"}]},"inClass":{"items":[{"name":"A.5.5: Linked Lists - Part 1","url":"https://bootcamp.rocketacademy.co/algorithms/a.5-data-structures/a.5.5-linked-lists#part-1"}]},"postClass":{"items":[{"name":"A.5.5: Linked Lists - Part 1","url":"https://bootcamp.rocketacademy.co/algorithms/a.5-data-structures/a.5.5-linked-lists#part-1"}]},"dayIndex":60},"ux":{"type":"ux","preClass":{},"inClass":{},"postClass":{}},"ip":{"type":"ip","ipDue":{},"preClass":{},"inClass":{},"postClass":{}},"projects":{"type":"projects","projectStart":{},"projectDue":{},"preClass":{},"inClass":{"items":[{"name":"Project 3 Scrum","url":"https://bootcamp.rocketacademy.co/course-logistics/course-methodology#project-scrums"}]},"postClass":{"items":[{"name":"Project 3 Implementation","url":"https://bootcamp.rocketacademy.co/projects/project-3-full-stack-game"}]},"dayIndex":60}}},"05-07-2022":{"courseDate":"05-07-2022","courseWeek":33,"weekDay":1,"dayNumber":2,"meetingDateTimeUTC":"2022-07-05T11:30:00.000Z","courseDay":61,"dateTypes":{"module":"Module 6: Frontend Infrastructure","general":{"type":"general","preClass":{},"inClass":{},"postClass":{}},"css":{"type":"css","preClass":{},"inClass":{},"postClass":{}},"algos":{"type":"algos","preClass":{},"inClass":{"items":[{"name":"A.5.5: Linked Lists - Part 2","url":"https://bootcamp.rocketacademy.co/algorithms/a.5-data-structures/a.5.5-linked-lists#part-2"}]},"postClass":{"items":[{"name":"A.5.5: Linked Lists - Part 2","url":"https://bootcamp.rocketacademy.co/algorithms/a.5-data-structures/a.5.5-linked-lists#part-2"}]},"dayIndex":61},"ux":{"type":"ux","preClass":{},"inClass":{},"postClass":{}},"ip":{"type":"ip","ipDue":{},"preClass":{},"inClass":{},"postClass":{}},"projects":{"type":"projects","projectStart":{},"projectDue":{"items":[{"name":"Due: Project 3 Presentations","url":"https://bootcamp.rocketacademy.co/course-logistics/course-methodology#project-presentations"}]},"preClass":{},"inClass":{},"postClass":{"items":[{"name":"Project 3 Post-Mortems","url":"https://bootcamp.rocketacademy.co/course-logistics/course-methodology#project-post-mortem-meeting"},{"name":"Project 3 Video Demo","url":"https://bootcamp.rocketacademy.co/projects/project-3-full-stack-game#video-demo"}]},"dayIndex":61}}},"09-07-2022":{"courseDay":null,"courseDate":"09-07-2022","courseWeek":33,"dayNumber":6,"dateTypes":{"holidayType":"public holiday","date":"09-07-2022","location":"SG","name":"Hari Raya Haji"}},"12-07-2022":{"courseDate":"12-07-2022","courseWeek":34,"weekDay":1,"dayNumber":2,"meetingDateTimeUTC":"2022-07-12T11:30:00.000Z","courseDay":62,"dateTypes":{"module":"Module 7: React","general":{"type":"general","preClass":{"items":[{"name":"7.0: Module 7 Overview","url":"https://bootcamp.rocketacademy.co/7-react/7.0-module-7-overview"},{"name":"7.1: JSX Intro","url":"https://bootcamp.rocketacademy.co/7-react/7.1-jsx-intro"},{"name":"7.1.1: Conditional Rendering","url":"https://bootcamp.rocketacademy.co/7-react/7.1-jsx-intro/7.1.1-conditional-rendering"},{"name":"7.1.2: Rendering In a Loop","url":"https://bootcamp.rocketacademy.co/7-react/7.1-jsx-intro/7.1.2-rendering-in-a-loop"}]},"inClass":{"items":[{"name":"7.ICE.1: JSX Products Items","url":"https://bootcamp.rocketacademy.co/7-react/7.ice-in-class-exercises/7.ice.1-product-rendering"}]},"postClass":{"items":[{"name":"7.POCE.1: JSX Bug Reports","url":"https://bootcamp.rocketacademy.co/7-react/7.poce-post-class-exercises/7.poce.1-bugs"}]},"dayIndex":62},"css":{"type":"css","preClass":{},"inClass":{},"postClass":{}},"algos":{"type":"algos","preClass":{},"inClass":{},"postClass":{}},"ux":{"type":"ux","preClass":{},"inClass":{},"postClass":{}},"ip":{"type":"ip","ipDue":{},"preClass":{},"inClass":{},"postClass":{}},"projects":{"type":"projects","projectStart":{},"projectDue":{},"preClass":{},"inClass":{"items":[{"name":"Peer project review exercise","url":"https://bootcamp.rocketacademy.co/projects/project-3-full-stack-game#project-presentations"}]},"postClass":{"items":[{"name":"Project 3 Video Demo","url":"https://bootcamp.rocketacademy.co/projects/project-3-full-stack-game#video-demo"}]},"dayIndex":62}}},"16-07-2022":{"courseDate":"16-07-2022","courseWeek":34,"weekDay":2,"dayNumber":6,"meetingDateTimeUTC":"2022-07-16T02:00:00.000Z","courseDay":63,"dateTypes":{"module":"Module 7: React","general":{"type":"general","preClass":{"items":[{"name":"7.2: React Components","url":"https://bootcamp.rocketacademy.co/7-react/7.2-react-components"},{"name":"7.2.1: Props","url":"https://bootcamp.rocketacademy.co/7-react/7.2-react-components/7.2.1-props"},{"name":"7.2.2: Generating Components from a List","url":"https://bootcamp.rocketacademy.co/7-react/7.2-react-components/7.2.2-generating-components-from-a-list"},{"name":"7.2.3: Class Components","url":"https://bootcamp.rocketacademy.co/7-react/7.2-react-components/7.2.3-class-components"}]},"inClass":{"items":[{"name":"7.ICE.2: React Pokedex","url":"https://bootcamp.rocketacademy.co/7-react/7.ice-in-class-exercises/7.ice.2-pokedex"}]},"postClass":{"items":[{"name":"7.ICE.2: React Pokedex","url":"https://bootcamp.rocketacademy.co/7-react/7.ice-in-class-exercises/7.ice.2-pokedex"}]},"dayIndex":63},"css":{"type":"css","preClass":{},"inClass":{},"postClass":{}},"algos":{"type":"algos","preClass":{},"inClass":{},"postClass":{}},"ux":{"type":"ux","preClass":{},"inClass":{},"postClass":{}},"ip":{"type":"ip","ipDue":{},"preClass":{},"inClass":{},"postClass":{}},"projects":{"type":"projects","projectStart":{},"projectDue":{},"preClass":{},"inClass":{},"postClass":{"items":[{"name":"Project 3 Video Demo","url":"https://bootcamp.rocketacademy.co/projects/project-3-full-stack-game#video-demo"}]},"dayIndex":63}}},"19-07-2022":{"courseDate":"19-07-2022","courseWeek":35,"weekDay":1,"dayNumber":2,"meetingDateTimeUTC":"2022-07-19T11:30:00.000Z","courseDay":64,"dateTypes":{"module":"Module 7: React","general":{"type":"general","preClass":{"items":[{"name":"7.3: Using React with Express and Webpack","url":"https://bootcamp.rocketacademy.co/7-react/7.3-using-react-with-express-and-webpack"},{"name":"7.4: React State","url":"https://bootcamp.rocketacademy.co/7-react/7.4-react-state"}]},"inClass":{"items":[{"name":"7.ICE.3: React Cards","url":"https://bootcamp.rocketacademy.co/7-react/7.ice-in-class-exercises/7.ice.3-react-cards"}]},"postClass":{"items":[{"name":"7.POCE.2: React Tic Tac Toe","url":"https://bootcamp.rocketacademy.co/7-react/7.poce-post-class-exercises/7.poce.2-react-tic-tac-toe"}]},"dayIndex":64},"css":{"type":"css","preClass":{},"inClass":{},"postClass":{}},"algos":{"type":"algos","preClass":{},"inClass":{},"postClass":{"items":[{"name":"A.5.5: Linked Lists - Part 3","url":"https://bootcamp.rocketacademy.co/algorithms/a.5-data-structures/a.5.5-linked-lists#part-3"}]},"dayIndex":64},"ux":{"type":"ux","preClass":{},"inClass":{},"postClass":{}},"ip":{"type":"ip","ipDue":{},"preClass":{},"inClass":{},"postClass":{}},"projects":{"type":"projects","projectStart":{},"projectDue":{},"preClass":{},"inClass":{},"postClass":{}}}},"23-07-2022":{"courseDate":"23-07-2022","courseWeek":35,"weekDay":2,"dayNumber":6,"meetingDateTimeUTC":"2022-07-23T02:00:00.000Z","courseDay":65,"dateTypes":{"module":"Module 7: React","general":{"type":"general","preClass":{"items":[{"name":"7.5: Controlled Forms","url":"https://bootcamp.rocketacademy.co/7-react/7.5-controlled-forms"},{"name":"7.6: Passing Data Between Sibling Components","url":"https://bootcamp.rocketacademy.co/7-react/7.6-passing-data-between-sibling-components"}]},"inClass":{"items":[{"name":"7.ICE.4: Guess the Word","url":"https://bootcamp.rocketacademy.co/7-react/7.ice-in-class-exercises/7.ice.4-guess-the-word"}]},"postClass":{"items":[{"name":"7.POCE.3: Read Later","url":"https://bootcamp.rocketacademy.co/7-react/7.poce-post-class-exercises/7.poce.3-read-later"}]},"dayIndex":65},"css":{"type":"css","preClass":{},"inClass":{},"postClass":{}},"algos":{"type":"algos","preClass":{"items":[{"name":"A.6: Binary Search - Pre-Class","url":"https://bootcamp.rocketacademy.co/algorithms/a.6-binary-search#pre-class"}]},"inClass":{},"postClass":{},"dayIndex":65},"ux":{"type":"ux","preClass":{},"inClass":{},"postClass":{}},"ip":{"type":"ip","ipDue":{},"preClass":{},"inClass":{},"postClass":{}},"projects":{"type":"projects","projectStart":{},"projectDue":{},"preClass":{},"inClass":{},"postClass":{}}}},"26-07-2022":{"courseDate":"26-07-2022","courseWeek":36,"weekDay":1,"dayNumber":2,"meetingDateTimeUTC":"2022-07-26T11:30:00.000Z","courseDay":66,"dateTypes":{"module":"Module 7: React","general":{"type":"general","preClass":{"items":[{"name":"7.7: Designing Component Hierarchy","url":"https://bootcamp.rocketacademy.co/7-react/7.7-designing-component-hierarchy"},{"name":"7.7.1: AJAX Requests from Components","url":"https://bootcamp.rocketacademy.co/7-react/7.7-designing-component-hierarchy/7.7.1-ajax-requests-from-components"},{"name":"7.9: React Dev Tools","url":"https://bootcamp.rocketacademy.co/7-react/7.9-react-dev-tools"}]},"inClass":{"items":[{"name":"7.ICE.5: Create Item","url":"https://bootcamp.rocketacademy.co/7-react/7.ice-in-class-exercises/7.ice.5-create-item"}]},"postClass":{"items":[{"name":"7.POCE.3: Read Later","url":"https://bootcamp.rocketacademy.co/7-react/7.poce-post-class-exercises/7.poce.3-read-later"}]},"dayIndex":66},"css":{"type":"css","preClass":{},"inClass":{},"postClass":{}},"algos":{"type":"algos","preClass":{},"inClass":{},"postClass":{"items":[{"name":"A.6: Binary Search - Part 1 ","url":"https://bootcamp.rocketacademy.co/algorithms/a.6-binary-search#part-1"}]},"dayIndex":66},"ux":{"type":"ux","preClass":{},"inClass":{},"postClass":{}},"ip":{"type":"ip","ipDue":{},"preClass":{},"inClass":{},"postClass":{}},"projects":{"type":"projects","projectStart":{},"projectDue":{},"preClass":{},"inClass":{},"postClass":{}}}},"30-07-2022":{"courseDate":"30-07-2022","courseWeek":36,"weekDay":2,"dayNumber":6,"meetingDateTimeUTC":"2022-07-30T02:00:00.000Z","courseDay":67,"dateTypes":{"module":"Module 7: React","general":{"type":"general","preClass":{},"inClass":{"items":[{"name":"Review 7.POCE.3: Read Later","url":"https://bootcamp.rocketacademy.co/7-react/7.poce-post-class-exercises/7.poce.3-read-later"}]},"postClass":{"items":[{"name":"7.POCE.4: Hot Pot Bill Splitter","url":"https://bootcamp.rocketacademy.co/7-react/7.poce-post-class-exercises/7.poce.4-hot-pot-bill-splitter"}]},"dayIndex":67},"css":{"type":"css","preClass":{},"inClass":{},"postClass":{}},"algos":{"type":"algos","preClass":{},"inClass":{},"postClass":{},"dayIndex":67},"ux":{"type":"ux","preClass":{},"inClass":{},"postClass":{}},"ip":{"type":"ip","ipDue":{},"preClass":{},"inClass":{},"postClass":{}},"projects":{"type":"projects","projectStart":{"projectStart":{"items":[{"name":"Start: Project 4 Ideation Phase 1","url":"https://bootcamp.rocketacademy.co/projects/project-4-full-stack-react-app#ideation-phase-1"}]}},"projectDue":{},"preClass":{},"inClass":{},"postClass":{"items":[{"name":"Project 4 Ideation Phase 1","url":"https://bootcamp.rocketacademy.co/projects/project-4-full-stack-react-app#ideation-phase-1"}]},"dayIndex":67}}},"02-08-2022":{"courseDate":"02-08-2022","courseWeek":37,"weekDay":1,"dayNumber":2,"meetingDateTimeUTC":"2022-08-02T11:30:00.000Z","courseDay":68,"dateTypes":{"module":"Module 7: React","general":{"type":"general","preClass":{"items":[{"name":"7.7.2: useEffect","url":"https://bootcamp.rocketacademy.co/7-react/7.7-designing-component-hierarchy/7.7.2-useeffect"}]},"inClass":{},"postClass":{"items":[{"name":"7.POCE.4: Hot Pot Bill Splitter","url":"https://bootcamp.rocketacademy.co/7-react/7.poce-post-class-exercises/7.poce.4-hot-pot-bill-splitter"}]},"dayIndex":68},"css":{"type":"css","preClass":{},"inClass":{},"postClass":{}},"algos":{"type":"algos","preClass":{},"inClass":{},"postClass":{}},"ux":{"type":"ux","preClass":{},"inClass":{},"postClass":{}},"ip":{"type":"ip","ipDue":{},"preClass":{},"inClass":{},"postClass":{}},"projects":{"type":"projects","projectStart":{},"projectDue":{},"preClass":{},"inClass":{},"postClass":{"items":[{"name":"Project 4 Ideation Phase 1","url":"https://bootcamp.rocketacademy.co/projects/project-4-full-stack-react-app#ideation-phase-1"}]},"dayIndex":68}}},"06-08-2022":{"courseDate":"06-08-2022","courseWeek":37,"weekDay":2,"dayNumber":6,"meetingDateTimeUTC":"2022-08-06T02:00:00.000Z","courseDay":69,"dateTypes":{"module":"Module 7: React","general":{"type":"general","preClass":{"items":[{"name":"7.8: Error Boundaries","url":"https://bootcamp.rocketacademy.co/7-react/7.8-error-boundaries"}]},"inClass":{},"postClass":{"items":[{"name":"7.POCE.4: Hot Pot Bill Splitter","url":"https://bootcamp.rocketacademy.co/7-react/7.poce-post-class-exercises/7.poce.4-hot-pot-bill-splitter"}]},"dayIndex":69},"css":{"type":"css","preClass":{},"inClass":{},"postClass":{}},"algos":{"type":"algos","preClass":{"items":[{"name":"A.5.4: Queues - Pre-Class","url":"https://bootcamp.rocketacademy.co/algorithms/a.5-data-structures/a.5.4-queues#pre-class"}]},"inClass":{"items":[{"name":"A.5.4: Queues - Part 1","url":"https://bootcamp.rocketacademy.co/algorithms/a.5-data-structures/a.5.4-queues#part-1"}]},"postClass":{"items":[{"name":"A.5.4: Queues - Part 1","url":"https://bootcamp.rocketacademy.co/algorithms/a.5-data-structures/a.5.4-queues#part-1"}]},"dayIndex":69},"ux":{"type":"ux","preClass":{},"inClass":{},"postClass":{}},"ip":{"type":"ip","ipDue":{},"preClass":{},"inClass":{},"postClass":{}},"projects":{"type":"projects","projectStart":{},"projectDue":{},"preClass":{},"inClass":{},"postClass":{"items":[{"name":"Project 4 Ideation Phase 1","url":"https://bootcamp.rocketacademy.co/projects/project-4-full-stack-react-app#ideation-phase-1"}]},"dayIndex":69}}},"09-08-2022":{"courseDay":null,"courseDate":"09-08-2022","courseWeek":38,"dayNumber":2,"dateTypes":{"holidayType":"public holiday","date":"09-08-2022","location":"SG","name":"National Day"}},"13-08-2022":{"courseDate":"13-08-2022","courseWeek":38,"weekDay":1,"dayNumber":6,"meetingDateTimeUTC":"2022-08-13T02:00:0