{
  "daysOfWeek": [2, 6],
  "courseStartIndex": 1,
  "totalCourseDays": 96,
  "courseType": "Bootcamp PT",
  "days": {
    "12-03-2022": {
      "courseDate": "12-03-2022",
      "courseWeek": 1,
      "weekDay": 1,
      "dayNumber": 6,
      "meetingDateTimeUTC": "2022-03-12T02:00:00.000Z",
      "courseDay": 0,
      "dateTypes": {
        "module": "Module 1: Frontend Basics",
        "general": {
          "type": "general",
          "preClass": {},
          "inClass": {
            "items": [
              { "name": "Day 1 Photo!", "url": "" },
              { "name": "Course and Student Introductions", "url": "" }
            ]
          },
          "postClass": {}
        }
      }
    },
    "15-03-2022": {
      "courseDate": "15-03-2022",
      "courseWeek": 2,
      "weekDay": 1,
      "dayNumber": 2,
      "meetingDateTimeUTC": "2022-03-15T11:30:00.000Z",
      "courseDay": 1,
      "dateTypes": {
        "module": "Module 1: Basic Frontend",
        "general": {
          "type": "general",
          "preClass": {
            "items": [
              {
                "name": "Day 1 Coursework",
                "url": "https://swebootcamp.rocketacademy.co/module-1-basic-frontend/day-1"
              }
            ]
          },
          "inClass": {},
          "postClass": {}
        }
      }
    },
    "19-03-2022": {
      "courseDate": "19-03-2022",
      "courseWeek": 2,
      "weekDay": 2,
      "dayNumber": 6,
      "meetingDateTimeUTC": "2022-03-19T02:00:00.000Z",
      "courseDay": 2,
      "dateTypes": {
        "module": "Module 1: Basic Frontend",
        "general": {
          "type": "general",
          "preClass": {
            "items": [
              {
                "name": "Day 2 Coursework",
                "url": "https://swebootcamp.rocketacademy.co/module-1-basic-frontend/day-2"
              }
            ]
          },
          "inClass": {},
          "postClass": {}
        }
      }
    },
    "22-03-2022": {
      "courseDate": "22-03-2022",
      "courseWeek": 3,
      "weekDay": 1,
      "dayNumber": 2,
      "meetingDateTimeUTC": "2022-03-22T11:30:00.000Z",
      "courseDay": 3,
      "dateTypes": {
        "module": "Module 1: Basic Frontend",
        "general": {
          "type": "general",
          "preClass": {
            "items": [
              {
                "name": "Day 3 Coursework",
                "url": "https://swebootcamp.rocketacademy.co/module-1-basic-frontend/day-3"
              }
            ]
          },
          "inClass": {},
          "postClass": {}
        }
      }
    },
    "26-03-2022": {
      "courseDate": "26-03-2022",
      "courseWeek": 3,
      "weekDay": 2,
      "dayNumber": 6,
      "meetingDateTimeUTC": "2022-03-26T02:00:00.000Z",
      "courseDay": 4,
      "dateTypes": {
        "module": "Module 1: Basic Frontend",
        "general": {
          "type": "general",
          "preClass": {
            "items": [
              {
                "name": "Day 4 Coursework",
                "url": "https://swebootcamp.rocketacademy.co/module-1-basic-frontend/day-4"
              }
            ]
          },
          "inClass": {},
          "postClass": {}
        }
      }
    },
    "29-03-2022": {
      "courseDate": "29-03-2022",
      "courseWeek": 4,
      "weekDay": 1,
      "dayNumber": 2,
      "meetingDateTimeUTC": "2022-03-29T11:30:00.000Z",
      "courseDay": 5,
      "dateTypes": {
        "module": "Module 1: Basic Frontend",
        "general": {
          "type": "general",
          "preClass": {
            "items": [
              {
                "name": "Day 5 Coursework",
                "url": "https://swebootcamp.rocketacademy.co/module-1-basic-frontend/day-5"
              }
            ]
          },
          "inClass": {},
          "postClass": {}
        }
      }
    },
    "02-04-2022": {
      "courseDate": "02-04-2022",
      "courseWeek": 4,
      "weekDay": 2,
      "dayNumber": 6,
      "meetingDateTimeUTC": "2022-04-02T02:00:00.000Z",
      "courseDay": 6,
      "dateTypes": {
        "module": "Module 1: Basic Frontend",
        "general": {
          "type": "general",
          "preClass": {
            "items": [
              {
                "name": "Day 6 Coursework",
                "url": "https://swebootcamp.rocketacademy.co/module-1-basic-frontend/day-6"
              }
            ]
          },
          "inClass": {},
          "postClass": {}
        }
      }
    },
    "05-04-2022": {
      "courseDate": "05-04-2022",
      "courseWeek": 5,
      "weekDay": 1,
      "dayNumber": 2,
      "meetingDateTimeUTC": "2022-04-05T11:30:00.000Z",
      "courseDay": 7,
      "dateTypes": {
        "module": "Module 1: Basic Frontend",
        "general": {
          "type": "general",
          "preClass": {
            "items": [
              {
                "name": "Day 7 Coursework",
                "url": "https://swebootcamp.rocketacademy.co/module-1-basic-frontend/day-7"
              }
            ]
          },
          "inClass": {},
          "postClass": {}
        }
      }
    },
    "09-04-2022": {
      "courseDate": "09-04-2022",
      "courseWeek": 5,
      "weekDay": 2,
      "dayNumber": 6,
      "meetingDateTimeUTC": "2022-04-09T02:00:00.000Z",
      "courseDay": 8,
      "dateTypes": {
        "module": "Module 1: Basic Frontend",
        "general": {
          "type": "general",
          "preClass": {
            "items": [
              {
                "name": "Day 8 Coursework",
                "url": "https://swebootcamp.rocketacademy.co/module-1-basic-frontend/day-8"
              }
            ]
          },
          "inClass": {},
          "postClass": {}
        }
      }
    },
    "12-04-2022": {
      "courseDate": "12-04-2022",
      "courseWeek": 6,
      "weekDay": 1,
      "dayNumber": 2,
      "meetingDateTimeUTC": "2022-04-12T11:30:00.000Z",
      "courseDay": 9,
      "dateTypes": {
        "module": "Module 1: Basic Frontend",
        "general": {
          "type": "general",
          "preClass": {
            "items": [
              {
                "name": "Day 9 Coursework",
                "url": "https://swebootcamp.rocketacademy.co/module-1-basic-frontend/day-9"
              }
            ]
          },
          "inClass": {},
          "postClass": {}
        }
      }
    },
    "16-04-2022": {
      "courseDate": "16-04-2022",
      "courseWeek": 6,
      "weekDay": 2,
      "dayNumber": 6,
      "meetingDateTimeUTC": "2022-04-16T02:00:00.000Z",
      "courseDay": 10,
      "dateTypes": {
        "module": "Module 1: Basic Frontend",
        "general": {
          "type": "general",
          "preClass": {
            "items": [
              {
                "name": "Day 10 Coursework",
                "url": "https://swebootcamp.rocketacademy.co/module-1-basic-frontend/day-10"
              }
            ]
          },
          "inClass": {},
          "postClass": {}
        }
      }
    },
    "19-04-2022": {
      "courseDate": "19-04-2022",
      "courseWeek": 7,
      "weekDay": 1,
      "dayNumber": 2,
      "meetingDateTimeUTC": "2022-04-19T11:30:00.000Z",
      "courseDay": 11,
      "dateTypes": {
        "module": "Module 1: Basic Frontend",
        "general": {
          "type": "general",
          "preClass": {
            "items": [
              {
                "name": "Day 11 Coursework",
                "url": "https://swebootcamp.rocketacademy.co/module-1-basic-frontend/day-11"
              }
            ]
          },
          "inClass": {},
          "postClass": {}
        }
      }
    },
    "23-04-2022": {
      "courseDate": "23-04-2022",
      "courseWeek": 7,
      "weekDay": 2,
      "dayNumber": 6,
      "meetingDateTimeUTC": "2022-04-23T02:00:00.000Z",
      "courseDay": 12,
      "dateTypes": {
        "module": "Module 1: Basic Frontend",
        "general": {
          "type": "general",
          "preClass": {
            "items": [
              {
                "name": "Day 12 Coursework",
                "url": "https://swebootcamp.rocketacademy.co/module-1-basic-frontend/day-12"
              }
            ]
          },
          "inClass": {},
          "postClass": {}
        }
      }
    },
    "26-04-2022": {
      "courseDate": "26-04-2022",
      "courseWeek": 8,
      "weekDay": 1,
      "dayNumber": 2,
      "meetingDateTimeUTC": "2022-04-26T11:30:00.000Z",
      "courseDay": 13,
      "dateTypes": {
        "module": "Module 1: Basic Frontend",
        "general": {
          "type": "general",
          "preClass": {
            "items": [
              {
                "name": "Day 13 Coursework",
                "url": "https://swebootcamp.rocketacademy.co/module-1-basic-frontend/day-13"
              }
            ]
          },
          "inClass": {},
          "postClass": {}
        }
      }
    },
    "30-04-2022": {
      "courseDate": "30-04-2022",
      "courseWeek": 8,
      "weekDay": 2,
      "dayNumber": 6,
      "meetingDateTimeUTC": "2022-04-30T02:00:00.000Z",
      "courseDay": 14,
      "dateTypes": {
        "module": "Module 1: Basic Frontend",
        "general": {
          "type": "general",
          "preClass": {
            "items": [
              {
                "name": "Day 14 Coursework",
                "url": "https://swebootcamp.rocketacademy.co/module-1-basic-frontend/day-14"
              }
            ]
          },
          "inClass": {},
          "postClass": {}
        }
      }
    },
    "03-05-2022": {
      "courseDay": null,
      "courseDate": "03-05-2022",
      "courseWeek": 9,
      "dayNumber": 2,
      "dateTypes": {
        "holidayType": "public holiday",
        "date": "03-05-2022",
        "location": "SG",
        "name": "Labour Day (observed)"
      }
    },
    "07-05-2022": {
      "courseDate": "07-05-2022",
      "courseWeek": 9,
      "weekDay": 1,
      "dayNumber": 6,
      "meetingDateTimeUTC": "2022-05-07T02:00:00.000Z",
      "courseDay": 15,
      "dateTypes": {
        "module": "Module 1: Basic Frontend",
        "general": {
          "type": "general",
          "preClass": {
            "items": [
              {
                "name": "Day 15 Coursework",
                "url": "https://swebootcamp.rocketacademy.co/module-1-basic-frontend/day-15"
              }
            ]
          },
          "inClass": {},
          "postClass": {}
        }
      }
    },
    "10-05-2022": {
      "courseDate": "10-05-2022",
      "courseWeek": 10,
      "weekDay": 1,
      "dayNumber": 2,
      "meetingDateTimeUTC": "2022-05-10T11:30:00.000Z",
      "courseDay": 16,
      "dateTypes": {
        "module": "Module 1: Basic Frontend",
        "general": {
          "type": "general",
          "preClass": {
            "items": [
              {
                "name": "Day 16 Coursework",
                "url": "https://swebootcamp.rocketacademy.co/module-1-basic-frontend/day-16"
              }
            ]
          },
          "inClass": {},
          "postClass": {}
        }
      }
    },
    "14-05-2022": {
      "courseDate": "14-05-2022",
      "courseWeek": 10,
      "weekDay": 2,
      "dayNumber": 6,
      "meetingDateTimeUTC": "2022-05-14T02:00:00.000Z",
      "courseDay": 17,
      "dateTypes": {
        "module": "Module 2: Basic Backend",
        "general": {
          "type": "general",
          "preClass": {
            "items": [
              {
                "name": "Day 1 Coursework",
                "url": "https://swebootcamp.rocketacademy.co/module-2-basic-backend/day-1"
              }
            ]
          },
          "inClass": {},
          "postClass": {}
        }
      }
    },
    "17-05-2022": {
      "courseDate": "17-05-2022",
      "courseWeek": 11,
      "weekDay": 1,
      "dayNumber": 2,
      "meetingDateTimeUTC": "2022-05-17T11:30:00.000Z",
      "courseDay": 18,
      "dateTypes": {
        "module": "Module 2: Basic Backend",
        "general": {
          "type": "general",
          "preClass": {
            "items": [
              {
                "name": "Day 2 Coursework",
                "url": "https://swebootcamp.rocketacademy.co/module-2-basic-backend/day-2"
              }
            ]
          },
          "inClass": {},
          "postClass": {}
        }
      }
    },
    "21-05-2022": {
      "courseDate": "21-05-2022",
      "courseWeek": 11,
      "weekDay": 2,
      "dayNumber": 6,
      "meetingDateTimeUTC": "2022-05-21T02:00:00.000Z",
      "courseDay": 19,
      "dateTypes": {
        "module": "Module 2: Basic Backend",
        "general": {
          "type": "general",
          "preClass": {
            "items": [
              {
                "name": "Day 3 Coursework",
                "url": "https://swebootcamp.rocketacademy.co/module-2-basic-backend/day-3"
              }
            ]
          },
          "inClass": {},
          "postClass": {}
        }
      }
    },
    "24-05-2022": {
      "courseDate": "24-05-2022",
      "courseWeek": 12,
      "weekDay": 1,
      "dayNumber": 2,
      "meetingDateTimeUTC": "2022-05-24T11:30:00.000Z",
      "courseDay": 20,
      "dateTypes": {
        "module": "Module 2: Basic Backend",
        "general": {
          "type": "general",
          "preClass": {
            "items": [
              {
                "name": "Day 4 Coursework",
                "url": "https://swebootcamp.rocketacademy.co/module-2-basic-backend/day-4"
              }
            ]
          },
          "inClass": {},
          "postClass": {}
        }
      }
    },
    "28-05-2022": {
      "courseDate": "28-05-2022",
      "courseWeek": 12,
      "weekDay": 2,
      "dayNumber": 6,
      "meetingDateTimeUTC": "2022-05-28T02:00:00.000Z",
      "courseDay": 21,
      "dateTypes": {
        "module": "Module 2: Basic Backend",
        "general": {
          "type": "general",
          "preClass": {
            "items": [
              {
                "name": "Day 5 Coursework",
                "url": "https://swebootcamp.rocketacademy.co/module-2-basic-backend/day-5"
              }
            ]
          },
          "inClass": {},
          "postClass": {}
        }
      }
    },
    "31-05-2022": {
      "courseDate": "31-05-2022",
      "courseWeek": 13,
      "weekDay": 1,
      "dayNumber": 2,
      "meetingDateTimeUTC": "2022-05-31T11:30:00.000Z",
      "courseDay": 22,
      "dateTypes": {
        "module": "Module 2: Basic Backend",
        "general": {
          "type": "general",
          "preClass": {
            "items": [
              {
                "name": "Day 6 Coursework",
                "url": "https://swebootcamp.rocketacademy.co/module-2-basic-backend/day-6"
              }
            ]
          },
          "inClass": {},
          "postClass": {}
        }
      }
    },
    "04-06-2022": {
      "courseDate": "04-06-2022",
      "courseWeek": 13,
      "weekDay": 2,
      "dayNumber": 6,
      "meetingDateTimeUTC": "2022-06-04T02:00:00.000Z",
      "courseDay": 23,
      "dateTypes": {
        "module": "Module 2: Basic Backend",
        "general": {
          "type": "general",
          "preClass": {
            "items": [
              {
                "name": "Day 7 Coursework",
                "url": "https://swebootcamp.rocketacademy.co/module-2-basic-backend/day-7"
              }
            ]
          },
          "inClass": {},
          "postClass": {}
        }
      }
    },
    "07-06-2022": {
      "courseDate": "07-06-2022",
      "courseWeek": 14,
      "weekDay": 1,
      "dayNumber": 2,
      "meetingDateTimeUTC": "2022-06-07T11:30:00.000Z",
      "courseDay": 24,
      "dateTypes": {
        "module": "Module 2: Basic Backend",
        "general": {
          "type": "general",
          "preClass": {
            "items": [
              {
                "name": "Day 8 Coursework",
                "url": "https://swebootcamp.rocketacademy.co/module-2-basic-backend/day-8"
              }
            ]
          },
          "inClass": {},
          "postClass": {}
        }
      }
    },
    "11-06-2022": {
      "courseDate": "11-06-2022",
      "courseWeek": 14,
      "weekDay": 2,
      "dayNumber": 6,
      "meetingDateTimeUTC": "2022-06-11T02:00:00.000Z",
      "courseDay": 25,
      "dateTypes": {
        "module": "Module 2: Basic Backend",
        "general": {
          "type": "general",
          "preClass": {
            "items": [
              {
                "name": "Day 9 Coursework",
                "url": "https://swebootcamp.rocketacademy.co/module-2-basic-backend/day-9"
              }
            ]
          },
          "inClass": {},
          "postClass": {}
        }
      }
    },
    "14-06-2022": {
      "courseDate": "14-06-2022",
      "courseWeek": 15,
      "weekDay": 1,
      "dayNumber": 2,
      "meetingDateTimeUTC": "2022-06-14T11:30:00.000Z",
      "courseDay": 26,
      "dateTypes": {
        "module": "Module 2: Basic Backend",
        "general": {
          "type": "general",
          "preClass": {
            "items": [
              {
                "name": "Day 10 Coursework",
                "url": "https://swebootcamp.rocketacademy.co/module-2-basic-backend/day-10"
              }
            ]
          },
          "inClass": {},
          "postClass": {}
        }
      }
    },
    "18-06-2022": {
      "courseDate": "18-06-2022",
      "courseWeek": 15,
      "weekDay": 2,
      "dayNumber": 6,
      "meetingDateTimeUTC": "2022-06-18T02:00:00.000Z",
      "courseDay": 27,
      "dateTypes": {
        "module": "Module 2: Basic Backend",
        "general": {
          "type": "general",
          "preClass": {
            "items": [
              {
                "name": "Day 11 Coursework",
                "url": "https://swebootcamp.rocketacademy.co/module-2-basic-backend/day-11"
              }
            ]
          },
          "inClass": {},
          "postClass": {}
        }
      }
    },
    "21-06-2022": {
      "courseDate": "21-06-2022",
      "courseWeek": 16,
      "weekDay": 1,
      "dayNumber": 2,
      "meetingDateTimeUTC": "2022-06-21T11:30:00.000Z",
      "courseDay": 28,
      "dateTypes": {
        "module": "Module 2: Basic Backend",
        "general": {
          "type": "general",
          "preClass": {
            "items": [
              {
                "name": "Day 12 Coursework",
                "url": "https://swebootcamp.rocketacademy.co/module-2-basic-backend/day-12"
              }
            ]
          },
          "inClass": {},
          "postClass": {}
        }
      }
    },
    "25-06-2022": {
      "courseDate": "25-06-2022",
      "courseWeek": 16,
      "weekDay": 2,
      "dayNumber": 6,
      "meetingDateTimeUTC": "2022-06-25T02:00:00.000Z",
      "courseDay": 29,
      "dateTypes": {
        "module": "Module 2: Basic Backend",
        "general": {
          "type": "general",
          "preClass": {
            "items": [
              {
                "name": "Day 13 Coursework",
                "url": "https://swebootcamp.rocketacademy.co/module-2-basic-backend/day-13"
              }
            ]
          },
          "inClass": {},
          "postClass": {}
        }
      }
    },
    "28-06-2022": {
      "courseDate": "28-06-2022",
      "courseWeek": 17,
      "weekDay": 1,
      "dayNumber": 2,
      "meetingDateTimeUTC": "2022-06-28T11:30:00.000Z",
      "courseDay": 30,
      "dateTypes": {
        "module": "Module 2: Basic Backend",
        "general": {
          "type": "general",
          "preClass": {
            "items": [
              {
                "name": "Day 14 Coursework",
                "url": "https://swebootcamp.rocketacademy.co/module-2-basic-backend/day-14"
              }
            ]
          },
          "inClass": {},
          "postClass": {}
        }
      }
    },
    "02-07-2022": {
      "courseDate": "02-07-2022",
      "courseWeek": 17,
      "weekDay": 2,
      "dayNumber": 6,
      "meetingDateTimeUTC": "2022-07-02T02:00:00.000Z",
      "courseDay": 31,
      "dateTypes": {
        "module": "Module 2: Basic Backend",
        "general": {
          "type": "general",
          "preClass": {
            "items": [
              {
                "name": "Day 15 Coursework",
                "url": "https://swebootcamp.rocketacademy.co/module-2-basic-backend/day-15"
              }
            ]
          },
          "inClass": {},
          "postClass": {}
        }
      }
    },
    "05-07-2022": {
      "courseDate": "05-07-2022",
      "courseWeek": 18,
      "weekDay": 1,
      "dayNumber": 2,
      "meetingDateTimeUTC": "2022-07-05T11:30:00.000Z",
      "courseDay": 32,
      "dateTypes": {
        "module": "Module 2: Basic Backend",
        "general": {
          "type": "general",
          "preClass": {
            "items": [
              {
                "name": "Day 16 Coursework",
                "url": "https://swebootcamp.rocketacademy.co/module-2-basic-backend/day-16"
              }
            ]
          },
          "inClass": {},
          "postClass": {}
        }
      }
    },
    "09-07-2022": {
      "courseDay": null,
      "courseDate": "09-07-2022",
      "courseWeek": 18,
      "dayNumber": 6,
      "dateTypes": {
        "holidayType": "public holiday",
        "date": "09-07-2022",
        "location": "SG",
        "name": "Hari Raya Haji"
      }
    },
    "12-07-2022": {
      "courseDate": "12-07-2022",
      "courseWeek": 19,
      "weekDay": 1,
      "dayNumber": 2,
      "meetingDateTimeUTC": "2022-07-12T11:30:00.000Z",
      "courseDay": 33,
      "dateTypes": {
        "module": "Module 3: Advanced Backend and Full Stack",
        "general": {
          "type": "general",
          "preClass": {
            "items": [
              {
                "name": "Day 1 Coursework",
                "url": "https://swebootcamp.rocketacademy.co/module-3-advanced-backend-and-full-stack/day-1"
              }
            ]
          },
          "inClass": {},
          "postClass": {}
        }
      }
    },
    "16-07-2022": {
      "courseDate": "16-07-2022",
      "courseWeek": 19,
      "weekDay": 2,
      "dayNumber": 6,
      "meetingDateTimeUTC": "2022-07-16T02:00:00.000Z",
      "courseDay": 34,
      "dateTypes": {
        "module": "Module 3: Advanced Backend and Full Stack",
        "general": {
          "type": "general",
          "preClass": {
            "items": [
              {
                "name": "Day 2 Coursework",
                "url": "https://swebootcamp.rocketacademy.co/module-3-advanced-backend-and-full-stack/day-2"
              },
              {
                "name": "Algo Day 1",
                "url": "https://swebootcamp.rocketacademy.co/algorithms/algos/day-1"
              }
            ]
          },
          "inClass": {},
          "postClass": {}
        }
      }
    },
    "19-07-2022": {
      "courseDate": "19-07-2022",
      "courseWeek": 20,
      "weekDay": 1,
      "dayNumber": 2,
      "meetingDateTimeUTC": "2022-07-19T11:30:00.000Z",
      "courseDay": 35,
      "dateTypes": {
        "module": "Module 3: Advanced Backend and Full Stack",
        "general": {
          "type": "general",
          "preClass": {
            "items": [
              {
                "name": "Day 3 Coursework",
                "url": "https://swebootcamp.rocketacademy.co/module-3-advanced-backend-and-full-stack/day-3"
              },
              {
                "name": "Algo Day 2",
                "url": "https://swebootcamp.rocketacademy.co/algorithms/algos/day-2"
              }
            ]
          },
          "inClass": {},
          "postClass": {}
        }
      }
    },
    "23-07-2022": {
      "courseDate": "23-07-2022",
      "courseWeek": 20,
      "weekDay": 2,
      "dayNumber": 6,
      "meetingDateTimeUTC": "2022-07-23T02:00:00.000Z",
      "courseDay": 36,
      "dateTypes": {
        "module": "Module 3: Advanced Backend and Full Stack",
        "general": {
          "type": "general",
          "preClass": {
            "items": [
              {
                "name": "Day 4 Coursework",
                "url": "https://swebootcamp.rocketacademy.co/module-3-advanced-backend-and-full-stack/day-4"
              }
            ]
          },
          "inClass": {},
          "postClass": {}
        }
      }
    },
    "26-07-2022": {
      "courseDate": "26-07-2022",
      "courseWeek": 21,
      "weekDay": 1,
      "dayNumber": 2,
      "meetingDateTimeUTC": "2022-07-26T11:30:00.000Z",
      "courseDay": 37,
      "dateTypes": {
        "module": "Module 3: Advanced Backend and Full Stack",
        "general": {
          "type": "general",
          "preClass": {
            "items": [
              {
                "name": "Day 5 Coursework",
                "url": "https://swebootcamp.rocketacademy.co/module-3-advanced-backend-and-full-stack/day-5"
              },
              {
                "name": "Algo Day 3",
                "url": "https://swebootcamp.rocketacademy.co/algorithms/algos/day-3"
              }
            ]
          },
          "inClass": {},
          "postClass": {}
        }
      }
    },
    "30-07-2022": {
      "courseDate": "30-07-2022",
      "courseWeek": 21,
      "weekDay": 2,
      "dayNumber": 6,
      "meetingDateTimeUTC": "2022-07-30T02:00:00.000Z",
      "courseDay": 38,
      "dateTypes": {
        "module": "Module 3: Advanced Backend and Full Stack",
        "general": {
          "type": "general",
          "preClass": {
            "items": [
              {
                "name": "Day 6 Coursework",
                "url": "https://swebootcamp.rocketacademy.co/module-3-advanced-backend-and-full-stack/day-6"
              },
              {
                "name": "Algo Day 4",
                "url": "https://swebootcamp.rocketacademy.co/algorithms/algos/day-4"
              }
            ]
          },
          "inClass": {},
          "postClass": {}
        }
      }
    },
    "02-08-2022": {
      "courseDate": "02-08-2022",
      "courseWeek": 22,
      "weekDay": 1,
      "dayNumber": 2,
      "meetingDateTimeUTC": "2022-08-02T11:30:00.000Z",
      "courseDay": 39,
      "dateTypes": {
        "module": "Module 3: Advanced Backend and Full Stack",
        "general": {
          "type": "general",
          "preClass": {
            "items": [
              {
                "name": "Day 7 Coursework",
                "url": "https://swebootcamp.rocketacademy.co/module-3-advanced-backend-and-full-stack/day-7"
              }
            ]
          },
          "inClass": {},
          "postClass": {}
        }
      }
    },
    "06-08-2022": {
      "courseDate": "06-08-2022",
      "courseWeek": 22,
      "weekDay": 2,
      "dayNumber": 6,
      "meetingDateTimeUTC": "2022-08-06T02:00:00.000Z",
      "courseDay": 40,
      "dateTypes": {
        "module": "Module 3: Advanced Backend and Full Stack",
        "general": {
          "type": "general",
          "preClass": {
            "items": [
              {
                "name": "Day 8 Coursework",
                "url": "https://swebootcamp.rocketacademy.co/module-3-advanced-backend-and-full-stack/day-8"
              },
              {
                "name": "Algo Day 5",
                "url": "https://swebootcamp.rocketacademy.co/algorithms/algos/day-5"
              }
            ]
          },
          "inClass": {},
          "postClass": {}
        }
      }
    },
    "09-08-2022": {
      "courseDay": null,
      "courseDate": "09-08-2022",
      "courseWeek": 23,
      "dayNumber": 2,
      "dateTypes": {
        "holidayType": "public holiday",
        "date": "09-08-2022",
        "location": "SG",
        "name": "National Day"
      }
    },
    "13-08-2022": {
      "courseDate": "13-08-2022",
      "courseWeek": 23,
      "weekDay": 1,
      "dayNumber": 6,
      "meetingDateTimeUTC": "2022-08-13T02:00:00.000Z",
      "courseDay": 41,
      "dateTypes": {
        "module": "Module 3: Advanced Backend and Full Stack",
        "general": {
          "type": "general",
          "preClass": {
            "items": [
              {
                "name": "Day 9 Coursework",
                "url": "https://swebootcamp.rocketacademy.co/module-3-advanced-backend-and-full-stack/day-9"
              },
              {
                "name": "Algo Day 6",
                "url": "https://swebootcamp.rocketacademy.co/algorithms/algos/day-6"
              }
            ]
          },
          "inClass": {},
          "postClass": {}
        }
      }
    },
    "16-08-2022": {
      "courseDate": "16-08-2022",
      "courseWeek": 24,
      "weekDay": 1,
      "dayNumber": 2,
      "meetingDateTimeUTC": "2022-08-16T11:30:00.000Z",
      "courseDay": 42,
      "dateTypes": {
        "module": "Module 3: Advanced Backend and Full Stack",
        "general": {
          "type": "general",
          "preClass": {
            "items": [
              {
                "name": "Day 10 Coursework",
                "url": "https://swebootcamp.rocketacademy.co/module-3-advanced-backend-and-full-stack/day-10"
              }
            ]
          },
          "inClass": {},
          "postClass": {}
        }
      }
    },
    "20-08-2022": {
      "courseDate": "20-08-2022",
      "courseWeek": 24,
      "weekDay": 2,
      "dayNumber": 6,
      "meetingDateTimeUTC": "2022-08-20T02:00:00.000Z",
      "courseDay": 43,
      "dateTypes": {
        "module": "Module 3: Advanced Backend and Full Stack",
        "general": {
          "type": "general",
          "preClass": {
            "items": [
              {
                "name": "Day 11 Coursework",
                "url": "https://swebootcamp.rocketacademy.co/module-3-advanced-backend-and-full-stack/day-11"
              },
              {
                "name": "Algo Day 7",
                "url": "https://swebootcamp.rocketacademy.co/algorithms/algos/day-7"
              }
            ]
          },
          "inClass": {},
          "postClass": {}
        }
      }
    },
    "23-08-2022": {
      "courseDate": "23-08-2022",
      "courseWeek": 25,
      "weekDay": 1,
      "dayNumber": 2,
      "meetingDateTimeUTC": "2022-08-23T11:30:00.000Z",
      "courseDay": 44,
      "dateTypes": {
        "module": "Module 3: Advanced Backend and Full Stack",
        "general": {
          "type": "general",
          "preClass": {
            "items": [
              {
                "name": "Day 12 Coursework",
                "url": "https://swebootcamp.rocketacademy.co/module-3-advanced-backend-and-full-stack/day-12"
              },
              {
                "name": "Algo Day 8",
                "url": "https://swebootcamp.rocketacademy.co/algorithms/algos/day-8"
              }
            ]
          },
          "inClass": {},
          "postClass": {}
        }
      }
    },
    "27-08-2022": {
      "courseDate": "27-08-2022",
      "courseWeek": 25,
      "weekDay": 2,
      "dayNumber": 6,
      "meetingDateTimeUTC": "2022-08-27T02:00:00.000Z",
      "courseDay": 45,
      "dateTypes": {
        "module": "Module 3: Advanced Backend and Full Stack",
        "general": {
          "type": "general",
          "preClass": {
            "items": [
              {
                "name": "Day 13 Coursework",
                "url": "https://swebootcamp.rocketacademy.co/module-3-advanced-backend-and-full-stack/day-13"
              }
            ]
          },
          "inClass": {},
          "postClass": {}
        }
      }
    },
    "30-08-2022": {
      "courseDate": "30-08-2022",
      "courseWeek": 26,
      "weekDay": 1,
      "dayNumber": 2,
      "meetingDateTimeUTC": "2022-08-30T11:30:00.000Z",
      "courseDay": 46,
      "dateTypes": {
        "module": "Module 3: Advanced Backend and Full Stack",
        "general": {
          "type": "general",
          "preClass": {
            "items": [
              {
                "name": "Day 14 Coursework",
                "url": "https://swebootcamp.rocketacademy.co/module-3-advanced-backend-and-full-stack/day-14"
              },
              {
                "name": "Algo Day 9",
                "url": "https://swebootcamp.rocketacademy.co/algorithms/algos/day-9"
              }
            ]
          },
          "inClass": {},
          "postClass": {}
        }
      }
    },
    "03-09-2022": {
      "courseDate": "03-09-2022",
      "courseWeek": 26,
      "weekDay": 2,
      "dayNumber": 6,
      "meetingDateTimeUTC": "2022-09-03T02:00:00.000Z",
      "courseDay": 47,
      "dateTypes": {
        "module": "Module 3: Advanced Backend and Full Stack",
        "general": {
          "type": "general",
          "preClass": {
            "items": [
              {
                "name": "Day 15 Coursework",
                "url": "https://swebootcamp.rocketacademy.co/module-3-advanced-backend-and-full-stack/day-15"
              },
              {
                "name": "Algo Day 10",
                "url": "https://swebootcamp.rocketacademy.co/algorithms/algos/day-10"
              }
            ]
          },
          "inClass": {},
          "postClass": {}
        }
      }
    },
    "06-09-2022": {
      "courseDate": "06-09-2022",
      "courseWeek": 27,
      "weekDay": 1,
      "dayNumber": 2,
      "meetingDateTimeUTC": "2022-09-06T11:30:00.000Z",
      "courseDay": 48,
      "dateTypes": {
        "module": "Module 3: Advanced Backend and Full Stack",
        "general": {
          "type": "general",
          "preClass": {
            "items": [
              {
                "name": "Day 16 Coursework",
                "url": "https://swebootcamp.rocketacademy.co/module-3-advanced-backend-and-full-stack/day-16"
              }
            ]
          },
          "inClass": {},
          "postClass": {}
        }
      }
    },
    "10-09-2022": {
      "courseDate": "10-09-2022",
      "courseWeek": 27,
      "weekDay": 2,
      "dayNumber": 6,
      "meetingDateTimeUTC": "2022-09-10T02:00:00.000Z",
      "courseDay": 49,
      "dateTypes": {
        "module": "Module 4: Frontend Framework - React",
        "general": {
          "type": "general",
          "preClass": {
            "items": [
              {
                "name": "Day 1 Coursework",
                "url": "https://swebootcamp.rocketacademy.co/module-4-frontend-framework-react/day-1"
              },
              {
                "name": "Algo Day 11",
                "url": "https://swebootcamp.rocketacademy.co/algorithms/algos/day-11"
              }
            ]
          },
          "inClass": {},
          "postClass": {}
        }
      }
    },
    "13-09-2022": {
      "courseDate": "13-09-2022",
      "courseWeek": 28,
      "weekDay": 1,
      "dayNumber": 2,
      "meetingDateTimeUTC": "2022-09-13T11:30:00.000Z",
      "courseDay": 50,
      "dateTypes": {
        "module": "Module 4: Frontend Framework - React",
        "general": {
          "type": "general",
          "preClass": {
            "items": [
              {
                "name": "Day 2 Coursework",
                "url": "https://swebootcamp.rocketacademy.co/module-4-frontend-framework-react/day-2"
              },
              {
                "name": "Algo Day 12",
                "url": "https://swebootcamp.rocketacademy.co/algorithms/algos/day-12"
              }
            ]
          },
          "inClass": {},
          "postClass": {}
        }
      }
    },
    "17-09-2022": {
      "courseDate": "17-09-2022",
      "courseWeek": 28,
      "weekDay": 2,
      "dayNumber": 6,
      "meetingDateTimeUTC": "2022-09-17T02:00:00.000Z",
      "courseDay": 51,
      "dateTypes": {
        "module": "Module 4: Frontend Framework - React",
        "general": {
          "type": "general",
          "preClass": {
            "items": [
              {
                "name": "Day 3 Coursework",
                "url": "https://swebootcamp.rocketacademy.co/module-4-frontend-framework-react/day-3"
              }
            ]
          },
          "inClass": {},
          "postClass": {}
        }
      }
    },
    "20-09-2022": {
      "courseDate": "20-09-2022",
      "courseWeek": 29,
      "weekDay": 1,
      "dayNumber": 2,
      "meetingDateTimeUTC": "2022-09-20T11:30:00.000Z",
      "courseDay": 52,
      "dateTypes": {
        "module": "Module 4: Frontend Framework - React",
        "general": {
          "type": "general",
          "preClass": {
            "items": [
              {
                "name": "Day 4 Coursework",
                "url": "https://swebootcamp.rocketacademy.co/module-4-frontend-framework-react/day-4"
              },
              {
                "name": "Algo Day 13",
                "url": "https://swebootcamp.rocketacademy.co/algorithms/algos/day-13"
              }
            ]
          },
          "inClass": {},
          "postClass": {}
        }
      }
    },
    "24-09-2022": {
      "courseDate": "24-09-2022",
      "courseWeek": 29,
      "weekDay": 2,
      "dayNumber": 6,
      "meetingDateTimeUTC": "2022-09-24T02:00:00.000Z",
      "courseDay": 53,
      "dateTypes": {
        "module": "Module 4: Frontend Framework - React",
        "general": {
          "type": "general",
          "preClass": {
            "items": [
              {
                "name": "Day 5 Coursework",
                "url": "https://swebootcamp.rocketacademy.co/module-4-frontend-framework-react/day-5"
              },
              {
                "name": "Algo Day 14",
                "url": "https://swebootcamp.rocketacademy.co/algorithms/algos/day-14"
              }
            ]
          },
          "inClass": {},
          "postClass": {}
        }
      }
    },
    "27-09-2022": {
      "courseDate": "27-09-2022",
      "courseWeek": 30,
      "weekDay": 1,
      "dayNumber": 2,
      "meetingDateTimeUTC": "2022-09-27T11:30:00.000Z",
      "courseDay": 54,
      "dateTypes": {
        "module": "Module 4: Frontend Framework - React",
        "general": {
          "type": "general",
          "preClass": {
            "items": [
              {
                "name": "Day 6 Coursework",
                "url": "https://swebootcamp.rocketacademy.co/module-4-frontend-framework-react/day-6"
              }
            ]
          },
          "inClass": {},
          "postClass": {}
        }
      }
    },
    "01-10-2022": {
      "courseDate": "01-10-2022",
      "courseWeek": 30,
      "weekDay": 2,
      "dayNumber": 6,
      "meetingDateTimeUTC": "2022-10-01T02:00:00.000Z",
      "courseDay": 55,
      "dateTypes": {
        "module": "Module 4: Frontend Framework - React",
        "general": {
          "type": "general",
          "preClass": {
            "items": [
              {
                "name": "Day 7 Coursework",
                "url": "https://swebootcamp.rocketacademy.co/module-4-frontend-framework-react/day-7"
              },
              {
                "name": "Algo Day 15",
                "url": "https://swebootcamp.rocketacademy.co/algorithms/algos/day-15"
              }
            ]
          },
          "inClass": {},
          "postClass": {}
        }
      }
    },
    "04-10-2022": {
      "courseDate": "04-10-2022",
      "courseWeek": 31,
      "weekDay": 1,
      "dayNumber": 2,
      "meetingDateTimeUTC": "2022-10-04T11:30:00.000Z",
      "courseDay": 56,
      "dateTypes": {
        "module": "Module 4: Frontend Framework - React",
        "general": {
          "type": "general",
          "preClass": {
            "items": [
              {
                "name": "Day 8 Coursework",
                "url": "https://swebootcamp.rocketacademy.co/module-4-frontend-framework-react/day-8"
              },
              {
                "name": "Algo Day 16",
                "url": "https://swebootcamp.rocketacademy.co/algorithms/algos/day-16"
              }
            ]
          },
          "inClass": {},
          "postClass": {}
        }
      }
    },
    "08-10-2022": {
      "courseDate": "08-10-2022",
      "courseWeek": 31,
      "weekDay": 2,
      "dayNumber": 6,
      "meetingDateTimeUTC": "2022-10-08T02:00:00.000Z",
      "courseDay": 57,
      "dateTypes": {
        "module": "Module 4: Frontend Framework - React",
        "general": {
          "type": "general",
          "preClass": {
            "items": [
              {
                "name": "Day 9 Coursework",
                "url": "https://swebootcamp.rocketacademy.co/module-4-frontend-framework-react/day-9"
              }
            ]
          },
          "inClass": {},
          "postClass": {}
        }
      }
    },
    "11-10-2022": {
      "courseDate": "11-10-2022",
      "courseWeek": 32,
      "weekDay": 1,
      "dayNumber": 2,
      "meetingDateTimeUTC": "2022-10-11T11:30:00.000Z",
      "courseDay": 58,
      "dateTypes": {
        "module": "Module 4: Frontend Framework - React",
        "general": {
          "type": "general",
          "preClass": {
            "items": [
              {
                "name": "Day 10 Coursework",
                "url": "https://swebootcamp.rocketacademy.co/module-4-frontend-framework-react/day-10"
              },
              {
                "name": "Algo Day 17",
                "url": "https://swebootcamp.rocketacademy.co/algorithms/algos/day-17"
              }
            ]
          },
          "inClass": {},
          "postClass": {}
        }
      }
    },
    "15-10-2022": {
      "courseDate": "15-10-2022",
      "courseWeek": 32,
      "weekDay": 2,
      "dayNumber": 6,
      "meetingDateTimeUTC": "2022-10-15T02:00:00.000Z",
      "courseDay": 59,
      "dateTypes": {
        "module": "Module 4: Frontend Framework - React",
        "general": {
          "type": "general",
          "preClass": {
            "items": [
              {
                "name": "Day 11 Coursework",
                "url": "https://swebootcamp.rocketacademy.co/module-4-frontend-framework-react/day-11"
              },
              {
                "name": "Algo Day 18",
                "url": "https://swebootcamp.rocketacademy.co/algorithms/algos/day-18"
              }
            ]
          },
          "inClass": {},
          "postClass": {}
        }
      }
    },
    "18-10-2022": {
      "courseDate": "18-10-2022",
      "courseWeek": 33,
      "weekDay": 1,
      "dayNumber": 2,
      "meetingDateTimeUTC": "2022-10-18T11:30:00.000Z",
      "courseDay": 60,
      "dateTypes": {
        "module": "Module 4: Frontend Framework - React",
        "general": {
          "type": "general",
          "preClass": {
            "items": [
              {
                "name": "Day 12 Coursework",
                "url": "https://swebootcamp.rocketacademy.co/module-4-frontend-framework-react/day-12"
              }
            ]
          },
          "inClass": {},
          "postClass": {}
        }
      }
    },
    "22-10-2022": {
      "courseDate": "22-10-2022",
      "courseWeek": 33,
      "weekDay": 2,
      "dayNumber": 6,
      "meetingDateTimeUTC": "2022-10-22T02:00:00.000Z",
      "courseDay": 61,
      "dateTypes": {
        "module": "Module 4: Frontend Framework - React",
        "general": {
          "type": "general",
          "preClass": {
            "items": [
              {
                "name": "Day 13 Coursework",
                "url": "https://swebootcamp.rocketacademy.co/module-4-frontend-framework-react/day-13"
              },
              {
                "name": "Algo Day 19",
                "url": "https://swebootcamp.rocketacademy.co/algorithms/algos/day-19"
              }
            ]
          },
          "inClass": {},
          "postClass": {}
        }
      }
    },
    "25-10-2022": {
      "courseDate": "25-10-2022",
      "courseWeek": 34,
      "weekDay": 1,
      "dayNumber": 2,
      "meetingDateTimeUTC": "2022-10-25T11:30:00.000Z",
      "courseDay": 62,
      "dateTypes": {
        "module": "Module 4: Frontend Framework - React",
        "general": {
          "type": "general",
          "preClass": {
            "items": [
              {
                "name": "Day 14 Coursework",
                "url": "https://swebootcamp.rocketacademy.co/module-4-frontend-framework-react/day-14"
              },
              {
                "name": "Algo Day 20",
                "url": "https://swebootcamp.rocketacademy.co/algorithms/algos/day-20"
              }
            ]
          },
          "inClass": {},
          "postClass": {}
        }
      }
    },
    "29-10-2022": {
      "courseDate": "29-10-2022",
      "courseWeek": 34,
      "weekDay": 2,
      "dayNumber": 6,
      "meetingDateTimeUTC": "2022-10-29T02:00:00.000Z",
      "courseDay": 63,
      "dateTypes": {
        "module": "Module 4: Frontend Framework - React",
        "general": {
          "type": "general",
          "preClass": {
            "items": [
              {
                "name": "Day 15 Coursework",
                "url": "https://swebootcamp.rocketacademy.co/module-4-frontend-framework-react/day-15"
              }
            ]
          },
          "inClass": {},
          "postClass": {}
        }
      }
    },
    "01-11-2022": {
      "courseDate": "01-11-2022",
      "courseWeek": 35,
      "weekDay": 1,
      "dayNumber": 2,
      "meetingDateTimeUTC": "2022-11-01T11:30:00.000Z",
      "courseDay": 64,
      "dateTypes": {
        "module": "Module 4: Frontend Framework - React",
        "general": {
          "type": "general",
          "preClass": {
            "items": [
              {
                "name": "Day 16 Coursework",
                "url": "https://swebootcamp.rocketacademy.co/module-4-frontend-framework-react/day-16"
              },
              {
                "name": "Algo Day 21",
                "url": "https://swebootcamp.rocketacademy.co/algorithms/algos/day-21"
              }
            ]
          },
          "inClass": {},
          "postClass": {}
        }
      }
    },
    "05-11-2022": {
      "courseDate": "05-11-2022",
      "courseWeek": 35,
      "weekDay": 2,
      "dayNumber": 6,
      "meetingDateTimeUTC": "2022-11-05T02:00:00.000Z",
      "courseDay": 65,
      "dateTypes": {
        "module": "Module 5: Advanced React",
        "general": {
          "type": "general",
          "preClass": {
            "items": [
              {
                "name": "Day 1 Coursework",
                "url": "https://swebootcamp.rocketacademy.co/module-5-advanced-react/day-1"
              },
              {
                "name": "Algo Day 22",
                "url": "https://swebootcamp.rocketacademy.co/algorithms/algos/day-22"
              }
            ]
          },
          "inClass": {},
          "postClass": {}
        }
      }
    },
    "08-11-2022": {
      "courseDate": "08-11-2022",
      "courseWeek": 36,
      "weekDay": 1,
      "dayNumber": 2,
      "meetingDateTimeUTC": "2022-11-08T11:30:00.000Z",
      "courseDay": 66,
      "dateTypes": {
        "module": "Module 5: Advanced React",
        "general": {
          "type": "general",
          "preClass": {
            "items": [
              {
                "name": "Day 2 Coursework",
                "url": "https://swebootcamp.rocketacademy.co/module-5-advanced-react/day-2"
              }
            ]
          },
          "inClass": {},
          "postClass": {}
        }
      }
    },
    "12-11-2022": {
      "courseDate": "12-11-2022",
      "courseWeek": 36,
      "weekDay": 2,
      "dayNumber": 6,
      "meetingDateTimeUTC": "2022-11-12T02:00:00.000Z",
      "courseDay": 67,
      "dateTypes": {
        "module": "Module 5: Advanced React",
        "general": {
          "type": "general",
          "preClass": {
            "items": [
              {
                "name": "Day 3 Coursework",
                "url": "https://swebootcamp.rocketacademy.co/module-5-advanced-react/day-3"
              },
              {
                "name": "Algo Day 23",
                "url": "https://swebootcamp.rocketacademy.co/algorithms/algos/day-23"
              }
            ]
          },
          "inClass": {},
          "postClass": {}
        }
      }
    },
    "15-11-2022": {
      "courseDate": "15-11-2022",
      "courseWeek": 37,
      "weekDay": 1,
      "dayNumber": 2,
      "meetingDateTimeUTC": "2022-11-15T11:30:00.000Z",
      "courseDay": 68,
      "dateTypes": {
        "module": "Module 5: Advanced React",
        "general": {
          "type": "general",
          "preClass": {
            "items": [
              {
                "name": "Day 4 Coursework",
                "url": "https://swebootcamp.rocketacademy.co/module-5-advanced-react/day-4"
              },
              {
                "name": "Algo Day 24",
                "url": "https://swebootcamp.rocketacademy.co/algorithms/algos/day-24"
              }
            ]
          },
          "inClass": {},
          "postClass": {}
        }
      }
    },
    "19-11-2022": {
      "courseDate": "19-11-2022",
      "courseWeek": 37,
      "weekDay": 2,
      "dayNumber": 6,
      "meetingDateTimeUTC": "2022-11-19T02:00:00.000Z",
      "courseDay": 69,
      "dateTypes": {
        "module": "Module 5: Advanced React",
        "general": {
          "type": "general",
          "preClass": {
            "items": [
              {
                "name": "Day 5 Coursework",
                "url": "https://swebootcamp.rocketacademy.co/module-5-advanced-react/day-5"
              }
            ]
          },
          "inClass": {},
          "postClass": {}
        }
      }
    },
    "22-11-2022": {
      "courseDate": "22-11-2022",
      "courseWeek": 38,
      "weekDay": 1,
      "dayNumber": 2,
      "meetingDateTimeUTC": "2022-11-22T11:30:00.000Z",
      "courseDay": 70,
      "dateTypes": {
        "module": "Module 5: Advanced React",
        "general": {
          "type": "general",
          "preClass": {
            "items": [
              {
                "name": "Day 6 Coursework",
                "url": "https://swebootcamp.rocketacademy.co/module-5-advanced-react/day-6"
              },
              {
                "name": "Algo Day 25",
                "url": "https://swebootcamp.rocketacademy.co/algorithms/algos/day-25"
              }
            ]
          },
          "inClass": {},
          "postClass": {}
        }
      }
    },
    "26-11-2022": {
      "courseDate": "26-11-2022",
      "courseWeek": 38,
      "weekDay": 2,
      "dayNumber": 6,
      "meetingDateTimeUTC": "2022-11-26T02:00:00.000Z",
      "courseDay": 71,
      "dateTypes": {
        "module": "Module 5: Advanced React",
        "general": {
          "type": "general",
          "preClass": {
            "items": [
              {
                "name": "Day 7 Coursework",
                "url": "https://swebootcamp.rocketacademy.co/module-5-advanced-react/day-7"
              },
              {
                "name": "Algo Day 26",
                "url": "https://swebootcamp.rocketacademy.co/algorithms/algos/day-26"
              }
            ]
          },
          "inClass": {},
          "postClass": {}
        }
      }
    },
    "29-11-2022": {
      "courseDate": "29-11-2022",
      "courseWeek": 39,
      "weekDay": 1,
      "dayNumber": 2,
      "meetingDateTimeUTC": "2022-11-29T11:30:00.000Z",
      "courseDay": 72,
      "dateTypes": {
        "module": "Module 5: Advanced React",
        "general": {
          "type": "general",
          "preClass": {
            "items": [
              {
                "name": "Day 8 Coursework",
                "url": "https://swebootcamp.rocketacademy.co/module-5-advanced-react/day-8"
              }
            ]
          },
          "inClass": {},
          "postClass": {}
        }
      }
    },
    "03-12-2022": {
      "courseDate": "03-12-2022",
      "courseWeek": 39,
      "weekDay": 2,
      "dayNumber": 6,
      "meetingDateTimeUTC": "2022-12-03T02:00:00.000Z",
      "courseDay": 73,
      "dateTypes": {
        "module": "Module 5: Advanced React",
        "general": {
          "type": "general",
          "preClass": {
            "items": [
              {
                "name": "Day 9 Coursework",
                "url": "https://swebootcamp.rocketacademy.co/module-5-advanced-react/day-9"
              },
              {
                "name": "Algo Day 27",
                "url": "https://swebootcamp.rocketacademy.co/algorithms/algos/day-27"
              }
            ]
          },
          "inClass": {},
          "postClass": {}
        }
      }
    },
    "06-12-2022": {
      "courseDate": "06-12-2022",
      "courseWeek": 40,
      "weekDay": 1,
      "dayNumber": 2,
      "meetingDateTimeUTC": "2022-12-06T11:30:00.000Z",
      "courseDay": 74,
      "dateTypes": {
        "module": "Module 5: Advanced React",
        "general": {
          "type": "general",
          "preClass": {
            "items": [
              {
                "name": "Day 10 Coursework",
                "url": "https://swebootcamp.rocketacademy.co/module-5-advanced-react/day-10"
              },
              {
                "name": "Algo Day 28",
                "url": "https://swebootcamp.rocketacademy.co/algorithms/algos/day-28"
              }
            ]
          },
          "inClass": {},
          "postClass": {}
        }
      }
    },
    "10-12-2022": {
      "courseDate": "10-12-2022",
      "courseWeek": 40,
      "weekDay": 2,
      "dayNumber": 6,
      "meetingDateTimeUTC": "2022-12-10T02:00:00.000Z",
      "courseDay": 75,
      "dateTypes": {
        "module": "Module 5: Advanced React",
        "general": {
          "type": "general",
          "preClass": {
            "items": [
              {
                "name": "Day 11 Coursework",
                "url": "https://swebootcamp.rocketacademy.co/module-5-advanced-react/day-11"
              }
            ]
          },
          "inClass": {},
          "postClass": {}
        }
      }
    },
    "13-12-2022": {
      "courseDate": "13-12-2022",
      "courseWeek": 41,
      "weekDay": 1,
      "dayNumber": 2,
      "meetingDateTimeUTC": "2022-12-13T11:30:00.000Z",
      "courseDay": 76,
      "dateTypes": {
        "module": "Module 5: Advanced React",
        "general": {
          "type": "general",
          "preClass": {
            "items": [
              {
                "name": "Day 12 Coursework",
                "url": "https://swebootcamp.rocketacademy.co/module-5-advanced-react/day-12"
              },
              {
                "name": "Algo Day 29",
                "url": "https://swebootcamp.rocketacademy.co/algorithms/algos/day-29"
              }
            ]
          },
          "inClass": {},
          "postClass": {}
        }
      }
    },
    "17-12-2022": {
      "courseDate": "17-12-2022",
      "courseWeek": 41,
      "weekDay": 2,
      "dayNumber": 6,
      "meetingDateTimeUTC": "2022-12-17T02:00:00.000Z",
      "courseDay": 77,
      "dateTypes": {
        "module": "Module 5: Advanced React",
        "general": {
          "type": "general",
          "preClass": {
            "items": [
              {
                "name": "Day 13 Coursework",
                "url": "https://swebootcamp.rocketacademy.co/module-5-advanced-react/day-13"
              },
              {
                "name": "Algo Day 30",
                "url": "https://swebootcamp.rocketacademy.co/algorithms/algos/day-30"
              }
            ]
          },
          "inClass": {},
          "postClass": {}
        }
      }
    },
    "20-12-2022": {
      "courseDate": "20-12-2022",
      "courseWeek": 42,
      "weekDay": 1,
      "dayNumber": 2,
      "meetingDateTimeUTC": "2022-12-20T11:30:00.000Z",
      "courseDay": 78,
      "dateTypes": {
        "module": "Module 5: Advanced React",
        "general": {
          "type": "general",
          "preClass": {
            "items": [
              {
                "name": "Day 14 Coursework",
                "url": "https://swebootcamp.rocketacademy.co/module-5-advanced-react/day-14"
              }
            ]
          },
          "inClass": {},
          "postClass": {}
        }
      }
    },
    "24-12-2022": {
      "courseDate": "24-12-2022",
      "courseWeek": 42,
      "weekDay": 2,
      "dayNumber": 6,
      "meetingDateTimeUTC": "2022-12-24T02:00:00.000Z",
      "courseDay": 79,
      "dateTypes": {
        "module": "Module 5: Advanced React",
        "general": {
          "type": "general",
          "preClass": {
            "items": [
              {
                "name": "Day 15 Coursework",
                "url": "https://swebootcamp.rocketacademy.co/module-5-advanced-react/day-15"
              },
              {
                "name": "Algo Day 31",
                "url": "https://swebootcamp.rocketacademy.co/algorithms/algos/day-31"
              }
            ]
          },
          "inClass": {},
          "postClass": {}
        }
      }
    },
    "27-12-2022": {
      "courseDate": "27-12-2022",
      "courseWeek": 43,
      "weekDay": 1,
      "dayNumber": 2,
      "meetingDateTimeUTC": "2022-12-27T11:30:00.000Z",
      "courseDay": 80,
      "dateTypes": {
        "module": "Module 5: Advanced React",
        "general": {
          "type": "general",
          "preClass": {
            "items": [
              {
                "name": "Day 16 Coursework",
                "url": "https://swebootcamp.rocketacademy.co/module-5-advanced-react/day-16"
              },
              {
                "name": "Algo Day 32",
                "url": "https://swebootcamp.rocketacademy.co/algorithms/algos/day-32"
              }
            ]
          },
          "inClass": {},
          "postClass": {}
        }
      }
    },
    "31-12-2022": {
      "courseDate": "31-12-2022",
      "courseWeek": 43,
      "weekDay": 2,
      "dayNumber": 6,
      "meetingDateTimeUTC": "2022-12-31T02:00:00.000Z",
      "courseDay": 81,
      "dateTypes": {
        "module": "Module 6: Capstone Project",
        "general": {
          "type": "general",
          "preClass": {
            "items": [
              {
                "name": "Day 1 Coursework",
                "url": "https://swebootcamp.rocketacademy.co/module-6-capstone-project/day-1"
              }
            ]
          },
          "inClass": {},
          "postClass": {}
        }
      }
    },
    "03-01-2023": {
      "courseDate": "03-01-2023",
      "courseWeek": 44,
      "weekDay": 1,
      "dayNumber": 2,
      "meetingDateTimeUTC": "2023-01-03T11:30:00.000Z",
      "courseDay": 82,
      "dateTypes": {
        "module": "Module 6: Capstone Project",
        "general": {
          "type": "general",
          "preClass": {
            "items": [
              {
                "name": "Day 2 Coursework",
                "url": "https://swebootcamp.rocketacademy.co/module-6-capstone-project/day-2"
              },
              {
                "name": "Algo Day 33",
                "url": "https://swebootcamp.rocketacademy.co/algorithms/algos/day-33"
              }
            ]
          },
          "inClass": {},
          "postClass": {}
        }
      }
    },
    "07-01-2023": {
      "courseDate": "07-01-2023",
      "courseWeek": 44,
      "weekDay": 2,
      "dayNumber": 6,
      "meetingDateTimeUTC": "2023-01-07T02:00:00.000Z",
      "courseDay": 83,
      "dateTypes": {
        "module": "Module 6: Capstone Project",
        "general": {
          "type": "general",
          "preClass": {
            "items": [
              {
                "name": "Day 3 Coursework",
                "url": "https://swebootcamp.rocketacademy.co/module-6-capstone-project/day-3"
              },
              {
                "name": "Algo Day 34",
                "url": "https://swebootcamp.rocketacademy.co/algorithms/algos/day-34"
              }
            ]
          },
          "inClass": {},
          "postClass": {}
        }
      }
    },
    "10-01-2023": {
      "courseDate": "10-01-2023",
      "courseWeek": 45,
      "weekDay": 1,
      "dayNumber": 2,
      "meetingDateTimeUTC": "2023-01-10T11:30:00.000Z",
      "courseDay": 84,
      "dateTypes": {
        "module": "Module 6: Capstone Project",
        "general": {
          "type": "general",
          "preClass": {
            "items": [
              {
                "name": "Day 4 Coursework",
                "url": "https://swebootcamp.rocketacademy.co/module-6-capstone-project/day-4"
              }
            ]
          },
          "inClass": {},
          "postClass": {}
        }
      }
    },
    "14-01-2023": {
      "courseDate": "14-01-2023",
      "courseWeek": 45,
      "weekDay": 2,
      "dayNumber": 6,
      "meetingDateTimeUTC": "2023-01-14T02:00:00.000Z",
      "courseDay": 85,
      "dateTypes": {
        "module": "Module 6: Capstone Project",
        "general": {
          "type": "general",
          "preClass": {
            "items": [
              {
                "name": "Day 5 Coursework",
                "url": "https://swebootcamp.rocketacademy.co/module-6-capstone-project/day-5"
              },
              {
                "name": "Algo Day 35",
                "url": "https://swebootcamp.rocketacademy.co/algorithms/algos/day-35"
              }
            ]
          },
          "inClass": {},
          "postClass": {}
        }
      }
    },
    "17-01-2023": {
      "courseDate": "17-01-2023",
      "courseWeek": 46,
      "weekDay": 1,
      "dayNumber": 2,
      "meetingDateTimeUTC": "2023-01-17T11:30:00.000Z",
      "courseDay": 86,
      "dateTypes": {
        "module": "Module 6: Capstone Project",
        "general": {
          "type": "general",
          "preClass": {
            "items": [
              {
                "name": "Day 6 Coursework",
                "url": "https://swebootcamp.rocketacademy.co/module-6-capstone-project/day-6"
              },
              {
                "name": "Algo Day 36",
                "url": "https://swebootcamp.rocketacademy.co/algorithms/algos/day-36"
              }
            ]
          },
          "inClass": {},
          "postClass": {}
        }
      }
    },
    "21-01-2023": {
      "courseDate": "21-01-2023",
      "courseWeek": 46,
      "weekDay": 2,
      "dayNumber": 6,
      "meetingDateTimeUTC": "2023-01-21T02:00:00.000Z",
      "courseDay": 87,
      "dateTypes": {
        "module": "Module 6: Capstone Project",
        "general": {
          "type": "general",
          "preClass": {
            "items": [
              {
                "name": "Day 7 Coursework",
                "url": "https://swebootcamp.rocketacademy.co/module-6-capstone-project/day-7"
              }
            ]
          },
          "inClass": {},
          "postClass": {}
        }
      }
    },
    "24-01-2023": {
      "courseDate": "24-01-2023",
      "courseWeek": 47,
      "weekDay": 1,
      "dayNumber": 2,
      "meetingDateTimeUTC": "2023-01-24T11:30:00.000Z",
      "courseDay": 88,
      "dateTypes": {
        "module": "Module 6: Capstone Project",
        "general": {
          "type": "general",
          "preClass": {
            "items": [
              {
                "name": "Day 8 Coursework",
                "url": "https://swebootcamp.rocketacademy.co/module-6-capstone-project/day-8"
              },
              {
                "name": "Algo Day 37",
                "url": "https://swebootcamp.rocketacademy.co/algorithms/algos/day-37"
              }
            ]
          },
          "inClass": {},
          "postClass": {}
        }
      }
    },
    "28-01-2023": {
      "courseDate": "28-01-2023",
      "courseWeek": 47,
      "weekDay": 2,
      "dayNumber": 6,
      "meetingDateTimeUTC": "2023-01-28T02:00:00.000Z",
      "courseDay": 89,
      "dateTypes": {
        "module": "Module 6: Capstone Project",
        "general": {
          "type": "general",
          "preClass": {
            "items": [
              {
                "name": "Day 9 Coursework",
                "url": "https://swebootcamp.rocketacademy.co/module-6-capstone-project/day-9"
              },
              {
                "name": "Algo Day 38",
                "url": "https://swebootcamp.rocketacademy.co/algorithms/algos/day-38"
              }
            ]
          },
          "inClass": {},
          "postClass": {}
        }
      }
    },
    "31-01-2023": {
      "courseDate": "31-01-2023",
      "courseWeek": 48,
      "weekDay": 1,
      "dayNumber": 2,
      "meetingDateTimeUTC": "2023-01-31T11:30:00.000Z",
      "courseDay": 90,
      "dateTypes": {
        "module": "Module 6: Capstone Project",
        "general": {
          "type": "general",
          "preClass": {
            "items": [
              {
                "name": "Day 10 Coursework",
                "url": "https://swebootcamp.rocketacademy.co/module-6-capstone-project/day-10"
              }
            ]
          },
          "inClass": {},
          "postClass": {}
        }
      }
    },
    "04-02-2023": {
      "courseDate": "04-02-2023",
      "courseWeek": 48,
      "weekDay": 2,
      "dayNumber": 6,
      "meetingDateTimeUTC": "2023-02-04T02:00:00.000Z",
      "courseDay": 91,
      "dateTypes": {
        "module": "Module 6: Capstone Project",
        "general": {
          "type": "general",
          "preClass": {
            "items": [
              {
                "name": "Day 11 Coursework",
                "url": "https://swebootcamp.rocketacademy.co/module-6-capstone-project/day-11"
              },
              {
                "name": "Algo Day 39",
                "url": "https://swebootcamp.rocketacademy.co/algorithms/algos/day-39"
              }
            ]
          },
          "inClass": {},
          "postClass": {}
        }
      }
    },
    "07-02-2023": {
      "courseDate": "07-02-2023",
      "courseWeek": 49,
      "weekDay": 1,
      "dayNumber": 2,
      "meetingDateTimeUTC": "2023-02-07T11:30:00.000Z",
      "courseDay": 92,
      "dateTypes": {
        "module": "Module 6: Capstone Project",
        "general": {
          "type": "general",
          "preClass": {
            "items": [
              {
                "name": "Day 12 Coursework",
                "url": "https://swebootcamp.rocketacademy.co/module-6-capstone-project/day-12"
              },
              {
                "name": "Algo Day 40",
                "url": "https://swebootcamp.rocketacademy.co/algorithms/algos/day-40"
              }
            ]
          },
          "inClass": {},
          "postClass": {}
        }
      }
    },
    "11-02-2023": {
      "courseDate": "11-02-2023",
      "courseWeek": 49,
      "weekDay": 2,
      "dayNumber": 6,
      "meetingDateTimeUTC": "2023-02-11T02:00:00.000Z",
      "courseDay": 93,
      "dateTypes": {
        "module": "Module 6: Capstone Project",
        "general": {
          "type": "general",
          "preClass": {
            "items": [
              {
                "name": "Day 13 Coursework",
                "url": "https://swebootcamp.rocketacademy.co/module-6-capstone-project/day-13"
              }
            ]
          },
          "inClass": {},
          "postClass": {}
        }
      }
    },
    "14-02-2023": {
      "courseDate": "14-02-2023",
      "courseWeek": 50,
      "weekDay": 1,
      "dayNumber": 2,
      "meetingDateTimeUTC": "2023-02-14T11:30:00.000Z",
      "courseDay": 94,
      "dateTypes": {
        "module": "Module 6: Capstone Project",
        "general": {
          "type": "general",
          "preClass": {
            "items": [
              {
                "name": "Day 14 Coursework",
                "url": "https://swebootcamp.rocketacademy.co/module-6-capstone-project/day-14"
              },
              {
                "name": "Algo Day 41",
                "url": "https://swebootcamp.rocketacademy.co/algorithms/algos/day-41"
              }
            ]
          },
          "inClass": {},
          "postClass": {}
        }
      }
    },
    "18-02-2023": {
      "courseDate": "18-02-2023",
      "courseWeek": 50,
      "weekDay": 2,
      "dayNumber": 6,
      "meetingDateTimeUTC": "2023-02-18T02:00:00.000Z",
      "courseDay": 95,
      "dateTypes": {
        "module": "Module 6: Capstone Project",
        "general": {
          "type": "general",
          "preClass": {
            "items": [
              {
                "name": "Day 15 Coursework",
                "url": "https://swebootcamp.rocketacademy.co/module-6-capstone-project/day-15"
              },
              {
                "name": "Algo Day 42",
                "url": "https://swebootcamp.rocketacademy.co/algorithms/algos/day-42"
              }
            ]
          },
          "inClass": {},
          "postClass": {}
        }
      }
    },
    "21-02-2023": {
      "courseDate": "21-02-2023",
      "courseWeek": 51,
      "weekDay": 1,
      "dayNumber": 2,
      "meetingDateTimeUTC": "2023-02-21T11:30:00.000Z",
      "courseDay": 96,
      "dateTypes": {
        "module": "Module 6: Capstone Project",
        "general": {
          "type": "general",
          "preClass": {
            "items": [
              {
                "name": "Day 16 Coursework",
                "url": "https://swebootcamp.rocketacademy.co/module-6-capstone-project/day-16"
              }
            ]
          },
          "inClass": {},
          "postClass": {}
        }
      }
    }
  },
  "courseName": "12-03-2022_18-02-2023_BATCH3"
}
