{"courseType":"FTBC","days":{"20-03-2023":{"courseDate":"20-03-2023","courseWeek":1,"weekDay":1,"dayNumber":1,"meetingDateTimeUTC":"2023-03-20T02:00:00.000Z","courseDay":1,"dateTypes":{"module":"Module 1: Frontend","general":{"type":"general","preClass":{"items":[{"name":"Required Software","url":"https://bootcamp.rocketacademy.co/logistics/required-software"},{"name":"Course Methodology","url":"https://bootcamp.rocketacademy.co/logistics/course-methodology"}]},"inClass":{"items":[{"name":"Orientation, class photo 😍","url":""}]},"postClass":{}},"css":{"type":"css","preClass":{},"inClass":{},"postClass":{}},"algos":{"type":"algos","preClass":{},"inClass":{},"postClass":{}},"ux":{"type":"ux","preClass":{},"inClass":{},"postClass":{}},"ip":{"type":"ip","ipDue":{},"preClass":{},"inClass":{},"postClass":{}},"projects":{"type":"projects","projectStart":{},"projectDue":{},"preClass":{},"inClass":{},"postClass":{}}}},"21-03-2023":{"courseDate":"21-03-2023","courseWeek":1,"weekDay":2,"dayNumber":2,"meetingDateTimeUTC":"2023-03-21T02:00:00.000Z","courseDay":2,"dateTypes":{"module":"Module 1: Frontend","general":{"type":"general","preClass":{"items":[{"name":"0.1: Command Line","url":"https://bootcamp.rocketacademy.co/0-foundations/0.1-command-line"},{"name":"0.2: Git","url":"https://bootcamp.rocketacademy.co/0-foundations/0.2-git"},{"name":"0.3: GitHub","url":"https://bootcamp.rocketacademy.co/0-foundations/0.3-github"},{"name":"0.3.1: Pull Requests","url":"https://bootcamp.rocketacademy.co/0-foundations/0.3-github/0.3.1-pull-requests"},{"name":"1.1: HTML","url":"https://bootcamp.rocketacademy.co/1-frontend/1.1-html"}]},"inClass":{"items":[{"name":"1.E.1: Recipe Site","url":"https://bootcamp.rocketacademy.co/1-frontend/1.e-exercises/1.e.1-recipe-site"}]},"postClass":{"items":[{"name":"1.E.1: Recipe Site","url":"https://bootcamp.rocketacademy.co/1-frontend/1.e-exercises/1.e.1-recipe-site"}]}},"css":{"type":"css","preClass":{},"inClass":{},"postClass":{}},"algos":{"type":"algos","preClass":{},"inClass":{},"postClass":{}},"ux":{"type":"ux","preClass":{},"inClass":{},"postClass":{}},"ip":{"type":"ip","ipDue":{},"preClass":{},"inClass":{},"postClass":{}},"projects":{"type":"projects","projectStart":{},"projectDue":{},"preClass":{},"inClass":{},"postClass":{}}}},"22-03-2023":{"courseDate":"22-03-2023","courseWeek":1,"weekDay":3,"dayNumber":3,"meetingDateTimeUTC":"2023-03-22T02:00:00.000Z","courseDay":3,"dateTypes":{"module":"Module 1: Frontend","general":{"type":"general","preClass":{"items":[{"name":"1.2: CSS","url":"https://bootcamp.rocketacademy.co/1-frontend/1.2-css"},{"name":"0.4.1: ES6","url":"https://bootcamp.rocketacademy.co/0-foundations/0.4-javascript/0.4.1-es6"},{"name":"0.4.2: Common Syntax","url":"https://bootcamp.rocketacademy.co/0-foundations/0.4-javascript/0.4.2-common-syntax"},{"name":"0.4.3: Reference vs Value","url":"https://bootcamp.rocketacademy.co/0-foundations/0.4-javascript/0.4.3-reference-vs-value"},{"name":"0.5: Node.js (No need to read 0.5.X submodules for now)","url":"https://bootcamp.rocketacademy.co/0-foundations/0.5-node.js"}]},"inClass":{"items":[{"name":"1.E.2: Portfolio Page (Day 1 of 2)","url":"https://bootcamp.rocketacademy.co/1-frontend/1.e-exercises/1.e.2-portfolio-page"}]},"postClass":{"items":[{"name":"1.2: CSS - Codecademy Learn CSS - Syntax and Selectors, Visual Rules, The Box Model","url":"https://bootcamp.rocketacademy.co/1-frontend/1.2-css#codecademy-learn-css"},{"name":"1.E.2: Portfolio Page (Day 1 of 2)","url":"https://bootcamp.rocketacademy.co/1-frontend/1.e-exercises/1.e.2-portfolio-page"}]}},"css":{"type":"css","preClass":{},"inClass":{},"postClass":{}},"algos":{"type":"algos","preClass":{"items":[{"name":"Intro to Algorithms","url":"https://bootcamp.rocketacademy.co/algorithms"}]},"inClass":{},"postClass":{}},"ux":{"type":"ux","preClass":{},"inClass":{},"postClass":{}},"ip":{"type":"ip","ipDue":{},"preClass":{},"inClass":{},"postClass":{}},"projects":{"type":"projects","projectStart":{},"projectDue":{},"preClass":{},"inClass":{},"postClass":{}}}},"23-03-2023":{"courseDate":"23-03-2023","courseWeek":1,"weekDay":4,"dayNumber":4,"meetingDateTimeUTC":"2023-03-23T02:00:00.000Z","courseDay":4,"dateTypes":{"module":"Module 1: Frontend","general":{"type":"general","preClass":{"items":[{"name":"1.2.1: Layout","url":"https://bootcamp.rocketacademy.co/1-frontend/1.2-css/1.2.1-layout"}]},"inClass":{"items":[{"name":"1.E.2: Portfolio Page (Day 2 of 2)","url":"https://bootcamp.rocketacademy.co/1-frontend/1.e-exercises/1.e.2-portfolio-page"}]},"postClass":{"items":[{"name":"1.E.2: Portfolio Page (Day 2 of 2)","url":"https://bootcamp.rocketacademy.co/1-frontend/1.e-exercises/1.e.2-portfolio-page"}]}},"css":{"type":"css","preClass":{},"inClass":{},"postClass":{}},"algos":{"type":"algos","preClass":{"items":[{"name":"A.1.1: Arrays - Pre-Class","url":"https://bootcamp.rocketacademy.co/algorithms/a.1-data-structures/a.1.1-arrays#pre-class"}]},"inClass":{"items":[{"name":"A.1.1: Arrays - Part 1","url":"https://bootcamp.rocketacademy.co/algorithms/a.1-data-structures/a.1.1-arrays#part-1"}]},"postClass":{"items":[{"name":"A.1.1: Arrays - Part 1","url":"https://bootcamp.rocketacademy.co/algorithms/a.1-data-structures/a.1.1-arrays#part-1"}]}},"ux":{"type":"ux","preClass":{},"inClass":{},"postClass":{}},"ip":{"type":"ip","ipDue":{},"preClass":{},"inClass":{},"postClass":{}},"projects":{"type":"projects","projectStart":{},"projectDue":{},"preClass":{},"inClass":{},"postClass":{}}}},"27-03-2023":{"courseDate":"27-03-2023","courseWeek":2,"weekDay":1,"dayNumber":1,"meetingDateTimeUTC":"2023-03-27T02:00:00.000Z","courseDay":5,"dateTypes":{"module":"Module 1: Frontend","general":{"type":"general","preClass":{"items":[{"name":"0.4.4: Classes","url":"https://bootcamp.rocketacademy.co/0-foundations/0.4-javascript/0.4.4-classes"},{"name":"1.3: React - Hello World, Introducing JSX, Rendering Elements","url":"https://bootcamp.rocketacademy.co/1-frontend/1.3-react"}]},"inClass":{"items":[{"name":"1.E.3: World Clock (Day 1 of 2)","url":"https://bootcamp.rocketacademy.co/1-frontend/1.e-exercises/1.e.3-world-clock"}]},"postClass":{"items":[{"name":"1.3: React - Codecademy React 101 - JSX","url":"https://bootcamp.rocketacademy.co/1-frontend/1.3-react#post-class-exercises-codecademy-react-101"},{"name":"1.E.3: World Clock (Day 1 of 2)","url":"https://bootcamp.rocketacademy.co/1-frontend/1.e-exercises/1.e.3-world-clock"}]}},"css":{"type":"css","preClass":{},"inClass":{},"postClass":{}},"algos":{"type":"algos","preClass":{},"inClass":{"items":[]},"postClass":{"items":[]}},"ux":{"type":"ux","preClass":{},"inClass":{},"postClass":{}},"ip":{"type":"ip","ipDue":{},"preClass":{},"inClass":{},"postClass":{}},"projects":{"type":"projects","projectStart":{},"projectDue":{},"preClass":{},"inClass":{},"postClass":{}}}},"28-03-2023":{"courseDate":"28-03-2023","courseWeek":2,"weekDay":2,"dayNumber":2,"meetingDateTimeUTC":"2023-03-28T02:00:00.000Z","courseDay":6,"dateTypes":{"module":"Module 1: Frontend","general":{"type":"general","preClass":{"items":[{"name":"1.3: React - Components and Props, State and Lifecycle","url":"https://bootcamp.rocketacademy.co/1-frontend/1.3-react#5-state-and-lifecycle"}]},"inClass":{"items":[{"name":"1.E.3: World Clock (Day 2 of 2)","url":"https://bootcamp.rocketacademy.co/1-frontend/1.e-exercises/1.e.3-world-clock"}]},"postClass":{"items":[{"name":"1.3: React - Codecademy React 101 - React Components, Components Interacting, Lifecycle Methods","url":"https://bootcamp.rocketacademy.co/1-frontend/1.3-react#post-class-exercises-codecademy-react-101"},{"name":"1.E.3: World Clock (Day 2 of 2)","url":"https://bootcamp.rocketacademy.co/1-frontend/1.e-exercises/1.e.3-world-clock"}]}},"css":{"type":"css","preClass":{},"inClass":{},"postClass":{}},"algos":{"type":"algos","preClass":{"items":[{"name":"A.1.1: Arrays - Part 2","url":"https://bootcamp.rocketacademy.co/algorithms/a.1-data-structures/a.1.1-arrays#part-2"}]},"inClass":{"items":[{"name":"A.1.1: Arrays - Part 2","url":"https://bootcamp.rocketacademy.co/algorithms/a.1-data-structures/a.1.1-arrays#part-2"}]},"postClass":{"items":[{"name":"A.1.1: Arrays - Part 2","url":"https://bootcamp.rocketacademy.co/algorithms/a.1-data-structures/a.1.1-arrays#part-2"}]}},"ux":{"type":"ux","preClass":{},"inClass":{},"postClass":{}},"ip":{"type":"ip","ipDue":{},"preClass":{},"inClass":{},"postClass":{}},"projects":{"type":"projects","projectStart":{},"projectDue":{},"preClass":{},"inClass":{},"postClass":{}}}},"29-03-2023":{"courseDate":"29-03-2023","courseWeek":2,"weekDay":3,"dayNumber":3,"meetingDateTimeUTC":"2023-03-29T02:00:00.000Z","courseDay":7,"dateTypes":{"module":"Module 1: Frontend","general":{"type":"general","preClass":{"items":[{"name":"1.3: React - Handling Events, Conditional Rendering, Lists and Keys","url":"https://bootcamp.rocketacademy.co/1-frontend/1.3-react"}]},"inClass":{"items":[{"name":"1.E.4: High Card (Day 1 of 2)","url":"https://bootcamp.rocketacademy.co/1-frontend/1.e-exercises/1.e.4-high-card"}]},"postClass":{"items":[{"name":"1.E.4: High Card (Day 1 of 2)","url":"https://bootcamp.rocketacademy.co/1-frontend/1.e-exercises/1.e.4-high-card"}]}},"css":{"type":"css","preClass":{},"inClass":{},"postClass":{}},"algos":{"type":"algos","preClass":{"items":[{"name":"A.2: Complexity Analysis","url":"https://bootcamp.rocketacademy.co/algorithms/a.2-complexity-analysis"},{"name":"A.1.1: Arrays - Part 3","url":"https://bootcamp.rocketacademy.co/algorithms/a.1-data-structures/a.1.1-arrays#part-3"}]},"inClass":{"items":[{"name":"A.1.1: Arrays - Part 3","url":"https://bootcamp.rocketacademy.co/algorithms/a.1-data-structures/a.1.1-arrays#part-3"}]},"postClass":{"items":[{"name":"A.1.1: Arrays - Part 3","url":"https://bootcamp.rocketacademy.co/algorithms/a.1-data-structures/a.1.1-arrays#part-3"}]}},"ux":{"type":"ux","preClass":{},"inClass":{},"postClass":{}},"ip":{"type":"ip","ipDue":{},"preClass":{},"inClass":{},"postClass":{}},"projects":{"type":"projects","projectStart":{"items":[{"name":"Project 1 Ideation Phase 1","url":"https://bootcamp.rocketacademy.co/1-frontend/1.p-frontend-app"}]},"projectDue":{},"preClass":{},"inClass":{},"postClass":{"items":[{"name":"Project 1 Ideation Phase 1","url":"https://bootcamp.rocketacademy.co/1-frontend/1.p-frontend-app"}]}}}},"30-03-2023":{"courseDate":"30-03-2023","courseWeek":2,"weekDay":4,"dayNumber":4,"meetingDateTimeUTC":"2023-03-30T02:00:00.000Z","courseDay":8,"dateTypes":{"module":"Module 1: Frontend","general":{"type":"general","preClass":{"items":[{"name":"0.5.1: Node Modules","url":"https://bootcamp.rocketacademy.co/0-foundations/0.5-node.js/0.5.1-node-modules"},{"name":"0.5.2: NPM","url":"https://bootcamp.rocketacademy.co/0-foundations/0.5-node.js/0.5.2-npm"}]},"inClass":{"items":[{"name":"1.E.4: High Card (Day 2 of 2)","url":"https://bootcamp.rocketacademy.co/1-frontend/1.e-exercises/1.e.4-high-card"}]},"postClass":{"items":[{"name":"1.E.4: High Card (Day 2 of 2)","url":"https://bootcamp.rocketacademy.co/1-frontend/1.e-exercises/1.e.4-high-card"}]}},"css":{"type":"css","preClass":{},"inClass":{},"postClass":{}},"algos":{"type":"algos","preClass":{"items":[]},"inClass":{},"postClass":{"items":[]}},"ux":{"type":"ux","preClass":{},"inClass":{},"postClass":{}},"ip":{"type":"ip","ipDue":{},"preClass":{},"inClass":{},"postClass":{}},"projects":{"type":"projects","projectStart":{},"projectDue":{},"preClass":{},"inClass":{},"postClass":{"items":[{"name":"Project 1 Ideation Phase 1","url":"https://bootcamp.rocketacademy.co/1-frontend/1.p-frontend-app"}]}}}},"03-04-2023":{"courseDate":"03-04-2023","courseWeek":3,"weekDay":1,"dayNumber":1,"meetingDateTimeUTC":"2023-04-03T02:00:00.000Z","courseDay":9,"dateTypes":{"module":"Module 1: Frontend","general":{"type":"general","preClass":{"items":[{"name":"0.4.5: Destructuring and Spread Operator","url":"https://bootcamp.rocketacademy.co/0-foundations/0.4-javascript/0.4.5-destructuring-and-spread-operator"},{"name":"1.3: React - Forms","url":"https://bootcamp.rocketacademy.co/1-frontend/1.3-react#9-forms"}]},"inClass":{"items":[{"name":"1.E.5: Guess The Word (Day 1 of 2)","url":"https://bootcamp.rocketacademy.co/1-frontend/1.e-exercises/1.e.5-guess-the-word"}]},"postClass":{"items":[{"name":"1.3: React - Codecademy React 101 - React Forms","url":"https://bootcamp.rocketacademy.co/1-frontend/1.3-react#post-class-exercises-codecademy-react-101"},{"name":"1.E.5: Guess The Word (Day 1 of 2)","url":"https://bootcamp.rocketacademy.co/1-frontend/1.e-exercises/1.e.5-guess-the-word"}]}},"css":{"type":"css","preClass":{},"inClass":{},"postClass":{}},"algos":{"type":"algos","preClass":{"items":[{"name":"A.1.2: Hash Tables - Pre-Class","url":"https://bootcamp.rocketacademy.co/algorithms/a.1-data-structures/a.1.2-hash-tables#pre-class"}]},"inClass":{"items":[{"name":"A.1.2: Hash Tables - Part 1","url":"https://bootcamp.rocketacademy.co/algorithms/a.1-data-structures/a.1.2-hash-tables#part-1"}]},"postClass":{"items":[{"name":"A.1.2: Hash Tables - Part 1","url":"https://bootcamp.rocketacademy.co/algorithms/a.1-data-structures/a.1.2-hash-tables#part-1"}]}},"ux":{"type":"ux","preClass":{},"inClass":{},"postClass":{}},"ip":{"type":"ip","ipDue":{},"preClass":{},"inClass":{},"postClass":{}},"projects":{"type":"projects","projectStart":{},"projectDue":{},"preClass":{},"inClass":{},"postClass":{"items":[{"name":"Project 1 Ideation Phase 1","url":"https://bootcamp.rocketacademy.co/1-frontend/1.p-frontend-app"}]}}}},"04-04-2023":{"courseDate":"04-04-2023","courseWeek":3,"weekDay":2,"dayNumber":2,"meetingDateTimeUTC":"2023-04-04T02:00:00.000Z","courseDay":10,"dateTypes":{"module":"Module 1: Frontend","general":{"type":"general","preClass":{"items":[{"name":"1.3: React - Lifting State Up","url":"https://bootcamp.rocketacademy.co/1-frontend/1.3-react#10-lifting-state-up"}]},"inClass":{"items":[{"name":"1.E.5: Guess The Word (Day 2 of 2)","url":"https://bootcamp.rocketacademy.co/1-frontend/1.e-exercises/1.e.5-guess-the-word"}]},"postClass":{"items":[{"name":"1.3: React - Codecademy React 101 - Stateless Components from Stateful Components","url":"https://bootcamp.rocketacademy.co/1-frontend/1.3-react#post-class-exercises-codecademy-react-101"},{"name":"1.E.5: Guess The Word (Day 2 of 2)","url":"https://bootcamp.rocketacademy.co/1-frontend/1.e-exercises/1.e.5-guess-the-word"}]}},"css":{"type":"css","preClass":{},"inClass":{},"postClass":{}},"algos":{"type":"algos","preClass":{},"inClass":{"items":[{"name":"A.1.2: Hash Tables - Part 2","url":"https://bootcamp.rocketacademy.co/algorithms/a.1-data-structures/a.1.2-hash-tables#part-2"}]},"postClass":{"items":[{"name":"A.1.2: Hash Tables - Part 2","url":"https://bootcamp.rocketacademy.co/algorithms/a.1-data-structures/a.1.2-hash-tables#part-2"}]}},"ux":{"type":"ux","preClass":{},"inClass":{},"postClass":{}},"ip":{"type":"ip","ipDue":{},"preClass":{},"inClass":{},"postClass":{}},"projects":{"type":"projects","projectStart":{},"projectDue":{},"preClass":{},"inClass":{},"postClass":{"items":[{"name":"Project 1 Ideation Phase 1","url":"https://bootcamp.rocketacademy.co/1-frontend/1.p-frontend-app"}]}}}},"05-04-2023":{"courseDate":"05-04-2023","courseWeek":3,"weekDay":3,"dayNumber":3,"meetingDateTimeUTC":"2023-04-05T02:00:00.000Z","courseDay":11,"dateTypes":{"module":"Module 1: Frontend","general":{"type":"general","preClass":{"items":[{"name":"1.3: React - Composition vs Inheritance, Thinking in React","url":"https://bootcamp.rocketacademy.co/1-frontend/1.3-react#11-composition-vs-inheritance"}]},"inClass":{},"postClass":{}},"css":{"type":"css","preClass":{},"inClass":{},"postClass":{}},"algos":{"type":"algos","preClass":{},"inClass":{"items":[{"name":"A.1.2: Hash Tables - Part 2","url":"https://bootcamp.rocketacademy.co/algorithms/a.1-data-structures/a.1.2-hash-tables#part-2"}]},"postClass":{"items":[{"name":"A.1.2: Hash Tables - Part 2","url":"https://bootcamp.rocketacademy.co/algorithms/a.1-data-structures/a.1.2-hash-tables#part-2"}]}},"ux":{"type":"ux","preClass":{},"inClass":{},"postClass":{}},"ip":{"type":"ip","ipDue":{},"preClass":{},"inClass":{},"postClass":{}},"projects":{"type":"projects","projectStart":{"items":[{"name":"Project 1 Ideation Phase 2","url":"https://bootcamp.rocketacademy.co/1-frontend/1.p-frontend-app"}]},"projectDue":{},"preClass":{},"inClass":{"items":[{"name":"Project 1 Ideation Phase 2","url":"https://bootcamp.rocketacademy.co/1-frontend/1.p-frontend-app"}]},"postClass":{"items":[{"name":"Project 1 Ideation Phase 2","url":"https://bootcamp.rocketacademy.co/1-frontend/1.p-frontend-app"}]}}}},"06-04-2023":{"courseDate":"06-04-2023","courseWeek":3,"weekDay":4,"dayNumber":4,"meetingDateTimeUTC":"2023-04-06T02:00:00.000Z","courseDay":12,"dateTypes":{"module":"Module 1: Frontend","general":{"type":"general","preClass":{"items":[{"name":"1.3: React - Tutorial: Intro to React","url":"https://bootcamp.rocketacademy.co/1-frontend/1.3-react#tutorial-intro-to-react"}]},"inClass":{},"postClass":{}},"css":{"type":"css","preClass":{},"inClass":{},"postClass":{}},"algos":{"type":"algos","preClass":{},"inClass":{},"postClass":{}},"ux":{"type":"ux","preClass":{},"inClass":{},"postClass":{}},"ip":{"type":"ip","ipDue":{},"preClass":{},"inClass":{},"postClass":{}},"projects":{"type":"projects","projectStart":{},"projectDue":{"items":[{"name":"Project 1 Ideation Phase 2","url":"https://bootcamp.rocketacademy.co/1-frontend/1.p-frontend-app"}]},"preClass":{},"inClass":{"items":[{"name":"Project 1 Scrum","url":"https://bootcamp.rocketacademy.co/logistics/course-methodology#scrum"}]},"postClass":{"items":[{"name":"Project 1 Implementation","url":"https://bootcamp.rocketacademy.co/1-frontend/1.p-frontend-app"}]}}}},"10-04-2023":{"courseDate":"10-04-2023","courseWeek":4,"weekDay":1,"dayNumber":1,"meetingDateTimeUTC":"2023-04-10T02:00:00.000Z","courseDay":13,"dateTypes":{"module":"Module 1: Frontend","general":{"type":"general","preClass":{},"inClass":{},"postClass":{}},"css":{"type":"css","preClass":{},"inClass":{},"postClass":{}},"algos":{"type":"algos","preClass":{},"inClass":{},"postClass":{}},"ux":{"type":"ux","preClass":{},"inClass":{},"postClass":{}},"ip":{"type":"ip","ipDue":{},"preClass":{},"inClass":{},"postClass":{}},"projects":{"type":"projects","projectStart":{},"projectDue":{},"preClass":{},"inClass":{"items":[{"name":"Project 1 Scrum","url":"https://bootcamp.rocketacademy.co/logistics/course-methodology#scrum"}]},"postClass":{"items":[{"name":"Project 1 Implementation","url":"https://bootcamp.rocketacademy.co/1-frontend/1.p-frontend-app"}]}}}},"11-04-2023":{"courseDate":"11-04-2023","courseWeek":4,"weekDay":2,"dayNumber":2,"meetingDateTimeUTC":"2023-04-11T02:00:00.000Z","courseDay":14,"dateTypes":{"module":"Module 1: Frontend","general":{"type":"general","projectStart":{},"projectDue":{},"preClass":{},"inClass":{},"postClass":{}},"css":{"type":"css","preClass":{},"inClass":{},"postClass":{}},"algos":{"type":"algos","preClass":{},"inClass":{},"postClass":{}},"ux":{"type":"ux","preClass":{},"inClass":{},"postClass":{}},"ip":{"type":"ip","ipDue":{},"preClass":{},"inClass":{},"postClass":{}},"projects":{"type":"projects","projectStart":{},"projectDue":{"items":[{"name":"Project 1 MVP Deadline","url":"https://bootcamp.rocketacademy.co/1-frontend/1.p-frontend-app"}]},"preClass":{},"inClass":{"items":[{"name":"Project 1 Scrum","url":"https://bootcamp.rocketacademy.co/logistics/course-methodology#scrum"}]},"postClass":{"items":[{"name":"Project 1 Implementation","url":"https://bootcamp.rocketacademy.co/1-frontend/1.p-frontend-app"}]}}}},"12-04-2023":{"courseDate":"12-04-2023","courseWeek":4,"weekDay":3,"dayNumber":3,"meetingDateTimeUTC":"2023-04-12T02:00:00.000Z","courseDay":15,"dateTypes":{"module":"Module 1: Frontend","general":{"type":"general","preClass":{},"inClass":{},"postClass":{}},"css":{"type":"css","preClass":{},"inClass":{},"postClass":{}},"algos":{"type":"algos","preClass":{},"inClass":{},"postClass":{}},"ux":{"type":"ux","preClass":{},"inClass":{},"postClass":{}},"ip":{"type":"ip","ipDue":{},"preClass":{},"inClass":{},"postClass":{}},"projects":{"type":"projects","projectStart":{},"projectDue":{"items":[{"name":"Project 1 Feature Freeze","url":"https://bootcamp.rocketacademy.co/1-frontend/1.p-frontend-app"}]},"preClass":{},"inClass":{"items":[{"name":"Project 1 Scrum","url":"https://bootcamp.rocketacademy.co/logistics/course-methodology#scrum"}]},"postClass":{"items":[{"name":"Project 1 Implementation","url":"https://bootcamp.rocketacademy.co/1-frontend/1.p-frontend-app"}]}}}},"13-04-2023":{"courseDate":"13-04-2023","courseWeek":4,"weekDay":4,"dayNumber":4,"meetingDateTimeUTC":"2023-04-13T02:00:00.000Z","courseDay":16,"dateTypes":{"module":"Module 1: Frontend","general":{"type":"general","preClass":{},"inClass":{},"postClass":{}},"css":{"type":"css","preClass":{},"inClass":{},"postClass":{}},"algos":{"type":"algos","preClass":{},"inClass":{},"postClass":{}},"ux":{"type":"ux","preClass":{},"inClass":{},"postClass":{}},"ip":{"type":"ip","ipDue":{},"preClass":{},"inClass":{},"postClass":{}},"projects":{"type":"projects","projectStart":{},"projectDue":{"items":[{"name":"Project 1 Presentations","url":"https://bootcamp.rocketacademy.co/1-frontend/1.p-frontend-app"}]},"preClass":{},"inClass":{"items":[{"name":"Project 1 Presentations","url":"https://bootcamp.rocketacademy.co/1-frontend/1.p-frontend-app"}]},"postClass":{"items":[{"name":"Project 1 Post-Mortems","url":"https://bootcamp.rocketacademy.co/logistics/course-methodology#post-mortem"}]}}}},"17-04-2023":{"courseDate":"17-04-2023","courseWeek":5,"weekDay":1,"dayNumber":1,"meetingDateTimeUTC":"2023-04-17T02:00:00.000Z","courseDay":17,"dateTypes":{"module":"Module 2: Full-Stack","general":{"type":"general","preClass":{"items":[{"name":"2.1: Internet 101","url":"https://bootcamp.rocketacademy.co/2-full-stack/2.1-internet-101"},{"name":"2.1.1: Chrome DevTools Network Panel","url":"https://bootcamp.rocketacademy.co/2-full-stack/2.1-internet-101/2.1.1-chrome-devtools-network-panel"},{"name":"0.4.6: JS Promises","url":"https://bootcamp.rocketacademy.co/0-foundations/0.4-javascript/0.4.6-promises"},{"name":"2.1.2: HTTP Requests and Responses","url":"https://bootcamp.rocketacademy.co/2-full-stack/2.1-internet-101/2.1.2-http-requests-and-responses"},{"name":"2.2.1: AJAX","url":"https://bootcamp.rocketacademy.co/2-full-stack/2.2-advanced-react/2.2.1-ajax"}]},"inClass":{"items":[{"name":"2.E.1: Weather App","url":"https://bootcamp.rocketacademy.co/2-full-stack/2.e-exercises/2.e.1-weather-app"}]},"postClass":{"items":[{"name":"2.E.1: Weather App","url":"https://bootcamp.rocketacademy.co/2-full-stack/2.e-exercises/2.e.1-weather-app"}]}},"css":{"type":"css","preClass":{},"inClass":{},"postClass":{}},"algos":{"type":"algos","preClass":{"items":[{"name":"A.1.3: Stacks - Pre-Class","url":"https://bootcamp.rocketacademy.co/algorithms/a.1-data-structures/a.1.3-stacks#pre-class"}]},"inClass":{"items":[{"name":"A.1.3: Stacks - Part 1","url":"https://bootcamp.rocketacademy.co/algorithms/a.1-data-structures/a.1.3-stacks#part-1"}]},"postClass":{"items":[{"name":"A.1.3: Stacks - Part 1","url":"https://bootcamp.rocketacademy.co/algorithms/a.1-data-structures/a.1.3-stacks#part-1"}]}},"ux":{"type":"ux","preClass":{},"inClass":{},"postClass":{}},"ip":{"type":"ip","ipDue":{},"preClass":{},"inClass":{},"postClass":{}},"projects":{"type":"projects","projectStart":{},"projectDue":{},"preClass":{},"inClass":{},"postClass":{}}}},"18-04-2023":{"courseDate":"18-04-2023","courseWeek":5,"weekDay":2,"dayNumber":2,"meetingDateTimeUTC":"2023-04-18T02:00:00.000Z","courseDay":18,"dateTypes":{"module":"Module 2: Full-Stack","general":{"type":"general","preClass":{"items":[{"name":"2.3: Firebase","url":"https://bootcamp.rocketacademy.co/2-full-stack/2.3-firebase"},{"name":"2.3.1: Firebase Realtime Database","url":"https://bootcamp.rocketacademy.co/2-full-stack/2.3-firebase/2.3.1-firebase-realtime-database"},{"name":"2.2.7: Enviromental Variables","url":"https://bootcamp.rocketacademy.co/2-full-stack/2.2-advanced-react/2.2.7-environmental-variables"}]},"inClass":{"items":[{"name":"2.E.2: Instagram Chat","url":"https://bootcamp.rocketacademy.co/2-full-stack/2.e-exercises/2.e.2-instagram-chat"}]},"postClass":{"items":[{"name":"2.E.2: Instagram Chat","url":"https://bootcamp.rocketacademy.co/2-full-stack/2.e-exercises/2.e.2-instagram-chat"}]}},"css":{"type":"css","preClass":{},"inClass":{},"postClass":{}},"algos":{"type":"algos","preClass":{},"inClass":{"items":[{"name":"A.1.3: Stacks - Part 2","url":"https://bootcamp.rocketacademy.co/algorithms/a.1-data-structures/a.1.3-stacks#part-2"}]},"postClass":{"items":[{"name":"A.1.3: Stacks - Part 2","url":"https://bootcamp.rocketacademy.co/algorithms/a.1-data-structures/a.1.3-stacks#part-2"}]}},"ux":{"type":"ux","preClass":{},"inClass":{},"postClass":{}},"ip":{"type":"ip","ipDue":{},"preClass":{},"inClass":{},"postClass":{}},"projects":{"type":"projects","projectStart":{},"projectDue":{},"preClass":{},"inClass":{},"postClass":{}}}},"19-04-2023":{"courseDate":"19-04-2023","courseWeek":5,"weekDay":3,"dayNumber":3,"meetingDateTimeUTC":"2023-04-19T02:00:00.000Z","courseDay":19,"dateTypes":{"module":"Module 2: Full-Stack","general":{"type":"general","preClass":{"items":[{"name":"2.3.2: Firebase Storage","url":"https://bootcamp.rocketacademy.co/2-full-stack/2.3-firebase/2.3.2-firebase-storage"}]},"inClass":{"items":[{"name":"2.E.3: Instagram Posts","url":"https://bootcamp.rocketacademy.co/2-full-stack/2.e-exercises/2.e.3-instagram-posts"}]},"postClass":{"items":[{"name":"2.E.3: Instagram Posts","url":"https://bootcamp.rocketacademy.co/2-full-stack/2.e-exercises/2.e.3-instagram-posts"}]}},"css":{"type":"css","preClass":{},"inClass":{},"postClass":{}},"algos":{"type":"algos","preClass":{"items":[{"name":"A.1.4: Queues - Pre-Class","url":"https://bootcamp.rocketacademy.co/algorithms/a.1-data-structures/a.1.4-queues#pre-class"}]},"inClass":{"items":[{"name":"A.1.4: Queues - Part 1","url":"https://bootcamp.rocketacademy.co/algorithms/a.1-data-structures/a.1.4-queues#part-1"}]},"postClass":{"items":[{"name":"A.1.4: Queues - Part 1","url":"https://bootcamp.rocketacademy.co/algorithms/a.1-data-structures/a.1.4-queues#part-1"}]}},"ux":{"type":"ux","preClass":{},"inClass":{},"postClass":{}},"ip":{"type":"ip","ipDue":{},"preClass":{},"inClass":{},"postClass":{}},"projects":{"type":"projects","projectStart":{"items":[{"name":"Project 2 Ideation Phase 1","url":"https://bootcamp.rocketacademy.co/2-full-stack/2.p-full-stack-app-firebase"}]},"projectDue":{},"preClass":{},"inClass":{},"postClass":{"items":[{"name":"Project 2 Ideation Phase 1","url":"https://bootcamp.rocketacademy.co/2-full-stack/2.p-full-stack-app-firebase"}]}}}},"20-04-2023":{"courseDate":"20-04-2023","courseWeek":5,"weekDay":4,"dayNumber":4,"meetingDateTimeUTC":"2023-04-20T02:00:00.000Z","courseDay":20,"dateTypes":{"module":"Module 2: Full-Stack","general":{"type":"general","preClass":{"items":[{"name":"2.3.3: Firebase Authentication","url":"https://bootcamp.rocketacademy.co/2-full-stack/2.3-firebase/2.3.3-firebase-authentication"}]},"inClass":{"items":[{"name":"2.E.4: Instagram Auth","url":"https://bootcamp.rocketacademy.co/2-full-stack/2.e-exercises/2.e.4-instagram-auth"}]},"postClass":{"items":[{"name":"2.E.4: Instagram Auth","url":"https://bootcamp.rocketacademy.co/2-full-stack/2.e-exercises/2.e.4-instagram-auth"}]}},"css":{"type":"css","preClass":{},"inClass":{},"postClass":{}},"algos":{"type":"algos","preClass":{"items":[{"name":"A.1.1.1: Binary Search - Pre-Class","url":"https://bootcamp.rocketacademy.co/algorithms/a.1-data-structures/a.1.1-arrays/a.1.1.1-binary-search#pre-class"}]},"inClass":{"items":[{"name":"A.1.1.1: Binary Search - Part 1","url":"https://bootcamp.rocketacademy.co/algorithms/a.1-data-structures/a.1.1-arrays/a.1.1.1-binary-search#part-1"}]},"postClass":{}},"ux":{"type":"ux","preClass":{},"inClass":{},"postClass":{}},"ip":{"type":"ip","ipDue":{},"preClass":{},"inClass":{},"postClass":{}},"projects":{"type":"projects","projectStart":{},"projectDue":{},"preClass":{},"inClass":{},"postClass":{"items":[{"name":"Project 2 Ideation Phase 1","url":"https://bootcamp.rocketacademy.co/2-full-stack/2.p-full-stack-app-firebase"}]}}}},"24-04-2023":{"courseDate":"24-04-2023","courseWeek":6,"weekDay":1,"dayNumber":1,"meetingDateTimeUTC":"2023-04-24T02:00:00.000Z","courseDay":21,"dateTypes":{"module":"Module 2: Full-Stack","general":{"type":"general","preClass":{"items":[{"name":"2.2.2: React Hooks","url":"https://bootcamp.rocketacademy.co/2-full-stack/2.2-advanced-react/2.2.2-hooks"}]},"inClass":{"items":[{"name":"2.E.4: Instagram Auth","url":"https://bootcamp.rocketacademy.co/2-full-stack/2.e-exercises/2.e.4-instagram-auth"}]},"postClass":{"items":[{"name":"2.E.4: Instagram Auth","url":"https://bootcamp.rocketacademy.co/2-full-stack/2.e-exercises/2.e.4-instagram-auth"},{"name":"2.2.2: React Hooks - Codecademy React 101 - Hooks","url":"https://bootcamp.rocketacademy.co/2-full-stack/2.2-advanced-react/2.2.2-hooks#post-class-exercises-codecademy-react-101"}]}},"css":{"type":"css","preClass":{},"inClass":{},"postClass":{}},"algos":{"type":"algos","preClass":{"items":[{"name":"A.1.1.2: Sliding Windows - Pre-Class","url":"https://bootcamp.rocketacademy.co/algorithms/a.1-data-structures/a.1.1-arrays/a.1.1.2-sliding-windows#pre-class"}]},"inClass":{"items":[{"name":"A.1.1.2: Sliding Windows - Part 1","url":"https://bootcamp.rocketacademy.co/algorithms/a.1-data-structures/a.1.1-arrays/a.1.1.2-sliding-windows#part-1"}]},"postClass":{"items":[{"name":"A.1.1.2: Sliding Windows - Part 1","url":"https://bootcamp.rocketacademy.co/algorithms/a.1-data-structures/a.1.1-arrays/a.1.1.2-sliding-windows#part-1"}]}},"ux":{"type":"ux","preClass":{},"inClass":{},"postClass":{}},"ip":{"type":"ip","ipDue":{},"preClass":{},"inClass":{},"postClass":{}},"projects":{"type":"projects","projectStart":{},"projectDue":{},"preClass":{},"inClass":{},"postClass":{"items":[{"name":"Project 2 Ideation Phase 1","url":"https://bootcamp.rocketacademy.co/2-full-stack/2.p-full-stack-app-firebase"}]}}}},"25-04-2023":{"courseDate":"25-04-2023","courseWeek":6,"weekDay":2,"dayNumber":2,"meetingDateTimeUTC":"2023-04-25T02:00:00.000Z","courseDay":22,"dateTypes":{"module":"Module 2: Full-Stack","general":{"type":"general","preClass":{"items":[{"name":"2.2.3: React Router","url":"https://bootcamp.rocketacademy.co/2-full-stack/2.2-advanced-react/2.2.3-react-router"},{"name":"2.3.4: Firebase Hosting","url":"https://bootcamp.rocketacademy.co/2-full-stack/2.3-firebase/2.3.4-firebase-hosting"}]},"inClass":{"items":[{"name":"2.E.5: Instagram Routes","url":"https://bootcamp.rocketacademy.co/2-full-stack/2.e-exercises/2.e.5-instagram-routes"}]},"postClass":{"items":[{"name":"2.E.5: Instagram Routes","url":"https://bootcamp.rocketacademy.co/2-full-stack/2.e-exercises/2.e.5-instagram-routes"}]}},"css":{"type":"css","preClass":{},"inClass":{},"postClass":{}},"algos":{"type":"algos","preClass":{"items":[{"name":"A.3: Object-Oriented Programming","url":"https://bootcamp.rocketacademy.co/algorithms/a.3-object-oriented-programming"},{"name":"A.1.5: Linked Lists - Pre-Class","url":"https://bootcamp.rocketacademy.co/algorithms/a.1-data-structures/a.1.5-linked-lists#pre-class"}]},"inClass":{"items":[{"name":"A.1.5: Linked Lists - Part 1","url":"https://bootcamp.rocketacademy.co/algorithms/a.1-data-structures/a.1.5-linked-lists#part-1"}]},"postClass":{"items":[{"name":"A.1.5: Linked Lists - Part 1","url":"https://bootcamp.rocketacademy.co/algorithms/a.1-data-structures/a.1.5-linked-lists#part-1"}]}},"ux":{"type":"ux","preClass":{},"inClass":{},"postClass":{}},"ip":{"type":"ip","ipDue":{},"preClass":{},"inClass":{},"postClass":{}},"projects":{"type":"projects","projectStart":{},"projectDue":{},"preClass":{},"inClass":{},"postClass":{"items":[{"name":"Project 2 Ideation Phase 1","url":"https://bootcamp.rocketacademy.co/2-full-stack/2.p-full-stack-app-firebase"}]}}}},"26-04-2023":{"courseDate":"26-04-2023","courseWeek":6,"weekDay":3,"dayNumber":3,"meetingDateTimeUTC":"2023-04-26T02:00:00.000Z","courseDay":23,"dateTypes":{"module":"Module 2: Full-Stack","general":{"type":"general","preClass":{"items":[{"name":"2.2.4: Higher-Order Components","url":"https://bootcamp.rocketacademy.co/2-full-stack/2.2-advanced-react/2.2.4-higher-order-components"},{"name":"2.2.5: React Context","url":"https://bootcamp.rocketacademy.co/2-full-stack/2.2-advanced-react/2.2.5-context"}]},"inClass":{},"postClass":{}},"css":{"type":"css","preClass":{},"inClass":{},"postClass":{}},"algos":{"type":"algos","preClass":{},"inClass":{"items":[{"name":"A.1.5: Linked Lists - Part 2","url":"https://bootcamp.rocketacademy.co/algorithms/a.1-data-structures/a.1.5-linked-lists#part-2"}]},"postClass":{"items":[{"name":"A.1.5: Linked Lists - Part 2","url":"https://bootcamp.rocketacademy.co/algorithms/a.1-data-structures/a.1.5-linked-lists#part-2"}]}},"ux":{"type":"ux","preClass":{},"inClass":{},"postClass":{}},"ip":{"type":"ip","ipDue":{},"preClass":{},"inClass":{},"postClass":{}},"projects":{"type":"projects","projectStart":{"items":[{"name":"Project 2 Ideation Phase 2","url":"https://bootcamp.rocketacademy.co/2-full-stack/2.p-full-stack-app-firebase"}]},"projectDue":{},"preClass":{},"inClass":{"items":[{"name":"Project 2 Ideation Phase 2","url":"https://bootcamp.rocketacademy.co/2-full-stack/2.p-full-stack-app-firebase"}]},"postClass":{"items":[{"name":"Project 2 Ideation Phase 2","url":"https://bootcamp.rocketacademy.co/2-full-stack/2.p-full-stack-app-firebase"}]}}}},"27-04-2023":{"courseDate":"27-04-2023","courseWeek":6,"weekDay":4,"dayNumber":4,"meetingDateTimeUTC":"2023-04-27T02:00:00.000Z","courseDay":24,"dateTypes":{"module":"Module 2: Full-Stack","general":{"type":"general","preClass":{"items":[{"name":"2.2.6: Eject CRA","url":"https://bootcamp.rocketacademy.co/2-full-stack/2.2-advanced-react/2.2.6-eject-cra"}]},"inClass":{},"postClass":{}},"css":{"type":"css","preClass":{},"inClass":{},"postClass":{}},"algos":{"type":"algos","preClass":{},"inClass":{},"postClass":{}},"ux":{"type":"ux","preClass":{},"inClass":{},"postClass":{}},"ip":{"type":"ip","ipDue":{},"preClass":{},"inClass":{},"postClass":{}},"projects":{"type":"projects","projectStart":{},"projectDue":{"items":[{"name":"Project 2 Ideation Phase 2","url":"https://bootcamp.rocketacademy.co/2-full-stack/2.p-full-stack-app-firebase"}]},"preClass":{},"inClass":{"items":[{"name":"Project 2 Scrum","url":"https://bootcamp.rocketacademy.co/logistics/course-methodology#scrum"}]},"postClass":{"items":[{"name":"Project 2 Implementation","url":"https://bootcamp.rocketacademy.co/2-full-stack/2.p-full-stack-app-firebase"}]}}}},"01-05-2023":{"courseDay":null,"courseDate":"01-05-2023","courseWeek":7,"dayNumber":1,"dateTypes":{"holidayType":"public holiday","date":"01-05-2023","location":"SG","name":"Labour Day"}},"02-05-2023":{"courseDate":"02-05-2023","courseWeek":7,"weekDay":1,"dayNumber":2,"meetingDateTimeUTC":"2023-05-02T02:00:00.000Z","courseDay":25,"dateTypes":{"module":"Module 2: Full-Stack","general":{"type":"general","preClass":{},"inClass":{},"postClass":{}},"css":{"type":"css","preClass":{},"inClass":{},"postClass":{}},"algos":{"type":"algos","preClass":{"items":[{"name":"A.4: Recursion - Pre-Class","url":"https://bootcamp.rocketacademy.co/algorithms/a.4-recursion#pre-class"}]},"inClass":{"items":[{"name":"A.4: Recursion - Part 1","url":"https://bootcamp.rocketacademy.co/algorithms/a.4-recursion#part-1"}]},"postClass":{"items":[{"name":"A.4: Recursion - Part 1","url":"https://bootcamp.rocketacademy.co/algorithms/a.4-recursion#part-1"}]}},"ux":{"type":"ux","preClass":{},"inClass":{},"postClass":{}},"ip":{"type":"ip","ipDue":{},"preClass":{},"inClass":{},"postClass":{}},"projects":{"type":"projects","projectStart":{},"projectDue":{},"preClass":{},"inClass":{"items":[{"name":"Project 2 Scrum","url":"https://bootcamp.rocketacademy.co/logistics/course-methodology#scrum"}]},"postClass":{"items":[{"name":"Project 2 Implementation","url":"https://bootcamp.rocketacademy.co/2-full-stack/2.p-full-stack-app-firebase"}]}}}},"03-05-2023":{"courseDate":"03-05-2023","courseWeek":7,"weekDay":2,"dayNumber":3,"meetingDateTimeUTC":"2023-05-03T02:00:00.000Z","courseDay":26,"dateTypes":{"module":"Module 2: Full-Stack","general":{"type":"general","preClass":{},"inClass":{},"postClass":{}},"css":{"type":"css","preClass":{},"inClass":{},"postClass":{}},"algos":{"type":"algos","preClass":{},"inClass":{"items":[{"name":"A.4: Recursion - Part 2","url":"https://bootcamp.rocketacademy.co/algorithms/a.4-recursion#part-2"}]},"postClass":{"items":[{"name":"A.4: Recursion - Part 2","url":"https://bootcamp.rocketacademy.co/algorithms/a.4-recursion#part-2"}]}},"ux":{"type":"ux","preClass":{},"inClass":{},"postClass":{}},"ip":{"type":"ip","ipDue":{},"preClass":{},"inClass":{},"postClass":{}},"projects":{"type":"projects","projectStart":{},"projectDue":{"items":[{"name":"Project 2 MVP Deadline","url":"https://bootcamp.rocketacademy.co/2-full-stack/2.p-full-stack-app-firebase"}]},"preClass":{},"inClass":{"items":[{"name":"Project 2 Scrum","url":"https://bootcamp.rocketacademy.co/logistics/course-methodology#scrum"}]},"postClass":{"items":[{"name":"Project 2 Implementation","url":"https://bootcamp.rocketacademy.co/2-full-stack/2.p-full-stack-app-firebase"}]}}}},"04-05-2023":{"courseDate":"04-05-2023","courseWeek":7,"weekDay":3,"dayNumber":4,"meetingDateTimeUTC":"2023-05-04T02:00:00.000Z","courseDay":27,"dateTypes":{"module":"Module 2: Full-Stack","general":{"type":"general","preClass":{},"inClass":{},"postClass":{}},"css":{"type":"css","preClass":{},"inClass":{},"postClass":{}},"algos":{"type":"algos","preClass":{},"inClass":{},"postClass":{}},"ux":{"type":"ux","preClass":{},"inClass":{},"postClass":{}},"ip":{"type":"ip","ipDue":{},"preClass":{},"inClass":{},"postClass":{}},"projects":{"type":"projects","projectStart":{},"projectDue":{},"preClass":{},"inClass":{"items":[{"name":"Project 2 Scrum","url":"https://bootcamp.rocketacademy.co/logistics/course-methodology#scrum"}]},"postClass":{"items":[{"name":"Project 2 Implementation","url":"https://bootcamp.rocketacademy.co/2-full-stack/2.p-full-stack-app-firebase"}]}}}},"08-05-2023":{"courseDate":"08-05-2023","courseWeek":8,"weekDay":1,"dayNumber":1,"meetingDateTimeUTC":"2023-05-08T02:00:00.000Z","courseDay":28,"dateTypes":{"module":"Module 2: Full-Stack","general":{"type":"general","preClass":{},"inClass":{},"postClass":{}},"css":{"type":"css","preClass":{},"inClass":{},"postClass":{}},"algos":{"type":"algos","preClass":{},"inClass":{},"postClass":{}},"ux":{"type":"ux","preClass":{},"inClass":{},"postClass":{}},"ip":{"type":"ip","ipDue":{},"preClass":{},"inClass":{},"postClass":{}},"projects":{"type":"projects","projectStart":{},"projectDue":{},"preClass":{},"inClass":{"items":[{"name":"Project 2 Scrum","url":"https://bootcamp.rocketacademy.co/logistics/course-methodology#scrum"}]},"postClass":{"items":[{"name":"Project 2 Implementation","url":"https://bootcamp.rocketacademy.co/2-full-stack/2.p-full-stack-app-firebase"}]}}}},"09-05-2023":{"courseDate":"09-05-2023","courseWeek":8,"weekDay":2,"dayNumber":2,"meetingDateTimeUTC":"2023-05-09T02:00:00.000Z","courseDay":29,"dateTypes":{"module":"Module 2: Full-Stack","general":{"type":"general","preClass":{},"inClass":{},"postClass":{}},"css":{"type":"css","preClass":{},"inClass":{},"postClass":{}},"algos":{"type":"algos","preClass":{},"inClass":{},"postClass":{}},"ux":{"type":"ux","preClass":{},"inClass":{},"postClass":{}},"ip":{"type":"ip","ipDue":{},"preClass":{},"inClass":{},"postClass":{}},"projects":{"type":"projects","projectStart":{},"projectDue":{},"preClass":{},"inClass":{"items":[{"name":"Project 2 Scrum","url":"https://bootcamp.rocketacademy.co/logistics/course-methodology#scrum"}]},"postClass":{"items":[{"name":"Project 2 Implementation","url":"https://bootcamp.rocketacademy.co/2-full-stack/2.p-full-stack-app-firebase"}]}}}},"10-05-2023":{"courseDate":"10-05-2023","courseWeek":8,"weekDay":3,"dayNumber":3,"meetingDateTimeUTC":"2023-05-10T02:00:00.000Z","courseDay":30,"dateTypes":{"module":"Module 2: Full-Stack","general":{"type":"general","preClass":{},"inClass":{},"postClass":{}},"css":{"type":"css","preClass":{},"inClass":{},"postClass":{}},"algos":{"type":"algos","preClass":{},"inClass":{},"postClass":{}},"ux":{"type":"ux","preClass":{},"inClass":{},"postClass":{}},"ip":{"type":"ip","ipDue":{},"preClass":{},"inClass":{},"postClass":{}},"projects":{"type":"projects","projectStart":{},"projectDue":{"items":[{"name":"Project 2 Feature Freeze","url":"https://bootcamp.rocketacademy.co/2-full-stack/2.p-full-stack-app-firebase"}]},"preClass":{},"inClass":{"items":[{"name":"Project 2 Scrum","url":"https://bootcamp.rocketacademy.co/logistics/course-methodology#scrum"}]},"postClass":{"items":[{"name":"Project 2 Implementation","url":"https://bootcamp.rocketacademy.co/2-full-stack/2.p-full-stack-app-firebase"}]}}}},"11-05-2023":{"courseDate":"11-05-2023","courseWeek":8,"weekDay":4,"dayNumber":4,"meetingDateTimeUTC":"2023-05-11T02:00:00.000Z","courseDay":31,"dateTypes":{"module":"Module 2: Full-Stack","general":{"type":"general","preClass":{},"inClass":{},"postClass":{}},"css":{"type":"css","preClass":{},"inClass":{},"postClass":{}},"algos":{"type":"algos","preClass":{},"inClass":{},"postClass":{}},"ux":{"type":"ux","preClass":{},"inClass":{},"postClass":{}},"ip":{"type":"ip","ipDue":{},"preClass":{},"inClass":{},"postClass":{}},"projects":{"type":"projects","projectStart":{},"projectDue":{},"preClass":{},"inClass":{"items":[{"name":"Project 2 Scrum","url":"https://bootcamp.rocketacademy.co/logistics/course-methodology#scrum"}]},"postClass":{"items":[{"name":"Project 2 Implementation","url":"https://bootcamp.rocketacademy.co/2-full-stack/2.p-full-stack-app-firebase"}]}}}},"15-05-2023":{"courseDate":"15-05-2023","courseWeek":9,"weekDay":1,"dayNumber":1,"meetingDateTimeUTC":"2023-05-15T02:00:00.000Z","courseDay":32,"dateTypes":{"module":"Module 2: Full-Stack","general":{"type":"general","preClass":{},"inClass":{},"postClass":{}},"css":{"type":"css","preClass":{},"inClass":{},"postClass":{}},"algos":{"type":"algos","preClass":{},"inClass":{},"postClass":{}},"ux":{"type":"ux","preClass":{},"inClass":{},"postClass":{}},"ip":{"type":"ip","ipDue":{},"preClass":{},"inClass":{},"postClass":{}},"projects":{"type":"projects","projectStart":{},"projectDue":{"items":[{"name":"Project 2 Presentations","url":"https://bootcamp.rocketacademy.co/2-full-stack/2.p-full-stack-app-firebase"}]},"preClass":{},"inClass":{"items":[{"name":"Project 2 Presentations","url":"https://bootcamp.rocketacademy.co/2-full-stack/2.p-full-stack-app-firebase"}]},"postClass":{"items":[{"name":"Project 2 Post-Mortems","url":"https://bootcamp.rocketacademy.co/logistics/course-methodology#post-mortem"}]}}}},"16-05-2023":{"courseDate":"16-05-2023","courseWeek":9,"weekDay":2,"dayNumber":2,"meetingDateTimeUTC":"2023-05-16T02:00:00.000Z","courseDay":33,"dateTypes":{"module":"Module 3: Backend","general":{"type":"general","preClass":{"items":[{"name":"3.1: Express.js (1)","url":"https://bootcamp.rocketacademy.co/3-backend/3.1-express.js"},{"name":"0.4.6.1: Async Await","url":"https://bootcamp.rocketacademy.co/0-foundations/0.4-javascript/0.4.6-promises/0.4.6.1-async-await"}]},"inClass":{"items":[{"name":"3.E.1: Bigfoot JSON","url":"https://bootcamp.rocketacademy.co/3-backend/3.e-exercises/3.e.1-bigfoot-json"}]},"postClass":{"items":[{"name":"3.E.1: Bigfoot JSON","url":"https://bootcamp.rocketacademy.co/3-backend/3.e-exercises/3.e.1-bigfoot-json"}]}},"css":{"type":"css","preClass":{},"inClass":{},"postClass":{}},"algos":{"type":"algos","preClass":{},"inClass":{},"postClass":{}},"ux":{"type":"ux","preClass":{},"inClass":{},"postClass":{}},"ip":{"type":"ip","ipDue":{},"preClass":{},"inClass":{},"postClass":{}},"projects":{"type":"projects","projectStart":{},"projectDue":{},"preClass":{},"inClass":{},"postClass":{}}}},"17-05-2023":{"courseDate":"17-05-2023","courseWeek":9,"weekDay":3,"dayNumber":3,"meetingDateTimeUTC":"2023-05-17T02:00:00.000Z","courseDay":34,"dateTypes":{"module":"Module 3: Backend","general":{"type":"general","preClass":{"items":[{"name":"3.1: Express.js (2)","url":"https://bootcamp.rocketacademy.co/3-backend/3.1-express.js"},{"name":"0.5.3: Nodemon","url":"https://bootcamp.rocketacademy.co/0-foundations/0.5-node.js/0.5.3-nodemon"}]},"inClass":{"items":[{"name":"3.E.1: Bigfoot JSON","url":"https://bootcamp.rocketacademy.co/3-backend/3.e-exercises/3.e.1-bigfoot-json"}]},"postClass":{"items":[{"name":"3.E.1: Bigfoot JSON","url":"https://bootcamp.rocketacademy.co/3-backend/3.e-exercises/3.e.1-bigfoot-json"}]}},"css":{"type":"css","preClass":{},"inClass":{},"postClass":{}},"algos":{"type":"algos","preClass":{"items":[{"name":"A.1.6: Trees - Pre-Class","url":"https://bootcamp.rocketacademy.co/algorithms/a.1-data-structures/a.1.6-trees#pre-class"}]},"inClass":{"items":[{"name":"A.1.6: Trees - Part 1","url":"https://bootcamp.rocketacademy.co/algorithms/a.1-data-structures/a.1.6-trees#part-1"}]},"postClass":{"items":[{"name":"A.1.6: Trees - Part 1","url":"https://bootcamp.rocketacademy.co/algorithms/a.1-data-structures/a.1.6-trees#part-1"}]}},"ux":{"type":"ux","preClass":{},"inClass":{},"postClass":{}},"ip":{"type":"ip","ipDue":{},"preClass":{},"inClass":{},"postClass":{}},"projects":{"type":"projects","projectStart":{},"projectDue":{},"preClass":{},"inClass":{},"postClass":{}}}},"18-05-2023":{"courseDate":"18-05-2023","courseWeek":9,"weekDay":4,"dayNumber":4,"meetingDateTimeUTC":"2023-05-18T02:00:00.000Z","courseDay":35,"dateTypes":{"module":"Module 3: Backend","general":{"type":"general","preClass":{"items":[{"name":"3.2: SQL","url":"https://bootcamp.rocketacademy.co/3-backend/3.2-sql"}]},"inClass":{"items":[{"name":"3.2: SQL","url":"https://bootcamp.rocketacademy.co/3-backend/3.2-sql"}]},"postClass":{"items":[{"name":"3.2: SQL - Codecademy Learn SQL","url":"https://bootcamp.rocketacademy.co/3-backend/3.2-sql#post-class-exercises-codecademy-learn-sql"}]}},"css":{"type":"css","preClass":{},"inClass":{},"postClass":{}},"algos":{"type":"algos","preClass":{},"inClass":{},"postClass":{}},"ux":{"type":"ux","preClass":{},"inClass":{},"postClass":{}},"ip":{"type":"ip","ipDue":{},"preClass":{},"inClass":{},"postClass":{}},"projects":{"type":"projects","projectStart":{},"projectDue":{},"preClass":{},"inClass":{},"postClass":{}}}},"22-05-2023":{"courseDate":"22-05-2023","courseWeek":10,"weekDay":1,"dayNumber":1,"meetingDateTimeUTC":"2023-05-22T02:00:00.000Z","courseDay":36,"dateTypes":{"module":"Module 3: Backend","general":{"type":"general","preClass":{"items":[{"name":"3.3: Sequelize (1)","url":"https://bootcamp.rocketacademy.co/3-backend/3.3-sequelize"}]},"inClass":{"items":[{"name":"3.E.2: Bigfoot SQL Setup","url":"https://bootcamp.rocketacademy.co/3-backend/3.e-exercises/3.e.2-bigfoot-sql"}]},"postClass":{"items":[{"name":"3.E.2: Bigfoot SQL","url":"https://bootcamp.rocketacademy.co/3-backend/3.e-exercises/3.e.2-bigfoot-sql"}]}},"css":{"type":"css","preClass":{},"inClass":{},"postClass":{}},"algos":{"type":"algos","preClass":{},"inClass":{"items":[{"name":"A.1.6: Trees - Part 2","url":"https://bootcamp.rocketacademy.co/algorithms/a.1-data-structures/a.1.6-trees#part-2"}]},"postClass":{"items":[{"name":"A.1.6: Trees - Part 2","url":"https://bootcamp.rocketacademy.co/algorithms/a.1-data-structures/a.1.6-trees#part-2"}]}},"ux":{"type":"ux","preClass":{},"inClass":{},"postClass":{}},"ip":{"type":"ip","ipDue":{},"preClass":{},"inClass":{},"postClass":{}},"projects":{"type":"projects","projectStart":{},"projectDue":{},"preClass":{},"inClass":{},"postClass":{}}}},"23-05-2023":{"courseDate":"23-05-2023","courseWeek":10,"weekDay":2,"dayNumber":2,"meetingDateTimeUTC":"2023-05-23T02:00:00.000Z","courseDay":37,"dateTypes":{"module":"Module 3: Backend","general":{"type":"general","preClass":{"items":[{"name":"3.3: Sequelize (2)","url":"https://bootcamp.rocketacademy.co/3-backend/3.3-sequelize"}]},"inClass":{"items":[{"name":"3.E.2: Bigfoot SQL","url":"https://bootcamp.rocketacademy.co/3-backend/3.e-exercises/3.e.2-bigfoot-sql"}]},"postClass":{"items":[{"name":"3.E.2: Bigfoot SQL","url":"https://bootcamp.rocketacademy.co/3-backend/3.e-exercises/3.e.2-bigfoot-sql"}]}},"css":{"type":"css","preClass":{},"inClass":{},"postClass":{}},"algos":{"type":"algos","preClass":{},"inClass":{},"postClass":{}},"ux":{"type":"ux","preClass":{},"inClass":{},"postClass":{}},"ip":{"type":"ip","ipDue":{},"preClass":{},"inClass":{},"postClass":{}},"projects":{"type":"projects","projectStart":{},"projectDue":{},"preClass":{},"inClass":{},"postClass":{}}}},"24-05-2023":{"courseDate":"24-05-2023","courseWeek":10,"weekDay":3,"dayNumber":3,"meetingDateTimeUTC":"2023-05-24T02:00:00.000Z","courseDay":38,"dateTypes":{"module":"Module 3: Backend","general":{"type":"general","preClass":{"items":[{"name":"3.1.1: MVC","url":"https://bootcamp.rocketacademy.co/3-backend/3.1-express.js/3.1.1-mvc"}]},"inClass":{"items":[{"name":"3.1.1: MVC","url":"https://bootcamp.rocketacademy.co/3-backend/3.1-express.js/3.1.1-mvc"}]},"postClass":{"items":[{"name":"3.1.1: MVC","url":"https://bootcamp.rocketacademy.co/3-backend/3.1-express.js/3.1.1-mvc#exercise"}]}},"css":{"type":"css","preClass":{},"inClass":{},"postClass":{}},"algos":{"type":"algos","preClass":{},"inClass":{},"postClass":{}},"ux":{"type":"ux","preClass":{},"inClass":{},"postClass":{}},"ip":{"type":"ip","ipDue":{},"preClass":{},"inClass":{},"postClass":{}},"projects":{"type":"projects","projectStart":{},"projectDue":{},"preClass":{},"inClass":{},"postClass":{}}}},"25-05-2023":{"courseDate":"25-05-2023","courseWeek":10,"weekDay":4,"dayNumber":4,"meetingDateTimeUTC":"2023-05-25T02:00:00.000Z","courseDay":39,"dateTypes":{"module":"Module 3: Backend","general":{"type":"general","preClass":{},"inClass":{"items":[{"name":"Application doubt clearing","url":"https://bootcamp.rocketacademy.co/3-backend/3.1-express.js/3.1.1-mvc"}]},"postClass":{}},"css":{"type":"css","preClass":{},"inClass":{},"postClass":{}},"algos":{"type":"algos","preClass":{"items":[{"name":"A.1.6: Trees - Part 3","url":"https://bootcamp.rocketacademy.co/algorithms/a.1-data-structures/a.1.6-trees#part-3"}]},"inClass":{"items":[{"name":"A.1.6: Trees - Part 3","url":"https://bootcamp.rocketacademy.co/algorithms/a.1-data-structures/a.1.6-trees#part-3"}]},"postClass":{"items":[{"name":"A.1.6: Trees - Part 3","url":"https://bootcamp.rocketacademy.co/algorithms/a.1-data-structures/a.1.6-trees#part-3"}]}},"ux":{"type":"ux","preClass":{},"inClass":{},"postClass":{}},"ip":{"type":"ip","ipDue":{},"preClass":{},"inClass":{},"postClass":{}},"projects":{"type":"projects","projectStart":{},"projectDue":{},"preClass":{},"inClass":{},"postClass":{}}}},"29-05-2023":{"courseDate":"29-05-2023","courseWeek":11,"weekDay":1,"dayNumber":1,"meetingDateTimeUTC":"2023-05-29T02:00:00.000Z","courseDay":40,"dateTypes":{"module":"Module 3: Backend","general":{"type":"general","preClass":{"items":[{"name":"3.2.1: SQL 1-M Relationships","url":"https://bootcamp.rocketacademy.co/3-backend/3.2-sql/3.2.1-sql-1-m-relationships"},{"name":"3.3.1: Sequelize 1-M Relationships","url":"https://bootcamp.rocketacademy.co/3-backend/3.3-sequelize/3.3.1-sequelize-1-m-relationships"}]},"inClass":{"items":[{"name":"3.E.3: Bigfoot SQL 1-M","url":"https://bootcamp.rocketacademy.co/3-backend/3.e-exercises/3.e.3-bigfoot-sql-1-m"}]},"postClass":{"items":[{"name":"3.E.3: Bigfoot SQL 1-M","url":"https://bootcamp.rocketacademy.co/3-backend/3.e-exercises/3.e.3-bigfoot-sql-1-m"}]}},"css":{"type":"css","preClass":{},"inClass":{},"postClass":{}},"algos":{"type":"algos","preClass":{},"inClass":{},"postClass":{}},"ux":{"type":"ux","preClass":{},"inClass":{},"postClass":{}},"ip":{"type":"ip","ipDue":{},"preClass":{},"inClass":{},"postClass":{}},"projects":{"type":"projects","projectStart":{"items":[{"name":"Project 3 Ideation Phase 1","url":"https://bootcamp.rocketacademy.co/3-backend/3.p-full-stack-app-express"}]},"projectDue":{},"preClass":{},"inClass":{},"postClass":{"items":[{"name":"Project 3 Ideation Phase 1","url":"https://bootcamp.rocketacademy.co/3-backend/3.p-full-stack-app-express"}]}}}},"30-05-2023":{"courseDate":"30-05-2023","courseWeek":11,"weekDay":2,"dayNumber":2,"meetingDateTimeUTC":"2023-05-30T02:00:00.000Z","courseDay":41,"dateTypes":{"module":"Module 3: Backend","general":{"type":"general","preClass":{"items":[{"name":"3.2.2: SQL M-M Relationships","url":"https://bootcamp.rocketacademy.co/3-backend/3.2-sql/3.2.2-sql-m-m-relationships"},{"name":"3.3.2: Sequelize M-M Relationships","url":"https://bootcamp.rocketacademy.co/3-backend/3.3-sequelize/3.3.2-sequelize-m-m-relationships"}]},"inClass":{"items":[{"name":"3.E.4: Bigfoot SQL M-M (Day 1 of 2)","url":"https://bootcamp.rocketacademy.co/3-backend/3.e-exercises/3.e.4-bigfoot-sql-m-m"}]},"postClass":{"items":[{"name":"3.E.4: Bigfoot SQL M-M (Day 1 of 2)","url":"https://bootcamp.rocketacademy.co/3-backend/3.e-exercises/3.e.4-bigfoot-sql-m-m"}]}},"css":{"type":"css","preClass":{},"inClass":{},"postClass":{}},"algos":{"type":"algos","preClass":{},"inClass":{},"postClass":{}},"ux":{"type":"ux","preClass":{},"inClass":{},"postClass":{}},"ip":{"type":"ip","ipDue":{},"preClass":{},"inClass":{},"postClass":{}},"projects":{"type":"projects","projectStart":{},"projectDue":{},"preClass":{},"inClass":{},"postClass":{"items":[{"name":"Project 3 Ideation Phase 1","url":"https://bootcamp.rocketacademy.co/3-backend/3.p-full-stack-app-express"}]}}}},"31-05-2023":{"courseDate":"31-05-2023","courseWeek":11,"weekDay":3,"dayNumber":3,"meetingDateTimeUTC":"2023-05-31T02:00:00.000Z","courseDay":42,"dateTypes":{"module":"Module 3: Backend","general":{"type":"general","preClass":{"items":[{"name":"3.2.3: SQL Schema Design","url":"https://bootcamp.rocketacademy.co/3-backend/3.2-sql/3.2.3-sql-schema-design"}]},"inClass":{"items":[{"name":"3.E.5: Carousell Schema Design","url":"https://bootcamp.rocketacademy.co/3-backend/3.e-exercises/3.e.5-carousell-schema-design"}]},"postClass":{"items":[{"name":"3.E.4: Bigfoot SQL M-M (Day 2 of 2)","url":"https://bootcamp.rocketacademy.co/3-backend/3.e-exercises/3.e.4-bigfoot-sql-m-m"},{"name":"3.E.5: Carousell Schema Design","url":"https://bootcamp.rocketacademy.co/3-backend/3.e-exercises/3.e.5-carousell-schema-design"}]}},"css":{"type":"css","preClass":{},"inClass":{},"postClass":{}},"algos":{"type":"algos","preClass":{},"inClass":{},"postClass":{}},"ux":{"type":"ux","preClass":{},"inClass":{},"postClass":{}},"ip":{"type":"ip","ipDue":{},"preClass":{},"inClass":{},"postClass":{}},"projects":{"type":"projects","projectStart":{},"projectDue":{},"preClass":{},"inClass":{},"postClass":{"items":[{"name":"Project 3 Ideation Phase 1","url":"https://bootcamp.rocketacademy.co/3-backend/3.p-full-stack-app-express"}]}}}},"01-06-2023":{"courseDate":"01-06-2023","courseWeek":11,"weekDay":4,"dayNumber":4,"meetingDateTimeUTC":"2023-06-01T02:00:00.000Z","courseDay":43,"dateTypes":{"module":"Module 3: Backend","general":{"type":"general","preClass":{"items":[{"name":"3.4: Authentication","url":"https://bootcamp.rocketacademy.co/3-backend/3.4-authentication"}]},"inClass":{"items":[{"name":"3.E.6: Carousell Auth","url":"https://bootcamp.rocketacademy.co/3-backend/3.e-exercises/3.e.6-carousell-auth"}]},"postClass":{"items":[{"name":"3.E.6: Carousell Auth","url":"https://bootcamp.rocketacademy.co/3-backend/3.e-exercises/3.e.6-carousell-auth"}]}},"css":{"type":"css","preClass":{},"inClass":{},"postClass":{}},"algos":{"type":"algos","preClass":{},"inClass":{},"postClass":{}},"ux":{"type":"ux","preClass":{},"inClass":{},"postClass":{}},"ip":{"type":"ip","ipDue":{},"preClass":{},"inClass":{},"postClass":{}},"projects":{"type":"projects","projectStart":{},"projectDue":{},"preClass":{},"inClass":{},"postClass":{"items":[{"name":"Project 3 Ideation Phase 1","url":"https://bootcamp.rocketacademy.co/3-backend/3.p-full-stack-app-express"}]}}}},"05-06-2023":{"courseDate":"05-06-2023","courseWeek":12,"weekDay":1,"dayNumber":1,"meetingDateTimeUTC":"2023-06-05T02:00:00.000Z","courseDay":44,"dateTypes":{"module":"Module 3: Backend","general":{"type":"general","preClass":{"items":[{"name":"3.2.4: Advanced SQL Concepts","url":"https://bootcamp.rocketacademy.co/3-backend/3.2-sql/3.2.4-advanced-sql-concepts"},{"name":"3.3.3: Advanced Sequelize Concepts","url":"https://bootcamp.rocketacademy.co/3-backend/3.3-sequelize/3.3.3-advanced-sequelize-concepts"}]},"inClass":{},"postClass":{}},"css":{"type":"css","preClass":{},"inClass":{},"postClass":{}},"algos":{"type":"algos","preClass":{"items":[{"name":"A.1.7: Graphs - Pre-Class","url":"https://bootcamp.rocketacademy.co/algorithms/a.1-data-structures/a.1.7-graphs#pre-class"}]},"inClass":{"items":[{"name":"A.1.7: Graphs - Part 1","url":"https://bootcamp.rocketacademy.co/algorithms/a.1-data-structures/a.1.7-graphs#part-1"}]},"postClass":{"items":[{"name":"A.1.7: Graphs - Part 1","url":"https://bootcamp.rocketacademy.co/algorithms/a.1-data-structures/a.1.7-graphs#part-1"}]}},"ux":{"type":"ux","preClass":{},"inClass":{},"postClass":{}},"ip":{"type":"ip","ipDue":{},"preClass":{},"inClass":{},"postClass":{}},"projects":{"type":"projects","projectStart":{"items":[{"name":"Project 3 Ideation Phase 2","url":"https://bootcamp.rocketacademy.co/3-backend/3.p-full-stack-app-express"}]},"projectDue":{},"preClass":{},"inClass":{"items":[{"name":"Project 3 Ideation Phase 2","url":"https://bootcamp.rocketacademy.co/3-backend/3.p-full-stack-app-express"}]},"postClass":{"items":[{"name":"Project 3 Ideation Phase 2","url":"https://bootcamp.rocketacademy.co/3-backend/3.p-full-stack-app-express"}]}}}},"06-06-2023":{"courseDate":"06-06-2023","courseWeek":12,"weekDay":2,"dayNumber":2,"meetingDateTimeUTC":"2023-06-06T02:00:00.000Z","courseDay":45,"dateTypes":{"module":"Module 3: Backend","general":{"type":"general","preClass":{},"inClass":{},"postClass":{}},"css":{"type":"css","preClass":{},"inClass":{},"postClass":{}},"algos":{"type":"algos","preClass":{},"inClass":{"items":[{"name":"A.1.7: Graphs - Part 2","url":"https://bootcamp.rocketacademy.co/algorithms/a.1-data-structures/a.1.7-graphs#part-2"}]},"postClass":{"items":[{"name":"A.1.7: Graphs - Part 2","url":"https://bootcamp.rocketacademy.co/algorithms/a.1-data-structures/a.1.7-graphs#part-2"}]}},"ux":{"type":"ux","preClass":{},"inClass":{},"postClass":{}},"ip":{"type":"ip","ipDue":{},"preClass":{},"inClass":{},"postClass":{}},"projects":{"type":"projects","projectStart":{},"projectDue":{"items":[{"name":"Project 3 Ideation Phase 2","url":"https://bootcamp.rocketacademy.co/3-backend/3.p-full-stack-app-express"}]},"preClass":{},"inClass":{"items":[{"name":"Project 3 Scrum","url":"https://bootcamp.rocketacademy.co/logistics/course-methodology#scrum"}]},"postClass":{"items":[{"name":"Project 3 Implementation","url":"https://bootcamp.rocketacademy.co/3-backend/3.p-full-stack-app-express"}]}}}},"07-06-2023":{"courseDate":"07-06-2023","courseWeek":12,"weekDay":3,"dayNumber":3,"meetingDateTimeUTC":"2023-06-07T02:00:00.000Z","courseDay":46,"dateTypes":{"module":"Module 3: Backend","general":{"type":"general","preClass":{},"inClass":{},"postClass":{}},"css":{"type":"css","preClass":{},"inClass":{},"postClass":{}},"algos":{"type":"algos","preClass":{},"inClass":{"items":[{"name":"A.1.7: Graphs - Part 3","url":"https://bootcamp.rocketacademy.co/algorithms/a.1-data-structures/a.1.7-graphs#part-3"}]},"postClass":{"items":[{"name":"A.1.7: Graphs - Part 3","url":"https://bootcamp.rocketacademy.co/algorithms/a.1-data-structures/a.1.7-graphs#part-3"}]}},"ux":{"type":"ux","preClass":{},"inClass":{},"postClass":{}},"ip":{"type":"ip","ipDue":{},"preClass":{},"inClass":{},"postClass":{}},"projects":{"type":"projects","projectStart":{},"projectDue":{},"preClass":{},"inClass":{"items":[{"name":"Project 3 Scrum","url":"https://bootcamp.rocketacademy.co/logistics/course-methodology#scrum"}]},"postClass":{"items":[{"name":"Project 3 Implementation","url":"https://bootcamp.rocketacademy.co/3-backend/3.p-full-stack-app-express"}]}}}},"08-06-2023":{"courseDate":"08-06-2023","courseWeek":12,"weekDay":4,"dayNumber":4,"meetingDateTimeUTC":"2023-06-08T02:00:00.000Z","courseDay":47,"dateTypes":{"module":"Module 3: Backend","general":{"type":"general","preClass":{},"inClass":{},"postClass":{}},"css":{"type":"css","preClass":{},"inClass":{},"postClass":{}},"algos":{"type":"algos","preClass":{},"inClass":{},"postClass":{}},"ux":{"type":"ux","preClass":{},"inClass":{},"postClass":{}},"ip":{"type":"ip","ipDue":{},"preClass":{},"inClass":{},"postClass":{}},"projects":{"type":"projects","projectStart":{},"projectDue":{"items":[{"name":"Project 3 MVP Deadline","url":"https://bootcamp.rocketacademy.co/3-backend/3.p-full-stack-app-express"}]},"preClass":{},"inClass":{"items":[{"name":"Project 3 Scrum","url":"https://bootcamp.rocketacademy.co/logistics/course-methodology#scrum"}]},"postClass":{"items":[{"name":"Project 3 Implementation","url":"https://bootcamp.rocketacademy.co/3-backend/3.p-full-stack-app-express"}]}}}},"12-06-2023":{"courseDate":"12-06-2023","courseWeek":13,"weekDay":1,"dayNumber":1,"meetingDateTimeUTC":"2023-06-12T02:00:00.000Z","courseDay":48,"dateTypes":{"module":"Module 3: Backend","general":{"type":"general","preClass":{},"inClass":{},"postClass":{}},"css":{"type":"css","preClass":{},"inClass":{},"postClass":{}},"algos":{"type":"algos","preClass":{},"inClass":{},"postClass":{}},"ux":{"type":"ux","preClass":{},"inClass":{},"postClass":{}},"ip":{"type":"ip","ipDue":{},"preClass":{},"inClass":{},"postClass":{}},"projects":{"type":"projects","projectStart":{},"projectDue":{},"preClass":{},"inClass":{"items":[{"name":"Project 3 Scrum","url":"https://bootcamp.rocketacademy.co/logistics/course-methodology#scrum"}]},"postClass":{"items":[{"name":"Project 3 Implementation","url":"https://bootcamp.rocketacademy.co/3-backend/3.p-full-stack-app-express"}]}}}},"13-06-2023":{"courseDate":"13-06-2023","courseWeek":13,"weekDay":2,"dayNumber":2,"meetingDateTimeUTC":"2023-06-13T02:00:00.000Z","courseDay":49,"dateTypes":{"module":"Module 3: Backend","general":{"type":"general","preClass":{},"inClass":{},"postClass":{}},"css":{"type":"css","preClass":{},"inClass":{},"postClass":{}},"algos":{"type":"algos","preClass":{},"inClass":{},"postClass":{}},"ux":{"type":"ux","preClass":{},"inClass":{},"postClass":{}},"ip":{"type":"ip","ipDue":{},"preClass":{},"inClass":{},"postClass":{}},"projects":{"type":"projects","projectStart":{},"projectDue":{},"preClass":{},"inClass":{"items":[{"name":"Project 3 Scrum","url":"https://bootcamp.rocketacademy.co/logistics/course-methodology#scrum"}]},"postClass":{"items":[{"name":"Project 3 Implementation","url":"https://bootcamp.rocketacademy.co/3-backend/3.p-full-stack-app-express"}]}}}},"14-06-2023":{"courseDate":"14-06-2023","courseWeek":13,"weekDay":3,"dayNumber":3,"meetingDateTimeUTC":"2023-06-14T02:00:00.000Z","courseDay":50,"dateTypes":{"module":"Module 3: Backend","general":{"type":"general","preClass":{},"inClass":{},"postClass":{}},"css":{"type":"css","preClass":{},"inClass":{},"postClass":{}},"algos":{"type":"algos","preClass":{},"inClass":{},"postClass":{}},"ux":{"type":"ux","preClass":{},"inClass":{},"postClass":{}},"ip":{"type":"ip","ipDue":{},"preClass":{},"inClass":{},"postClass":{}},"projects":{"type":"projects","projectStart":{},"projectDue":{"items":[{"name":"Project 3 Feature Freeze","url":"https://bootcamp.rocketacademy.co/3-backend/3.p-full-stack-app-express"}]},"preClass":{},"inClass":{"items":[{"name":"Project 3 Scrum","url":"https://bootcamp.rocketacademy.co/logistics/course-methodology#scrum"}]},"postClass":{"items":[{"name":"Project 3 Implementation","url":"https://bootcamp.rocketacademy.co/3-backend/3.p-full-stack-app-express"}]}}}},"15-06-2023":{"courseDate":"15-06-2023","courseWeek":13,"weekDay":4,"dayNumber":4,"meetingDateTimeUTC":"2023-06-15T02:00:00.000Z","courseDay":51,"dateTypes":{"module":"Module 3: Backend","general":{"type":"general","preClass":{},"inClass":{},"postClass":{}},"css":{"type":"css","preClass":{},"inClass":{},"postClass":{}},"algos":{"type":"algos","preClass":{},"inClass":{},"postClass":{}},"ux":{"type":"ux","preClass":{},"inClass":{},"postClass":{}},"ip":{"type":"ip","ipDue":{},"preClass":{},"inClass":{},"postClass":{}},"projects":{"type":"projects","projectStart":{},"projectDue":{},"preClass":{},"inClass":{"items":[{"name":"Project 3 Scrum","url":"https://bootcamp.rocketacademy.co/logistics/course-methodology#scrum"}]},"postClass":{"items":[{"name":"Project 3 Implementation","url":"https://bootcamp.rocketacademy.co/3-backend/3.p-full-stack-app-express"}]}}}},"19-06-2023":{"courseDate":"19-06-2023","courseWeek":14,"weekDay":1,"dayNumber":1,"meetingDateTimeUTC":"2023-06-19T02:00:00.000Z","courseDay":52,"dateTypes":{"module":"Module 3: Backend","general":{"type":"general","preClass":{},"inClass":{},"postClass":{}},"css":{"type":"css","preClass":{},"inClass":{},"postClass":{}},"algos":{"type":"algos","preClass":{},"inClass":{},"postClass":{}},"ux":{"type":"ux","preClass":{},"inClass":{},"postClass":{}},"ip":{"type":"ip","ipDue":{},"preClass":{},"inClass":{},"postClass":{}},"projects":{"type":"projects","projectStart":{},"projectDue":{"items":[{"name":"Project 3 Presentations","url":"https://bootcamp.rocketacademy.co/3-backend/3.p-full-stack-app-express"}]},"preClass":{},"inClass":{"items":[{"name":"Project 3 Presentations","url":"https://bootcamp.rocketacademy.co/3-backend/3.p-full-stack-app-express"}]},"postClass":{"items":[{"name":"Project 3 Post-Mortems","url":"https://bootcamp.rocketacademy.co/logistics/course-methodology#post-mortem"}]}}}},"20-06-2023":{"courseDate":"20-06-2023","courseWeek":14,"weekDay":2,"dayNumber":2,"meetingDateTimeUTC":"2023-06-20T02:00:00.000Z","courseDay":53,"dateTypes":{"module":"Module 4: Capstone","general":{"type":"general","preClass":{"items":[{"name":"4.1: Testing","url":"https://bootcamp.rocketacademy.co/4-capstone/4.1-testing"}]},"inClass":{},"postClass":{}},"css":{"type":"css","preClass":{},"inClass":{},"postClass":{}},"algos":{"type":"algos","preClass":{"items":[{"name":"A.5: Dynamic Programming","url":"https://bootcamp.rocketacademy.co/algorithms/a.5-dynamic-programming"}]},"inClass":{"items":[{"name":"A.5: Dynamic Programming - Part 1","url":"https://bootcamp.rocketacademy.co/algorithms/a.5-dynamic-programming#part-1"}]},"postClass":{"items":[{"name":"A.5: Dynamic Programming - Part 1","url":"https://bootcamp.rocketacademy.co/algorithms/a.5-dynamic-programming#part-1"}]}},"ux":{"type":"ux","preClass":{},"inClass":{},"postClass":{}},"ip":{"type":"ip","ipDue":{},"preClass":{},"inClass":{},"postClass":{}},"projects":{"type":"projects","projectStart":{"items":[{"name":"Project 4 Ideation Phase 1","url":"https://bootcamp.rocketacademy.co/4-capstone/4.p-capstone"}]},"projectDue":{},"preClass":{},"inClass":{"items":[{"name":"Project 4 Ideation Phase 1","url":"https://bootcamp.rocketacademy.co/4-capstone/4.p-capstone"}]},"postClass":{"items":[{"name":"Project 4 Ideation Phase 1","url":"https://bootcamp.rocketacademy.co/4-capstone/4.p-capstone"}]}}}},"21-06-2023":{"courseDate":"21-06-2023","courseWeek":14,"weekDay":3,"dayNumber":3,"meetingDateTimeUTC":"2023-06-21T02:00:00.000Z","courseDay":54,"dateTypes":{"module":"Module 4: Capstone","general":{"type":"general","preClass":{"items":[{"name":"4.2: Continuous Integration","url":"https://bootcamp.rocketacademy.co/4-capstone/4.2-continuous-integration"}]},"inClass":{},"postClass":{}},"css":{"type":"css","preClass":{},"inClass":{},"postClass":{}},"algos":{"type":"algos","preClass":{},"inClass":{"items":[{"name":"A.5: Dynamic Programming - Part 2","url":"https://bootcamp.rocketacademy.co/algorithms/a.5-dynamic-programming#part-2"}]},"postClass":{"items":[{"name":"A.5: Dynamic Programming - Part 2","url":"https://bootcamp.rocketacademy.co/algorithms/a.5-dynamic-programming#part-2"}]}},"ux":{"type":"ux","preClass":{},"inClass":{},"postClass":{}},"ip":{"type":"ip","ipDue":{},"preClass":{},"inClass":{},"postClass":{}},"projects":{"type":"projects","projectStart":{},"projectDue":{},"preClass":{},"inClass":{"items":[{"name":"Project 4 Ideation Phase 1","url":"https://bootcamp.rocketacademy.co/4-capstone/4.p-capstone"}]},"postClass":{"items":[{"name":"Project 4 Ideation Phase 1","url":"https://bootcamp.rocketacademy.co/4-capstone/4.p-capstone"}]}}}},"22-06-2023":{"courseDate":"22-06-2023","courseWeek":14,"weekDay":4,"dayNumber":4,"meetingDateTimeUTC":"2023-06-22T02:00:00.000Z","courseDay":55,"dateTypes":{"module":"Module 4: Capstone","general":{"type":"general","preClass":{"items":[{"name":"4.3: TypeScript","url":"https://bootcamp.rocketacademy.co/4-capstone/4.3-typescript"}]},"inClass":{},"postClass":{}},"css":{"type":"css","preClass":{},"inClass":{},"postClass":{}},"algos":{"type":"algos","preClass":{},"inClass":{"items":[{"name":"A.5: Dynamic Programming - Part 3","url":"https://bootcamp.rocketacademy.co/algorithms/a.5-dynamic-programming#part-3"}]},"postClass":{"items":[{"name":"A.5: Dynamic Programming - Part 3","url":"https://bootcamp.rocketacademy.co/algorithms/a.5-dynamic-programming#part-3"}]}},"ux":{"type":"ux","preClass":{},"inClass":{},"postClass":{}},"ip":{"type":"ip","ipDue":{},"preClass":{},"inClass":{},"postClass":{}},"projects":{"type":"projects","projectStart":{},"projectDue":{},"preClass":{},"inClass":{"items":[{"name":"Project 4 Ideation Phase 1","url":"https://bootcamp.rocketacademy.co/4-capstone/4.p-capstone"}]},"postClass":{"items":[{"name":"Project 4 Ideation Phase 1","url":"https://bootcamp.rocketacademy.co/4-capstone/4.p-capstone"}]}}}},"26-06-2023":{"courseDate":"26-06-2023","courseWeek":15,"weekDay":1,"dayNumber":1,"meetingDateTimeUTC":"2023-06-26T02:00:00.000Z","courseDay":56,"dateTypes":{"module":"Module 4: Capstone","general":{"type":"general","preClass":{"items":[{"name":"4.4: Security","url":"https://bootcamp.rocketacademy.co/4-capstone/4.4-security"}]},"inClass":{},"postClass":{}},"css":{"type":"css","preClass":{},"inClass":{},"postClass":{}},"algos":{"type":"algos","preClass":{},"inClass":{"items":[{"name":"A.5: Dynamic Programming - Part 4","url":"https://bootcamp.rocketacademy.co/algorithms/a.5-dynamic-programming#part-4"}]},"postClass":{"items":[{"name":"A.5: Dynamic Programming - Part 4","url":"https://bootcamp.rocketacademy.co/algorithms/a.5-dynamic-programming#part-4"}]}},"ux":{"type":"ux","preClass":{},"inClass":{},"postClass":{}},"ip":{"type":"ip","ipDue":{},"preClass":{},"inClass":{},"postClass":{}},"projects":{"type":"projects","projectStart":{"items":[{"name":"Project 4 Ideation Phase 2","url":"https://bootcamp.rocketacademy.co/4-capstone/4.p-capstone"}]},"projectDue":{},"preClass":{},"inClass":{"items":[{"name":"Project 4 Ideation Phase 2","url":"https://bootcamp.rocketacademy.co/4-capstone/4.p-capstone"}]},"postClass":{"items":[{"name":"Project 4 Ideation Phase 2","url":"https://bootcamp.rocketacademy.co/4-capstone/4.p-capstone"}]}}}},"27-06-2023":{"courseDate":"27-06-2023","courseWeek":15,"weekDay":2,"dayNumber":2,"meetingDateTimeUTC":"2023-06-27T02:00:00.000Z","courseDay":57,"dateTypes":{"module":"Module 4: Capstone","general":{"type":"general","preClass":{},"inClass":{},"postClass":{}},"css":{"type":"css","preClass":{},"inClass":{},"postClass":{}},"algos":{"type":"algos","preClass":{"items":[{"name":"A.6: Bit Manipulation - Pre-Class","url":"https://bootcamp.rocketacademy.co/algorithms/a.6-bit-manipulation#pre-class"}]},"inClass":{"items":[{"name":"A.6: Bit Manipulation - Part 1","url":"https://bootcamp.rocketacademy.co/algorithms/a.6-bit-manipulation#part-1"}]},"postClass":{"items":[{"name":"A.6: Bit Manipulation - Part 1","url":"https://bootcamp.rocketacademy.co/algorithms/a.6-bit-manipulation#part-1"}]}},"ux":{"type":"ux","preClass":{},"inClass":{},"postClass":{}},"ip":{"type":"ip","ipDue":{},"preClass":{},"inClass":{},"postClass":{}},"projects":{"type":"projects","projectStart":{},"projectDue":{"items":[{"name":"Project 4 Ideation Phase 2","url":"https://bootcamp.rocketacademy.co/4-capstone/4.p-capstone"}]},"preClass":{},"inClass":{"items":[{"name":"Project 4 Scrum","url":"https://bootcamp.rocketacademy.co/logistics/course-methodology#scrum"}]},"postClass":{"items":[{"name":"Project 4 Implementation","url":"https://bootcamp.rocketacademy.co/4-capstone/4.p-capstone"}]}}}},"28-06-2023":{"courseDate":"28-06-2023","courseWeek":15,"weekDay":3,"dayNumber":3,"meetingDateTimeUTC":"2023-06-28T02:00:00.000Z","courseDay":58,"dateTypes":{"module":"Module 4: Capstone","general":{"type":"general","preClass":{},"inClass":{},"postClass":{}},"css":{"type":"css","preClass":{},"inClass":{},"postClass":{}},"algos":{"type":"algos","preClass":{},"inClass":{"items":[{"name":"A.6: Bit Manipulation - Part 2","url":"https://bootcamp.rocketacademy.co/algorithms/a.6-bit-manipulation#part-2"}]},"postClass":{"items":[{"name":"A.6: Bit Manipulation - Part 2","url":"https://bootcamp.rocketacademy.co/algorithms/a.6-bit-manipulation#part-2"}]}},"ux":{"type":"ux","preClass":{},"inClass":{},"postClass":{}},"ip":{"type":"ip","ipDue":{},"preClass":{},"inClass":{},"postClass":{}},"projects":{"type":"projects","projectStart":{},"projectDue":{},"preClass":{},"inClass":{"items":[{"name":"Project 4 Scrum","url":"https://bootcamp.rocketacademy.co/logistics/course-methodology#scrum"}]},"postClass":{"items":[{"name":"Project 4 Implementation","url":"https://bootcamp.rocketacademy.co/4-capstone/4.p-capstone"}]}}}},"29-06-2023":{"courseDay":null,"courseDate":"29-06-2023","courseWeek":15,"dayNumber":4,"dateTypes":{"holidayType":"public holiday","date":"29-06-2023","location":"SG","name":"Hari Raya Haji"}},"03-07-2023":{"courseDate":"03-07-2023","courseWeek":16,"weekDay":1,"dayNumber":1,"meetingDateTimeUTC":"2023-07-03T02:00:00.000Z","courseDay":59,"dateTypes":{"module":"Module 4: Capstone","general":{"type":"general","preClass":{},"inClass":{},"postClass":{}},"css":{"type":"css","preClass":{},"inClass":{},"postClass":{}},"algos":{"type":"algos","preClass":{"items":[{"name":"A.7: Python","url":"https://bootcamp.rocketacademy.co/algorithms/a.7-python"}]},"inClass":{"items":[{"name":"A.7: Python","url":"https://bootcamp.rocketacademy.co/algorithms/a.7-python"}]},"postClass":{"items":[{"name":"A.7: Python","url":"https://bootcamp.rocketacademy.co/algorithms/a.7-python"}]}},"ux":{"type":"ux","preClass":{},"inClass":{},"postClass":{}},"ip":{"type":"ip","ipDue":{},"preClass":{},"inClass":{},"postClass":{}},"projects":{"type":"projects","projectStart":{},"projectDue":{},"preClass":{},"inClass":{"items":[{"name":"Project 4 Scrum","url":"https://bootcamp.rocketacademy.co/logistics/course-methodology#scrum"}]},"postClass":{"items":[{"name":"Project 4 Implementation","url":"https://bootcamp.rocketacademy.co/4-capstone/4.p-capstone"}]}}}},"04-07-2023":{"courseDate":"04-07-2023","courseWeek":16,"weekDay":2,"dayNumber":2,"meetingDateTimeUTC":"2023-07-04T02:00:00.000Z","courseDay":60,"dateTypes":{"module":"Module 4: Capstone","general":{"type":"general","preClass":{},"inClass":{},"postClass":{}},"css":{"type":"css","preClass":{},"inClass":{},"postClass":{}},"algos":{"type":"algos","preClass":{"items":[{"name":"A.1.8: Heaps - Pre-Class","url":"https://bootcamp.rocketacademy.co/algorithms/a.1-data-structures/a.1.8-heaps#pre-class"}]},"inClass":{"items":[{"name":"A.1.8: Heaps - Part 1","url":"https://bootcamp.rocketacademy.co/algorithms/a.1-data-structures/a.1.8-heaps#part-1"}]},"postClass":{"items":[{"name":"A.1.8: Heaps - Part 1","url":"https://bootcamp.rocketacademy.co/algorithms/a.1-data-structures/a.1.8-heaps#part-1"}]}},"ux":{"type":"ux","preClass":{},"inClass":{},"postClass":{}},"ip":{"type":"ip","ipDue":{},"preClass":{},"inClass":{},"postClass":{}},"projects":{"type":"projects","projectStart":{},"projectDue":{"items":[{"name":"Project 4 MVP Deadline","url":"https://bootcamp.rocketacademy.co/4-capstone/4.p-capstone"}]},"preClass":{},"inClass":{"items":[{"name":"Project 4 Scrum","url":"https://bootcamp.rocketacademy.co/logistics/course-methodology#scrum"}]},"postClass":{"items":[{"name":"Project 4 Implementation","url":"https://bootcamp.rocketacademy.co/4-capstone/4.p-capstone"}]}}}},"05-07-2023":{"courseDate":"05-07-2023","courseWeek":16,"weekDay":3,"dayNumber":3,"meetingDateTimeUTC":"2023-07-05T02:00:00.000Z","courseDay":61,"dateTypes":{"module":"Module 4: Capstone","general":{"type":"general","preClass":{},"inClass":{},"postClass":{}},"css":{"type":"css","preClass":{},"inClass":{},"postClass":{}},"algos":{"type":"algos","preClass":{},"inClass":{"items":[{"name":"A.1.8: Heaps - Part 2","url":"https://bootcamp.rocketacademy.co/algorithms/a.1-data-structures/a.1.8-heaps#part-2"}]},"postClass":{"items":[{"name":"A.1.8: Heaps - Part 2","url":"https://bootcamp.rocketacademy.co/algorithms/a.1-data-structures/a.1.8-heaps#part-2"}]}},"ux":{"type":"ux","preClass":{},"inClass":{},"postClass":{}},"ip":{"type":"ip","ipDue":{},"preClass":{},"inClass":{},"postClass":{}},"projects":{"type":"projects","projectStart":{},"projectDue":{},"preClass":{},"inClass":{"items":[{"name":"Project 4 Scrum","url":"https://bootcamp.rocketacademy.co/logistics/course-methodology#scrum"}]},"postClass":{"items":[{"name":"Project 4 Implementation","url":"https://bootcamp.rocketacademy.co/4-capstone/4.p-capstone"}]}}}},"06-07-2023":{"courseDate":"06-07-2023","courseWeek":16,"weekDay":4,"dayNumber":4,"meetingDateTimeUTC":"2023-07-06T02:00:00.000Z","courseDay":62,"dateTypes":{"module":"Module 4: Capstone","general":{"type":"general","preClass":{},"inClass":{},"postClass":{}},"css":{"type":"css","preClass":{},"inClass":{},"postClass":{}},"algos":{"type":"algos","preClass":{},"inClass":{"items":[{"name":"A.1.8: Heaps - Part 3","url":"https://bootcamp.rocketacademy.co/algorithms/a.1-data-structures/a.1.8-heaps#part-3"}]},"postClass":{"items":[{"name":"A.1.8: Heaps - Part 3","url":"https://bootcamp.rocketacademy.co/algorithms/a.1-data-structures/a.1.8-heaps#part-3"}]}},"ux":{"type":"ux","preClass":{},"inClass":{},"postClass":{}},"ip":{"type":"ip","ipDue":{},"preClass":{},"inClass":{},"postClass":{}},"projects":{"type":"projects","projectStart":{},"projectDue":{},"preClass":{},"inClass":{"items":[{"name":"Project 4 Scrum","url":"https://bootcamp.rocketacademy.co/logistics/course-methodology#scrum"}]},"postClass":{"items":[{"name":"Project 4 Implementation","url":"https://bootcamp.rocketacademy.co/4-capstone/4.p-capstone"}]}}}},"10-07-2023":{"courseDate":"10-07-2023","courseWeek":17,"weekDay":1,"dayNumber":1,"meetingDateTimeUTC":"2023-07-10T02:00:00.000Z","courseDay":63,"dateTypes":{"module":"Module 4: Capstone","general":{"type":"general","preClass":{},"inClass":{},"postClass":{}},"css":{"type":"css","preClass":{},"inClass":{},"postClass":{}},"algos":{"type":"algos","preClass":{},"inClass":{},"postClass":{}},"ux":{"type":"ux","preClass":{},"inClass":{},"postClass":{}},"ip":{"type":"ip","ipDue":{},"preClass":{},"inClass":{},"postClass":{}},"projects":{"type":"projects","projectStart":{},"projectDue":{},"preClass":{},"inClass":{"items":[{"name":"Project 4 Scrum","url":"https://bootcamp.rocketacademy.co/logistics/course-methodology#scrum"}]},"postClass":{"items":[{"name":"Project 4 Implementation","url":"https://bootcamp.rocketacademy.co/4-capstone/4.p-capstone"}]}}}},"11-07-2023":{"courseDate":"11-07-2023","courseWeek":17,"weekDay":2,"dayNumber":2,"meetingDateTimeUTC":"2023-07-11T02:00:00.000Z","courseDay":64,"dateTypes":{"module":"Module 4: Capstone","general":{"type":"general","preClass":{},"inClass":{},"postClass":{}},"css":{"type":"css","preClass":{},"inClass":{},"postClass":{}},"algos":{"type":"algos","preClass":{},"inClass":{},"postClass":{}},"ux":{"type":"ux","preClass":{},"inClass":{},"postClass":{}},"ip":{"type":"ip","ipDue":{},"preClass":{},"inClass":{},"postClass":{}},"projects":{"type":"projects","projectStart":{},"projectDue":{"items":[{"name":"Project 4 Presentations","url":"https://bootcamp.rocketacademy.co/4-capstone/4.p-capstone"}]},"preClass":{},"inClass":{"items":[{"name":"Project 4 Presentations","url":"https://bootcamp.rocketacademy.co/4-capstone/4.p-capstone"}]},"postClass":{"items":[{"name":"Project 4 Post-Mortems","url":"https://bootcamp.rocketacademy.co/logistics/course-methodology#post-mortem"}]}}}}},"daysOfWeek":[1,2,3,4],"courseStartDaysOfWeekIndex":0,"totalCourseDays":64,"courseName":"20-03-2023_11-07-2023_FTBC11"}