{
  "daysOfWeek": [1, 2, 3, 4],
  "courseStartIndex": 0,
  "totalCourseDays": 96,
  "courseType": "Bootcamp FT",
  "days": {
    "28-03-2022": {
      "courseDate": "28-03-2022",
      "courseWeek": 1,
      "weekDay": 1,
      "dayNumber": 1,
      "meetingDateTimeUTC": "2022-03-28T02:00:00.000Z",
      "courseDay": 0,
      "dateTypes": {
        "module": "Module 1: Frontend Basics",
        "general": {
          "type": "general",
          "preClass": {},
          "inClass": {
            "items": [
              { "name": "Day 1 Photo!", "url": "" },
              { "name": "Course and Student Introductions", "url": "" }
            ]
          },
          "postClass": {}
        }
      }
    },
    "29-03-2022": {
      "courseDate": "29-03-2022",
      "courseWeek": 1,
      "weekDay": 2,
      "dayNumber": 2,
      "meetingDateTimeUTC": "2022-03-29T02:00:00.000Z",
      "courseDay": 1,
      "dateTypes": {
        "module": "Module 1: Basic Frontend",
        "general": {
          "type": "general",
          "preClass": {
            "items": [
              {
                "name": "0.0: Module 0 Overview",
                "url": "https://swebootcamp.rocketacademy.co/module-1-basic-frontend/day-1/pre-class/0.0-module-0-overview"
              },
              {
                "name": "0.1: New JS Syntax",
                "url": "https://swebootcamp.rocketacademy.co/module-1-basic-frontend/day-1/pre-class/0.1-new-js-syntax"
              },
              {
                "name": "0.2: ES6",
                "url": "https://swebootcamp.rocketacademy.co/module-1-basic-frontend/day-1/pre-class/0.2-es6"
              },
              {
                "name": "0.2.1: ES6 Basics",
                "url": "https://swebootcamp.rocketacademy.co/module-1-basic-frontend/day-1/pre-class/0.2.1-es6-basics"
              },
              {
                "name": "1.0: Module 1 Overview",
                "url": "https://swebootcamp.rocketacademy.co/module-1-basic-frontend/day-1/pre-class/1.0-module-1-overview"
              },
              {
                "name": "1.1: HTML",
                "url": "https://swebootcamp.rocketacademy.co/module-1-basic-frontend/day-1/pre-class/1.1-html"
              },
              {
                "name": "1.1.0: Wireframes",
                "url": "https://swebootcamp.rocketacademy.co/module-1-basic-frontend/day-1/pre-class/1.1.0-wireframes"
              },
              {
                "name": "1.1.1: HTML Basics",
                "url": "https://swebootcamp.rocketacademy.co/module-1-basic-frontend/day-1/pre-class/1.1.1-basic-html"
              },
              {
                "name": "1.2: DOM Review",
                "url": "https://swebootcamp.rocketacademy.co/module-1-basic-frontend/day-1/pre-class/1.2-dom-review"
              },
              {
                "name": "1.2.1: DOM Review - Creating Elements",
                "url": "https://swebootcamp.rocketacademy.co/module-1-basic-frontend/day-1/pre-class/1.2.1-creating-elements"
              },
              {
                "name": "1.2.2 DOM Review - Events",
                "url": "https://swebootcamp.rocketacademy.co/module-1-basic-frontend/day-1/pre-class/1.2.2-events"
              }
            ]
          },
          "inClass": {
            "items": [
              {
                "name": "1.ICE.1: Drawing DOM",
                "url": "https://swebootcamp.rocketacademy.co/module-1-basic-frontend/day-1/in-class/1.ice.1-drawing-dom"
              }
            ]
          },
          "postClass": {
            "items": [
              {
                "name": "1.POCE.1: Noodle Recipe Website",
                "url": "https://swebootcamp.rocketacademy.co/module-1-basic-frontend/day-1/post-class/1.poce.1-noodles"
              }
            ]
          }
        }
      }
    },
    "30-03-2022": {
      "courseDate": "30-03-2022",
      "courseWeek": 1,
      "weekDay": 3,
      "dayNumber": 3,
      "meetingDateTimeUTC": "2022-03-30T02:00:00.000Z",
      "courseDay": 2,
      "dateTypes": {
        "module": "Module 1: Basic Frontend",
        "general": {
          "type": "general",
          "preClass": {
            "items": [
              {
                "name": "0.3: Reading Documentation",
                "url": "https://swebootcamp.rocketacademy.co/module-1-basic-frontend/day-2"
              },
              {
                "name": "1.3: High Card DOM",
                "url": "https://swebootcamp.rocketacademy.co/module-1-basic-frontend/day-2"
              },
              {
                "name": "1.4: setTimeout",
                "url": "https://swebootcamp.rocketacademy.co/module-1-basic-frontend/day-2"
              },
              {
                "name": "CSS.1: Basic CSS (Exercises Part 1)",
                "url": "https://swebootcamp.rocketacademy.co/module-1-basic-frontend/day-2"
              }
            ]
          },
          "inClass": {
            "items": [
              {
                "name": "Review 1.POCE.1: Noodle Recipe Website",
                "url": "https://swebootcamp.rocketacademy.co/module-1-basic-frontend/day-2/in-class/1.poce.1-noodles"
              },
              {
                "name": "1.ICE.1: Drawing DOM (continued)",
                "url": "https://swebootcamp.rocketacademy.co/module-1-basic-frontend/day-2/in-class/1.ice.1-drawing-dom"
              }
            ]
          },
          "postClass": {
            "items": [
              {
                "name": "1.POCE.2: High Card DOM",
                "url": "https://swebootcamp.rocketacademy.co/module-1-basic-frontend/day-2/post-class/1.poce.2-high-card-dom"
              }
            ]
          }
        }
      }
    },
    "31-03-2022": {
      "courseDate": "31-03-2022",
      "courseWeek": 1,
      "weekDay": 4,
      "dayNumber": 4,
      "meetingDateTimeUTC": "2022-03-31T02:00:00.000Z",
      "courseDay": 3,
      "dateTypes": {
        "module": "Module 1: Basic Frontend",
        "general": {
          "type": "general",
          "preClass": {
            "items": [
              {
                "name": "1.5: High Card setTimeout",
                "url": "https://swebootcamp.rocketacademy.co/module-1-basic-frontend/day-3/pre-class/1.5-high-card-settimeout"
              },
              {
                "name": "1.6: Match Game",
                "url": "https://swebootcamp.rocketacademy.co/module-1-basic-frontend/day-3/pre-class/1.6-match-game"
              },
              {
                "name": "0.2.4: Reference vs. Value",
                "url": "https://swebootcamp.rocketacademy.co/module-1-basic-frontend/day-3/pre-class/0.2.4-reference-vs.-value"
              },
              {
                "name": "CSS.1: Basic CSS (Exercises Part 2)",
                "url": "https://swebootcamp.rocketacademy.co/module-1-basic-frontend/day-3/pre-class/css-1-basic-css"
              }
            ]
          },
          "inClass": {
            "items": [
              {
                "name": "Peer-Review: 1.POCE.2: High Card",
                "url": "https://swebootcamp.rocketacademy.co/module-1-basic-frontend/day-3/in-class/course-methodology"
              },
              {
                "name": "1.ICE.2: Timeout / High Card Redux",
                "url": "https://swebootcamp.rocketacademy.co/module-1-basic-frontend/day-3/in-class/1.ice.2-high-card-redux"
              }
            ]
          },
          "postClass": {
            "items": [
              {
                "name": "1.POCE.3: Match Game",
                "url": "https://swebootcamp.rocketacademy.co/module-1-basic-frontend/day-3/post-class/1.poce.3-match-game"
              }
            ]
          }
        }
      }
    },
    "04-04-2022": {
      "courseDate": "04-04-2022",
      "courseWeek": 2,
      "weekDay": 1,
      "dayNumber": 1,
      "meetingDateTimeUTC": "2022-04-04T02:00:00.000Z",
      "courseDay": 4,
      "dateTypes": {
        "module": "Module 1: Basic Frontend",
        "general": {
          "type": "general",
          "preClass": {
            "items": [
              {
                "name": "1.7: setInterval",
                "url": "https://swebootcamp.rocketacademy.co/module-1-basic-frontend/day-4/pre-class/1.7-setinterval"
              },
              {
                "name": "1.8: Timer",
                "url": "https://swebootcamp.rocketacademy.co/module-1-basic-frontend/day-4/pre-class/1.8-timer"
              },
              {
                "name": "CSS.2.1 No Layout",
                "url": "https://swebootcamp.rocketacademy.co/module-1-basic-frontend/day-4/pre-class/css.2.1-no-layout"
              },
              {
                "name": "CSS.2.2 Display Inline Block",
                "url": "https://swebootcamp.rocketacademy.co/module-1-basic-frontend/day-4/pre-class/css.2.2-display-inline-and-block"
              }
            ]
          },
          "inClass": {
            "items": [
              {
                "name": "Peer-Review: 1.POCE.3: Match Game",
                "url": "https://swebootcamp.rocketacademy.co/module-1-basic-frontend/day-4/in-class/course-methodology"
              },
              {
                "name": "1.ICE.3: setInterval",
                "url": "https://swebootcamp.rocketacademy.co/module-1-basic-frontend/day-4/in-class/1.ice.3-setinterval"
              }
            ]
          },
          "postClass": {
            "items": [
              {
                "name": "1.POCE.4: Timer",
                "url": "https://swebootcamp.rocketacademy.co/module-1-basic-frontend/day-4/post-class/1.poce.4-timer"
              }
            ]
          }
        }
      }
    },
    "05-04-2022": {
      "courseDate": "05-04-2022",
      "courseWeek": 2,
      "weekDay": 2,
      "dayNumber": 2,
      "meetingDateTimeUTC": "2022-04-05T02:00:00.000Z",
      "courseDay": 5,
      "dateTypes": {
        "module": "Module 1: Basic Frontend",
        "general": {
          "type": "general",
          "preClass": {
            "items": [
              {
                "name": "1.9: Tic Tac Toe",
                "url": "https://swebootcamp.rocketacademy.co/module-1-basic-frontend/day-5/pre-class/1.9-tic-tac-toe"
              },
              {
                "name": "1.10: Multi File Refactor",
                "url": "https://swebootcamp.rocketacademy.co/module-1-basic-frontend/day-5/pre-class/1.10-multi-file-refactor"
              },
              {
                "name": "CSS.2.3 Box Model",
                "url": "https://swebootcamp.rocketacademy.co/module-1-basic-frontend/day-5/pre-class/css.2.3-box-model"
              },
              {
                "name": "CSS.2.4 Layout Width",
                "url": "https://swebootcamp.rocketacademy.co/module-1-basic-frontend/day-5/pre-class/css.2.4-layout-fixed-width-and-max-width"
              }
            ]
          },
          "inClass": {
            "items": [
              {
                "name": "Peer-Review: 1.POCE.4: Timer",
                "url": "https://swebootcamp.rocketacademy.co/module-1-basic-frontend/day-5/in-class/course-methodology"
              }
            ]
          },
          "postClass": {
            "items": [
              {
                "name": "1.POCE.5: Tic Tac Toe",
                "url": "https://swebootcamp.rocketacademy.co/module-1-basic-frontend/day-5/post-class/1.poce.5-tic-tac-toe"
              }
            ]
          }
        }
      }
    },
    "06-04-2022": {
      "courseDate": "06-04-2022",
      "courseWeek": 2,
      "weekDay": 3,
      "dayNumber": 3,
      "meetingDateTimeUTC": "2022-04-06T02:00:00.000Z",
      "courseDay": 6,
      "dateTypes": {
        "module": "Module 1: Basic Frontend",
        "general": {
          "type": "general",
          "preClass": {
            "items": [
              {
                "name": "1.11 CSS Control with DOM",
                "url": "https://swebootcamp.rocketacademy.co/module-1-basic-frontend/day-6/pre-class/1.11-css-control-with-dom"
              },
              {
                "name": "0.4 JS Object as Tally",
                "url": "https://swebootcamp.rocketacademy.co/module-1-basic-frontend/day-6/pre-class/0.4-js-object-as-tally"
              },
              {
                "name": "CSS 2.5 Display Inline Block",
                "url": "https://swebootcamp.rocketacademy.co/module-1-basic-frontend/day-6/pre-class/css.2.5-display-inline-block"
              },
              {
                "name": "CSS.2.6 Layout Col / Card",
                "url": "https://swebootcamp.rocketacademy.co/module-1-basic-frontend/day-6/pre-class/css.2.6-layout-columns-and-cards"
              }
            ]
          },
          "inClass": {
            "items": [
              {
                "name": "Peer-Review: 1.POCE.5: Tic Tac Toe",
                "url": "https://swebootcamp.rocketacademy.co/module-1-basic-frontend/day-6/in-class/course-methodology"
              }
            ]
          },
          "postClass": {
            "items": [
              {
                "name": "Project 1 Implementation",
                "url": "https://swebootcamp.rocketacademy.co/module-1-basic-frontend/day-6/post-class/project-1-video-poker"
              }
            ]
          }
        },
        "projects": {
          "type": "projects",
          "projectStart": {
            "items": [
              {
                "name": "Start: Project 1 Video Poker",
                "url": "https://swebootcamp.rocketacademy.co/module-1-basic-frontend/day-6/post-class/project-1-video-poker"
              }
            ]
          }
        }
      }
    },
    "07-04-2022": {
      "courseDate": "07-04-2022",
      "courseWeek": 2,
      "weekDay": 4,
      "dayNumber": 4,
      "meetingDateTimeUTC": "2022-04-07T02:00:00.000Z",
      "courseDay": 7,
      "dateTypes": {
        "module": "Module 1: Basic Frontend",
        "general": {
          "type": "general",
          "preClass": {
            "items": [
              {
                "name": "CSS 2.7: Position",
                "url": "https://swebootcamp.rocketacademy.co/module-1-basic-frontend/day-7/pre-class/css.2.7-position"
              },
              {
                "name": "CSS 2.8: Float",
                "url": "https://swebootcamp.rocketacademy.co/module-1-basic-frontend/day-7/pre-class/css.2.8-float"
              }
            ]
          },
          "inClass": {
            "items": [
              {
                "name": "Project 1 Scrum",
                "url": "https://swebootcamp.rocketacademy.co/course-logistics/course-methodology#project-scrums"
              },
              {
                "name": "ICE.CSS.1: Personal Portfolio Site",
                "url": "https://swebootcamp.rocketacademy.co/module-1-basic-frontend/day-7/in-class/1.ice.css.1-personal-portfolio-site"
              }
            ]
          },
          "postClass": {
            "items": [
              {
                "name": "Project 1 Implementation",
                "url": "https://swebootcamp.rocketacademy.co/module-1-basic-frontend/day-6/post-class/project-1-video-poker"
              }
            ]
          }
        }
      }
    },
    "11-04-2022": {
      "courseDate": "11-04-2022",
      "courseWeek": 3,
      "weekDay": 1,
      "dayNumber": 1,
      "meetingDateTimeUTC": "2022-04-11T02:00:00.000Z",
      "courseDay": 8,
      "dateTypes": {
        "module": "Module 1: Basic Frontend",
        "general": {
          "type": "general",
          "preClass": {
            "items": [
              {
                "name": "CSS 3: Flexbox",
                "url": "https://swebootcamp.rocketacademy.co/module-1-basic-frontend/day-8/pre-class/css.3-flexbox"
              },
              {
                "name": "CSS 3.1: Flexbox Columns",
                "url": "https://swebootcamp.rocketacademy.co/module-1-basic-frontend/day-8/pre-class/css.3.1-flexbox-layout"
              }
            ]
          },
          "inClass": {
            "items": [
              {
                "name": "Project 1 Scrum",
                "url": "https://swebootcamp.rocketacademy.co/course-logistics/course-methodology#project-scrums"
              },
              {
                "name": "ICE.CSS.2: Wikipedia",
                "url": "https://swebootcamp.rocketacademy.co/module-1-basic-frontend/day-8/in-class/1.ice.css.2-css-practice-6-wikipedia"
              }
            ]
          },
          "postClass": {
            "items": [
              {
                "name": "Project 1 Implementation",
                "url": "https://swebootcamp.rocketacademy.co/module-1-basic-frontend/day-6/post-class/project-1-video-poker"
              }
            ]
          }
        }
      }
    },
    "12-04-2022": {
      "courseDate": "12-04-2022",
      "courseWeek": 3,
      "weekDay": 2,
      "dayNumber": 2,
      "meetingDateTimeUTC": "2022-04-12T02:00:00.000Z",
      "courseDay": 9,
      "dateTypes": {
        "module": "Module 1: Basic Frontend",
        "general": {
          "type": "general",
          "preClass": {
            "items": [
              {
                "name": "CSS 4: Responsive Design",
                "url": "https://swebootcamp.rocketacademy.co/module-1-basic-frontend/day-9/pre-class/css.4-responsive-design"
              },
              {
                "name": "CSS 5: Web Design Basics",
                "url": "https://swebootcamp.rocketacademy.co/module-1-basic-frontend/day-9/pre-class/css.5-web-design-basics"
              }
            ]
          },
          "inClass": {
            "items": [
              {
                "name": "Project 1 Scrum",
                "url": "https://swebootcamp.rocketacademy.co/course-logistics/course-methodology#project-scrums"
              },
              {
                "name": "ICE.CSS.4: Etsy",
                "url": "https://swebootcamp.rocketacademy.co/module-1-basic-frontend/day-9/in-class/css.ice.4-etsy"
              }
            ]
          },
          "postClass": {
            "items": [
              {
                "name": "1.POCE.8: Flexbox Personal Page",
                "url": "https://swebootcamp.rocketacademy.co/module-1-basic-frontend/day-9/post-class/1.poce.css.2-flexbox-personal-page"
              },
              {
                "name": "Project 1 Implementation",
                "url": "https://swebootcamp.rocketacademy.co/module-1-basic-frontend/day-6/post-class/project-1-video-poker"
              }
            ]
          }
        }
      }
    },
    "13-04-2022": {
      "courseDate": "13-04-2022",
      "courseWeek": 3,
      "weekDay": 3,
      "dayNumber": 3,
      "meetingDateTimeUTC": "2022-04-13T02:00:00.000Z",
      "courseDay": 10,
      "dateTypes": {
        "module": "Module 1: Basic Frontend",
        "general": {
          "type": "general",
          "preClass": {
            "items": [
              {
                "name": "CSS.6 Bootstrap - Day 1",
                "url": "https://swebootcamp.rocketacademy.co/module-1-basic-frontend/day-10/pre-class/css.6-bootstrap"
              }
            ]
          },
          "inClass": {
            "items": [
              {
                "name": "Project 1 Scrum",
                "url": "https://swebootcamp.rocketacademy.co/course-logistics/course-methodology#project-scrums"
              },
              {
                "name": "CSS.ICE MyTunes",
                "url": "https://swebootcamp.rocketacademy.co/module-1-basic-frontend/day-10/in-class/1.ice.css.3-mytunes"
              }
            ]
          },
          "postClass": {
            "items": [
              {
                "name": "1.POCE.3: Bootstrap Columns",
                "url": "https://swebootcamp.rocketacademy.co/module-1-basic-frontend/day-10/post-class/1.poce.css.3-bootstrap-columns"
              },
              {
                "name": "Project 1 Implementation",
                "url": "https://swebootcamp.rocketacademy.co/module-1-basic-frontend/day-10/post-class/project-1-video-poker"
              },
              {
                "name": "Project 1: Deploy to GitHub Pages",
                "url": "https://swebootcamp.rocketacademy.co/module-1-basic-frontend/day-10/post-class/12.3-deployment"
              }
            ]
          }
        }
      }
    },
    "14-04-2022": {
      "courseDate": "14-04-2022",
      "courseWeek": 3,
      "weekDay": 4,
      "dayNumber": 4,
      "meetingDateTimeUTC": "2022-04-14T02:00:00.000Z",
      "courseDay": 11,
      "dateTypes": {
        "module": "Module 1: Basic Frontend",
        "general": {
          "type": "general",
          "preClass": {
            "items": [
              {
                "name": "CSS.6 Bootstrap - Day 2",
                "url": "https://swebootcamp.rocketacademy.co/module-1-basic-frontend/day-11/pre-class/css.6-bootstrap"
              }
            ]
          },
          "inClass": {
            "items": [
              {
                "name": "Project 1 Scrum",
                "url": "https://swebootcamp.rocketacademy.co/course-logistics/course-methodology#project-scrums"
              },
              {
                "name": "CSS.ICE Restaurant",
                "url": "https://swebootcamp.rocketacademy.co/module-1-basic-frontend/day-11/in-class/1.ice.css.5-restaurant"
              }
            ]
          },
          "postClass": {
            "items": [
              {
                "name": "1.POCE.4: More Bootstrap",
                "url": "https://swebootcamp.rocketacademy.co/module-1-basic-frontend/day-11/post-class/1.poce.css.4-bootstrap-adobe"
              },
              {
                "name": "Project 1 Implementation",
                "url": "https://swebootcamp.rocketacademy.co/module-1-basic-frontend/day-11/post-class/project-1-video-poker"
              }
            ]
          }
        }
      }
    },
    "18-04-2022": {
      "courseDate": "18-04-2022",
      "courseWeek": 4,
      "weekDay": 1,
      "dayNumber": 1,
      "meetingDateTimeUTC": "2022-04-18T02:00:00.000Z",
      "courseDay": 12,
      "dateTypes": {
        "module": "Module 1: Basic Frontend",
        "general": {
          "type": "general",
          "preClass": {
            "items": [
              {
                "name": "Project 1 Implementation",
                "url": "https://swebootcamp.rocketacademy.co/module-1-basic-frontend/day-11/post-class/project-1-video-poker"
              }
            ]
          },
          "inClass": {
            "items": [
              {
                "name": "Project 1 Presentations",
                "url": "https://swebootcamp.rocketacademy.co/course-logistics/course-methodology#project-post-mortem-meeting"
              }
            ]
          },
          "postClass": {
            "items": [
              {
                "name": "Project 1 Post-Mortems",
                "url": "https://swebootcamp.rocketacademy.co/course-logistics/course-methodology#project-post-mortem-meeting"
              }
            ]
          }
        },
        "projects": {
          "type": "projects",
          "projectDue": {
            "items": [
              {
                "name": "Due: Project 1 Video Poker",
                "url": "https://swebootcamp.rocketacademy.co/module-1-basic-frontend/day-11/post-class/project-1-video-poker"
              }
            ]
          }
        }
      }
    },
    "19-04-2022": {
      "courseDate": "19-04-2022",
      "courseWeek": 4,
      "weekDay": 2,
      "dayNumber": 2,
      "meetingDateTimeUTC": "2022-04-19T02:00:00.000Z",
      "courseDay": 13,
      "dateTypes": {
        "module": "Module 1: Basic Frontend",
        "general": {
          "type": "general",
          "preClass": {
            "items": [
              {
                "name": "2.0: Module 2 Overview",
                "url": "https://swebootcamp.rocketacademy.co/module-1-basic-frontend/day-13/pre-class/2.0-module-2-overview"
              },
              {
                "name": "2.1: My First Node.js Program",
                "url": "https://swebootcamp.rocketacademy.co/module-1-basic-frontend/day-13/pre-class/2.1-my-first-node-program"
              },
              {
                "name": "2.2: Command Line Programs",
                "url": "https://swebootcamp.rocketacademy.co/module-1-basic-frontend/day-13/pre-class/2.2-command-line-programs"
              },
              {
                "name": "2.3: Modules",
                "url": "https://swebootcamp.rocketacademy.co/module-1-basic-frontend/day-13/pre-class/2.3-modules"
              }
            ]
          },
          "inClass": {
            "items": [
              {
                "name": "2.ICE.1: Command Line Colour Converter",
                "url": "https://swebootcamp.rocketacademy.co/module-1-basic-frontend/day-13/in-class/2.ice.1-conversions"
              }
            ]
          },
          "postClass": {
            "items": [
              {
                "name": "2.POCE.1: Command Line Colour Converter",
                "url": "https://swebootcamp.rocketacademy.co/module-1-basic-frontend/day-13/post-class/2.poce.1-command-line-colour-converter"
              }
            ]
          }
        }
      }
    },
    "20-04-2022": {
      "courseDate": "20-04-2022",
      "courseWeek": 4,
      "weekDay": 3,
      "dayNumber": 3,
      "meetingDateTimeUTC": "2022-04-20T02:00:00.000Z",
      "courseDay": 14,
      "dateTypes": {
        "module": "Module 1: Basic Frontend",
        "general": {
          "type": "general",
          "preClass": {
            "items": [
              {
                "name": "2.4: Disk Reading",
                "url": "https://swebootcamp.rocketacademy.co/module-1-basic-frontend/day-14/pre-class/2.4-disk-reading"
              },
              {
                "name": "2.5: Disk Writing",
                "url": "https://swebootcamp.rocketacademy.co/module-1-basic-frontend/day-14/pre-class/2.5-disk-writing"
              },
              {
                "name": "2.6: Disk Altering",
                "url": "https://swebootcamp.rocketacademy.co/module-1-basic-frontend/day-14/pre-class/2.6-disk-altering"
              }
            ]
          },
          "inClass": {
            "items": [
              {
                "name": "2.ICE.2: Modules, Disk Reading",
                "url": "https://swebootcamp.rocketacademy.co/module-1-basic-frontend/day-14/in-class/2.ice.2-modules-disk-reading"
              },
              {
                "name": "2.ICE.3: Disk Altering",
                "url": "https://swebootcamp.rocketacademy.co/module-1-basic-frontend/day-14/in-class/2.ice.3-disk-altering"
              }
            ]
          },
          "postClass": {
            "items": [
              {
                "name": "2.POCE.2: CSS Reader",
                "url": "https://swebootcamp.rocketacademy.co/module-1-basic-frontend/day-14/post-class/2.poce.2-css-reader"
              }
            ]
          }
        }
      }
    },
    "21-04-2022": {
      "courseDate": "21-04-2022",
      "courseWeek": 4,
      "weekDay": 4,
      "dayNumber": 4,
      "meetingDateTimeUTC": "2022-04-21T02:00:00.000Z",
      "courseDay": 15,
      "dateTypes": {
        "module": "Module 1: Basic Frontend",
        "general": {
          "type": "general",
          "preClass": {
            "items": [
              {
                "name": "2.7: Internet 101",
                "url": "https://swebootcamp.rocketacademy.co/module-1-basic-frontend/day-15/pre-class/2.7-internet-101"
              },
              {
                "name": "2.8: Chrome Networking",
                "url": "https://swebootcamp.rocketacademy.co/module-1-basic-frontend/day-15/pre-class/2.8-chrome-networking"
              }
            ]
          },
          "inClass": {
            "items": [
              {
                "name": "Review 2.POCE.3: CSS Processor",
                "url": "https://swebootcamp.rocketacademy.co/module-1-basic-frontend/day-15/in-class/course-methodology"
              }
            ]
          },
          "postClass": {
            "items": [
              {
                "name": "2.POCE.2: CSS Processor",
                "url": "https://swebootcamp.rocketacademy.co/module-1-basic-frontend/day-15/post-class/2.poce.3-css-processor"
              }
            ]
          }
        }
      }
    },
    "25-04-2022": {
      "courseDate": "25-04-2022",
      "courseWeek": 5,
      "weekDay": 1,
      "dayNumber": 1,
      "meetingDateTimeUTC": "2022-04-25T02:00:00.000Z",
      "courseDay": 16,
      "dateTypes": {
        "module": "Module 1: Basic Frontend",
        "general": {
          "type": "general",
          "preClass": {
            "items": [
              {
                "name": "2.9: HTTP Requests and Responses",
                "url": "https://swebootcamp.rocketacademy.co/module-1-basic-frontend/day-16/pre-class/2.9-http"
              },
              {
                "name": "2.10: HTTP File Server",
                "url": "https://swebootcamp.rocketacademy.co/module-1-basic-frontend/day-16/pre-class/2.10-http-file-server"
              },
              {
                "name": "Installation Instructions for 2.ICE.4",
                "url": "https://swebootcamp.rocketacademy.co/module-1-basic-frontend/day-16/pre-class/2.0-module-2-overview"
              }
            ]
          },
          "inClass": {
            "items": [
              {
                "name": "2.ICE.4: Servers and Requests",
                "url": "https://swebootcamp.rocketacademy.co/module-1-basic-frontend/day-16/in-class/2.ice.4-servers-and-requests"
              }
            ]
          },
          "postClass": {
            "items": [
              {
                "name": "2.POCE.4: File Server",
                "url": "https://swebootcamp.rocketacademy.co/module-1-basic-frontend/day-16/post-class/2.poce.4-file-server"
              }
            ]
          }
        }
      }
    },
    "26-04-2022": {
      "courseDate": "26-04-2022",
      "courseWeek": 5,
      "weekDay": 2,
      "dayNumber": 2,
      "meetingDateTimeUTC": "2022-04-26T02:00:00.000Z",
      "courseDay": 17,
      "dateTypes": {
        "module": "Module 2: Basic Backend",
        "general": {
          "type": "general",
          "preClass": {
            "items": [
              {
                "name": "3.0 Overview",
                "url": "https://swebootcamp.rocketacademy.co/module-2-basic-backend/day-1/pre-class/3.0-module-3-overview"
              },
              {
                "name": "3.1: Express.js",
                "url": "https://swebootcamp.rocketacademy.co/module-2-basic-backend/day-1/pre-class/3.1-express-js"
              },
              {
                "name": "3.1.1: Express with JSON DB",
                "url": "https://swebootcamp.rocketacademy.co/module-2-basic-backend/day-1/pre-class/3.1.1-express-with-json-db"
              }
            ]
          },
          "inClass": {
            "items": [
              {
                "name": "3.ICE.1: Bigfoot",
                "url": "https://swebootcamp.rocketacademy.co/module-2-basic-backend/day-1/in-class/3.ice.1-bigfoot"
              }
            ]
          },
          "postClass": {
            "items": [
              {
                "name": "3.POCE.1: Express Noodle App",
                "url": "https://swebootcamp.rocketacademy.co/module-2-basic-backend/day-1/post-class/3.poce.1-express-noodle-app"
              }
            ]
          }
        }
      }
    },
    "27-04-2022": {
      "courseDate": "27-04-2022",
      "courseWeek": 5,
      "weekDay": 3,
      "dayNumber": 3,
      "meetingDateTimeUTC": "2022-04-27T02:00:00.000Z",
      "courseDay": 18,
      "dateTypes": {
        "module": "Module 2: Basic Backend",
        "general": {
          "type": "general",
          "preClass": {
            "items": [
              {
                "name": "3.2: EJS",
                "url": "https://swebootcamp.rocketacademy.co/module-2-basic-backend/day-2/pre-class/3.2-ejs"
              },
              {
                "name": "3.2.2: EJS Conditionals",
                "url": "https://swebootcamp.rocketacademy.co/module-2-basic-backend/day-2/pre-class/3.2.2-ejs-conditionals"
              },
              {
                "name": "3.2.3: EJS Partials",
                "url": "https://swebootcamp.rocketacademy.co/module-2-basic-backend/day-2/pre-class/3.2.3-advanced-ejs"
              }
            ]
          },
          "inClass": {
            "items": [
              {
                "name": "3.ICE.2: Bigfoot EJS",
                "url": "https://swebootcamp.rocketacademy.co/module-2-basic-backend/day-2/in-class/3.ice.2-bigfoot-ejs"
              }
            ]
          },
          "postClass": {
            "items": [
              {
                "name": "3.POCE.2: Express, EJS Noodle App",
                "url": "https://swebootcamp.rocketacademy.co/module-2-basic-backend/day-2/post-class/3.poce.2-express-ejs-noodle-app"
              }
            ]
          }
        }
      }
    },
    "28-04-2022": {
      "courseDate": "28-04-2022",
      "courseWeek": 5,
      "weekDay": 4,
      "dayNumber": 4,
      "meetingDateTimeUTC": "2022-04-28T02:00:00.000Z",
      "courseDay": 19,
      "dateTypes": {
        "module": "Module 2: Basic Backend",
        "general": {
          "type": "general",
          "preClass": {
            "items": [
              {
                "name": "3.1.2: HTML Forms",
                "url": "https://swebootcamp.rocketacademy.co/module-2-basic-backend/day-3/pre-class/3.1.2-html-forms"
              },
              {
                "name": "3.1.3: Handling POST Requests",
                "url": "https://swebootcamp.rocketacademy.co/module-2-basic-backend/day-3/pre-class/3.1.3-handling-post-requests"
              },
              {
                "name": "3.1.4: PUT, DELETE Requests",
                "url": "https://swebootcamp.rocketacademy.co/module-2-basic-backend/day-3/pre-class/3.1.4-put-delete-requests"
              },
              {
                "name": "0.7 Thunder Client",
                "url": "https://swebootcamp.rocketacademy.co/module-2-basic-backend/day-3/pre-class/0.7-postman"
              }
            ]
          },
          "inClass": {
            "items": [
              {
                "name": "3.ICE.3 Bigfoot POST",
                "url": "https://swebootcamp.rocketacademy.co/module-2-basic-backend/day-3/in-class/3.ice.3-bigfoot-post"
              }
            ]
          },
          "postClass": {
            "items": [
              {
                "name": "3.POCE.3: UFO Sightings",
                "url": "https://swebootcamp.rocketacademy.co/module-2-basic-backend/day-3/post-class/3.poce.3-express-ufos"
              }
            ]
          }
        }
      }
    },
    "02-05-2022": {
      "courseDay": null,
      "courseDate": "02-05-2022",
      "courseWeek": 6,
      "dayNumber": 1,
      "dateTypes": {
        "holidayType": "public holiday",
        "date": "02-05-2022",
        "location": "SG",
        "name": "Hari Raya Puasa"
      }
    },
    "03-05-2022": {
      "courseDay": null,
      "courseDate": "03-05-2022",
      "courseWeek": 6,
      "dayNumber": 2,
      "dateTypes": {
        "holidayType": "public holiday",
        "date": "03-05-2022",
        "location": "SG",
        "name": "Labour Day (observed)"
      }
    },
    "04-05-2022": {
      "courseDate": "04-05-2022",
      "courseWeek": 6,
      "weekDay": 1,
      "dayNumber": 3,
      "meetingDateTimeUTC": "2022-05-04T02:00:00.000Z",
      "courseDay": 20,
      "dateTypes": {
        "module": "Module 2: Basic Backend",
        "general": {
          "type": "general",
          "preClass": {
            "items": [
              {
                "name": "3.3 SQL Language",
                "url": "https://swebootcamp.rocketacademy.co/module-2-basic-backend/day-4/pre-class/3.3-sql-language"
              },
              {
                "name": "3.3.1: Basic SQL Commands",
                "url": "https://swebootcamp.rocketacademy.co/module-2-basic-backend/day-4/pre-class/3.3.1-basic-sql-commands"
              },
              {
                "name": "3.4: SQL Applications",
                "url": "https://swebootcamp.rocketacademy.co/module-2-basic-backend/day-4/pre-class/3.4-sql-applications"
              },
              {
                "name": "3.4.1: PostgreSQL, psql",
                "url": "https://swebootcamp.rocketacademy.co/module-2-basic-backend/day-4/pre-class/3.4.1-postgresql-psql"
              },
              {
                "name": "3.4.2: PostgreSQL Node App",
                "url": "https://swebootcamp.rocketacademy.co/module-2-basic-backend/day-4/pre-class/3.4.2-postgresql-node-app"
              }
            ]
          },
          "inClass": {
            "items": [
              {
                "name": "3.POCE.4: Meal Tracker",
                "url": "https://swebootcamp.rocketacademy.co/module-2-basic-backend/day-4/in-class/3.poce.4-sql-meal-keeper"
              }
            ]
          },
          "postClass": {
            "items": [
              {
                "name": "3.POCE.3: UFO Sightings",
                "url": "https://swebootcamp.rocketacademy.co/module-2-basic-backend/day-4/post-class/3.poce.3-express-ufos"
              }
            ]
          }
        }
      }
    },
    "05-05-2022": {
      "courseDate": "05-05-2022",
      "courseWeek": 6,
      "weekDay": 2,
      "dayNumber": 4,
      "meetingDateTimeUTC": "2022-05-05T02:00:00.000Z",
      "courseDay": 21,
      "dateTypes": {
        "module": "Module 2: Basic Backend",
        "projects": {
          "type": "projects",
          "projectStart": {
            "items": [
              {
                "name": "Start: Project 2 Ideation Phase 1",
                "url": "https://swebootcamp.rocketacademy.co/module-2-basic-backend/day-5/post-class/project-2-server-side-app"
              }
            ]
          }
        },
        "general": {
          "type": "general",
          "preClass": {
            "items": [
              {
                "name": "0.8 JS Promises",
                "url": "https://swebootcamp.rocketacademy.co/module-2-basic-backend/day-5/pre-class/0.8-js-promises"
              },
              {
                "name": "0.8.1: Promise.prototype.catch, Promise.all",
                "url": "https://swebootcamp.rocketacademy.co/module-2-basic-backend/day-5/pre-class/0.8.1-promise.prototype.catch-promise.all"
              },
              {
                "name": "3.4.3: Nested SQL Queries",
                "url": "https://swebootcamp.rocketacademy.co/module-2-basic-backend/day-5/pre-class/3.4.3-nested-sql-queries"
              },
              {
                "name": "3.3.6: SQL Schema Design",
                "url": "https://swebootcamp.rocketacademy.co/module-2-basic-backend/day-5/pre-class/3.3.6-sql-schema-design"
              }
            ]
          },
          "inClass": {
            "items": [
              {
                "name": "3.ICE.9: DB Schema Design - Carousell",
                "url": "https://swebootcamp.rocketacademy.co/module-2-basic-backend/day-5/in-class/3.ice.9-db-schema-design-carousell"
              }
            ]
          },
          "postClass": {
            "items": [
              {
                "name": "3.POCE.3: UFO Sightings",
                "url": "https://swebootcamp.rocketacademy.co/module-2-basic-backend/day-5/post-class/3.poce.3-express-ufos"
              },
              {
                "name": "Project 2 Ideation Phase 1",
                "url": "https://swebootcamp.rocketacademy.co/module-2-basic-backend/day-5/post-class/project-2-server-side-app"
              }
            ]
          }
        }
      }
    },
    "09-05-2022": {
      "courseDate": "09-05-2022",
      "courseWeek": 7,
      "weekDay": 1,
      "dayNumber": 1,
      "meetingDateTimeUTC": "2022-05-09T02:00:00.000Z",
      "courseDay": 22,
      "dateTypes": {
        "module": "Module 2: Basic Backend",
        "general": {
          "type": "general",
          "preClass": {
            "items": [
              {
                "name": "3.4.4: PostgreSQL Express App",
                "url": "https://swebootcamp.rocketacademy.co/module-2-basic-backend/day-6/pre-class/3.4.4-postgresql-express-app"
              },
              {
                "name": "3.3.2: SQL Relationships (One to Many)",
                "url": "https://swebootcamp.rocketacademy.co/module-2-basic-backend/day-6/pre-class/3.3.2-sql-relationships-one-to-many"
              },
              {
                "name": "3.4.5: Forms for One-to-Many Relationships",
                "url": "https://swebootcamp.rocketacademy.co/module-2-basic-backend/day-6/pre-class/3.4.5-forms-for-one-to-many-relationships"
              }
            ]
          },
          "inClass": {
            "items": [
              {
                "name": "3.ICE.5: One to Many",
                "url": "https://swebootcamp.rocketacademy.co/module-2-basic-backend/day-6/in-class/3.ice.5-one-to-many"
              }
            ]
          },
          "postClass": {
            "items": [
              {
                "name": "3.POCE.5 Bird Watching",
                "url": "https://swebootcamp.rocketacademy.co/module-2-basic-backend/day-6/post-class/3.poce.5-bird-watching"
              },
              {
                "name": "Project 2 Ideation Phase 1",
                "url": "https://swebootcamp.rocketacademy.co/module-2-basic-backend/day-5/post-class/project-2-server-side-app"
              }
            ]
          }
        }
      }
    },
    "10-05-2022": {
      "courseDate": "10-05-2022",
      "courseWeek": 7,
      "weekDay": 2,
      "dayNumber": 2,
      "meetingDateTimeUTC": "2022-05-10T02:00:00.000Z",
      "courseDay": 23,
      "dateTypes": {
        "module": "Module 2: Basic Backend",
        "projects": {
          "type": "projects",
          "projectDue": {
            "items": [
              {
                "name": "Due: Project 2 Ideation Phase 1",
                "url": "https://swebootcamp.rocketacademy.co/module-2-basic-backend/day-5/post-class/project-2-server-side-app"
              }
            ]
          }
        },
        "general": {
          "type": "general",
          "preClass": {
            "items": [
              {
                "name": "3.4.7: pg Promises",
                "url": "https://swebootcamp.rocketacademy.co/module-2-basic-backend/day-7/pre-class/3.4.7-pg-promises"
              },
              {
                "name": "3.3.3: SQL Relationships (Many to Many)",
                "url": "https://swebootcamp.rocketacademy.co/module-2-basic-backend/day-7/pre-class/3.3.3-sql-relationships-many-to-many"
              },
              {
                "name": "3.4.6: Forms for Many-to-Many Relationships",
                "url": "https://swebootcamp.rocketacademy.co/module-2-basic-backend/day-7/pre-class/3.4.6-forms-for-many-to-many-relationships"
              }
            ]
          },
          "inClass": {
            "items": [
              {
                "name": "3.ICE.7: Many-to-Many",
                "url": "https://swebootcamp.rocketacademy.co/module-2-basic-backend/day-7/in-class/3.ice.7-many-to-many"
              }
            ]
          },
          "postClass": {
            "items": [
              {
                "name": "3.POCE.7: Bird Watching Species",
                "url": "https://swebootcamp.rocketacademy.co/module-2-basic-backend/day-7/post-class/3.poce.7-bird-watching-species"
              },
              {
                "name": "Project 2 Ideation Phase 1",
                "url": "https://swebootcamp.rocketacademy.co/module-2-basic-backend/day-5/post-class/project-2-server-side-app"
              }
            ]
          }
        }
      }
    },
    "11-05-2022": {
      "courseDate": "11-05-2022",
      "courseWeek": 7,
      "weekDay": 3,
      "dayNumber": 3,
      "meetingDateTimeUTC": "2022-05-11T02:00:00.000Z",
      "courseDay": 24,
      "dateTypes": {
        "module": "Module 2: Basic Backend",
        "projects": {
          "type": "projects",
          "projectStart": {
            "items": [
              {
                "name": "Start: Project 2 Ideation Phase 2",
                "url": "https://swebootcamp.rocketacademy.co/module-2-basic-backend/day-8/post-class/project-2-server-side-app"
              }
            ]
          }
        },
        "general": {
          "type": "general",
          "preClass": {
            "items": [
              {
                "name": "3.3.4: Inner Join",
                "url": "https://swebootcamp.rocketacademy.co/module-2-basic-backend/day-8/pre-class/3.3.4-inner-join"
              },
              {
                "name": "3.3.5: Non-FK Relationship Data in Join Table",
                "url": "https://swebootcamp.rocketacademy.co/module-2-basic-backend/day-8/pre-class/3.3.5-non-fk-relationship-data-in-join-table"
              }
            ]
          },
          "inClass": {
            "items": [
              {
                "name": "3.ICE.6: Inner Join",
                "url": "https://swebootcamp.rocketacademy.co/module-2-basic-backend/day-8/in-class/3.ice.6-inner-join"
              },
              {
                "name": "3.ICE.8: Multiple Foreign Keys",
                "url": "https://swebootcamp.rocketacademy.co/module-2-basic-backend/day-8/in-class/3.ice.8-multi-foreign-key"
              }
            ]
          },
          "postClass": {
            "items": [
              {
                "name": "Project 2 Ideation Phase 2",
                "url": "https://swebootcamp.rocketacademy.co/module-2-basic-backend/day-8/post-class/project-2-server-side-app"
              }
            ]
          }
        }
      }
    },
    "12-05-2022": {
      "courseDate": "12-05-2022",
      "courseWeek": 7,
      "weekDay": 4,
      "dayNumber": 4,
      "meetingDateTimeUTC": "2022-05-12T02:00:00.000Z",
      "courseDay": 25,
      "dateTypes": {
        "module": "Module 2: Basic Backend",
        "general": {
          "type": "general",
          "preClass": {
            "items": [
              {
                "name": "3.4.10: Dates in SQL and JS",
                "url": "https://swebootcamp.rocketacademy.co/module-2-basic-backend/day-9/pre-class/3.4.10-dates-in-sql-and-js"
              },
              {
                "name": "3.4.11: File Uploads",
                "url": "https://swebootcamp.rocketacademy.co/module-2-basic-backend/day-9/pre-class/3.4.11-file-uploads"
              },
              {
                "name": "3.5.1: Cookies",
                "url": "https://swebootcamp.rocketacademy.co/module-2-basic-backend/day-9/pre-class/3.5.1-cookies"
              },
              {
                "name": "3.5.2: User Auth",
                "url": "https://swebootcamp.rocketacademy.co/module-2-basic-backend/day-9/pre-class/3.5.2-user-auth"
              }
            ]
          },
          "inClass": {
            "items": [
              {
                "name": "3.POCE.6: Bird Watching Users",
                "url": "https://swebootcamp.rocketacademy.co/module-2-basic-backend/day-9/in-class/3.poce.6-bird-watching-users"
              }
            ]
          },
          "postClass": {
            "items": [
              {
                "name": "3.POCE.8: Bird Watching Behaviour",
                "url": "https://swebootcamp.rocketacademy.co/module-2-basic-backend/day-9/post-class/3.poce.8-bird-watching-behaviour"
              },
              {
                "name": "Project 2 Ideation Phase 2",
                "url": "https://swebootcamp.rocketacademy.co/module-2-basic-backend/day-9/post-class/project-2-server-side-app"
              }
            ]
          }
        }
      }
    },
    "16-05-2022": {
      "courseDay": null,
      "courseDate": "16-05-2022",
      "courseWeek": 8,
      "dayNumber": 1,
      "dateTypes": {
        "holidayType": "public holiday",
        "date": "16-05-2022",
        "location": "SG",
        "name": "Vesak Day (observed)"
      }
    },
    "17-05-2022": {
      "courseDate": "17-05-2022",
      "courseWeek": 8,
      "weekDay": 1,
      "dayNumber": 2,
      "meetingDateTimeUTC": "2022-05-17T02:00:00.000Z",
      "courseDay": 26,
      "dateTypes": {
        "module": "Module 2: Basic Backend",
        "general": {
          "type": "general",
          "preClass": {
            "items": [
              {
                "name": "3.4.8: SQL Clients",
                "url": "https://swebootcamp.rocketacademy.co/module-2-basic-backend/day-10/pre-class/3.4.8-sql-clients"
              },
              {
                "name": "3.4.9: Database Setup Files",
                "url": "https://swebootcamp.rocketacademy.co/module-2-basic-backend/day-10/pre-class/3.4.9-database-setup-files"
              }
            ]
          },
          "inClass": {
            "items": [
              {
                "name": "3.ICE.12: DB Schema Design - Instagram",
                "url": "https://swebootcamp.rocketacademy.co/module-2-basic-backend/day-10/in-class/3.ice.12-db-schema-design-instagram"
              }
            ]
          },
          "postClass": {
            "items": [
              {
                "name": "3.POCE.9: Bird Watching Comments",
                "url": "https://swebootcamp.rocketacademy.co/module-2-basic-backend/day-10/post-class/3.poce.9-bird-watching-comments"
              },
              {
                "name": "Project 2 Ideation Phase 2",
                "url": "https://swebootcamp.rocketacademy.co/module-2-basic-backend/day-9/post-class/project-2-server-side-app"
              }
            ]
          }
        }
      }
    },
    "18-05-2022": {
      "courseDate": "18-05-2022",
      "courseWeek": 8,
      "weekDay": 2,
      "dayNumber": 3,
      "meetingDateTimeUTC": "2022-05-18T02:00:00.000Z",
      "courseDay": 27,
      "dateTypes": {
        "module": "Module 2: Basic Backend",
        "projects": {
          "type": "projects",
          "projectStart": {
            "items": [
              {
                "name": "Start: Project 2",
                "url": "https://swebootcamp.rocketacademy.co/module-2-basic-backend/day-11/post-class/project-2-server-side-app"
              }
            ]
          },
          "projectDue": {
            "items": [
              {
                "name": "Due: Project 2 Ideation Phase 2",
                "url": "https://swebootcamp.rocketacademy.co/module-2-basic-backend/day-11/in-class/project-2-server-side-app"
              }
            ]
          }
        },
        "general": {
          "type": "general",
          "preClass": {},
          "inClass": {
            "items": [
              {
                "name": "Project 2 Planning Docs Peer Review",
                "url": "https://swebootcamp.rocketacademy.co/module-2-basic-backend/day-14/post-class/project-2-server-side-app#ideation-phase-2"
              }
            ]
          },
          "postClass": {
            "items": [
              {
                "name": "Project 2 Implementation",
                "url": "https://swebootcamp.rocketacademy.co/module-2-basic-backend/day-11/post-class/project-2-server-side-app"
              }
            ]
          }
        }
      }
    },
    "19-05-2022": {
      "courseDate": "19-05-2022",
      "courseWeek": 8,
      "weekDay": 3,
      "dayNumber": 4,
      "meetingDateTimeUTC": "2022-05-19T02:00:00.000Z",
      "courseDay": 28,
      "dateTypes": {
        "module": "Module 2: Basic Backend",
        "general": {
          "type": "general",
          "preClass": {},
          "inClass": {
            "items": [
              {
                "name": "Project 2 Scrum",
                "url": "https://swebootcamp.rocketacademy.co/course-logistics/course-methodology#project-scrums"
              }
            ]
          },
          "postClass": {
            "items": [
              {
                "name": "Project 2 Implementation",
                "url": "https://swebootcamp.rocketacademy.co/module-2-basic-backend/day-11/post-class/project-2-server-side-app"
              }
            ]
          }
        }
      }
    },
    "23-05-2022": {
      "courseDate": "23-05-2022",
      "courseWeek": 9,
      "weekDay": 1,
      "dayNumber": 1,
      "meetingDateTimeUTC": "2022-05-23T02:00:00.000Z",
      "courseDay": 29,
      "dateTypes": {
        "module": "Module 2: Basic Backend",
        "general": {
          "type": "general",
          "preClass": {},
          "inClass": {
            "items": [
              {
                "name": "Project 2 Scrum",
                "url": "https://swebootcamp.rocketacademy.co/course-logistics/course-methodology#project-scrums"
              }
            ]
          },
          "postClass": {
            "items": [
              {
                "name": "Project 2 Mid-Point Instructor Meeting",
                "url": "https://swebootcamp.rocketacademy.co/module-2-basic-backend/day-13/post-class/project-2-server-side-app"
              },
              {
                "name": "Project 2 Implementation",
                "url": "https://swebootcamp.rocketacademy.co/module-2-basic-backend/day-11/post-class/project-2-server-side-app"
              }
            ]
          }
        }
      }
    },
    "24-05-2022": {
      "courseDate": "24-05-2022",
      "courseWeek": 9,
      "weekDay": 2,
      "dayNumber": 2,
      "meetingDateTimeUTC": "2022-05-24T02:00:00.000Z",
      "courseDay": 30,
      "dateTypes": {
        "module": "Module 2: Basic Backend",
        "general": {
          "type": "general",
          "preClass": {},
          "inClass": {
            "items": [
              {
                "name": "Project 2 Scrum",
                "url": "https://swebootcamp.rocketacademy.co/course-logistics/course-methodology#project-scrums"
              }
            ]
          },
          "postClass": {
            "items": [
              {
                "name": "Project 2 Implementation",
                "url": "https://swebootcamp.rocketacademy.co/module-2-basic-backend/day-11/post-class/project-2-server-side-app"
              }
            ]
          }
        }
      }
    },
    "25-05-2022": {
      "courseDate": "25-05-2022",
      "courseWeek": 9,
      "weekDay": 3,
      "dayNumber": 3,
      "meetingDateTimeUTC": "2022-05-25T02:00:00.000Z",
      "courseDay": 31,
      "dateTypes": {
        "module": "Module 2: Basic Backend",
        "general": {
          "type": "general",
          "preClass": {},
          "inClass": {
            "items": [
              {
                "name": "Project 2 Scrum",
                "url": "https://swebootcamp.rocketacademy.co/course-logistics/course-methodology#project-scrums"
              }
            ]
          },
          "postClass": {
            "items": [
              {
                "name": "Project 2 Implementation",
                "url": "https://swebootcamp.rocketacademy.co/module-2-basic-backend/day-11/post-class/project-2-server-side-app"
              }
            ]
          }
        }
      }
    },
    "26-05-2022": {
      "courseDate": "26-05-2022",
      "courseWeek": 9,
      "weekDay": 4,
      "dayNumber": 4,
      "meetingDateTimeUTC": "2022-05-26T02:00:00.000Z",
      "courseDay": 32,
      "dateTypes": {
        "module": "Module 2: Basic Backend",
        "projects": {
          "type": "projects",
          "projectDue": {
            "items": [
              {
                "name": "Due: Project 2",
                "url": "https://swebootcamp.rocketacademy.co/module-2-basic-backend/day-11/post-class/project-2-server-side-app"
              }
            ]
          }
        },
        "general": {
          "type": "general",
          "preClass": {
            "items": [
              {
                "name": "3.6: Heroku",
                "url": "https://swebootcamp.rocketacademy.co/module-2-basic-backend/day-16/pre-class/3.6-heroku"
              },
              {
                "name": "3.6.1: Heroku Deploy",
                "url": "https://swebootcamp.rocketacademy.co/module-2-basic-backend/day-16/pre-class/3.6.1-heroku-deploy"
              },
              {
                "name": "3.6.2: Heroku Postgres",
                "url": "https://swebootcamp.rocketacademy.co/module-2-basic-backend/day-16/pre-class/3.6.2-heroku-postgres"
              },
              {
                "name": "3.6.3: Heroku S3",
                "url": "https://swebootcamp.rocketacademy.co/module-2-basic-backend/day-16/pre-class/3.6.3-heroku-s3"
              },
              {
                "name": "0.10: Introduction to Classes",
                "url": "https://swebootcamp.rocketacademy.co/module-2-basic-backend/day-16/pre-class/0.10-introduction-to-classes"
              }
            ]
          },
          "inClass": {
            "items": [
              {
                "name": "Project 2 Presentations",
                "url": "https://swebootcamp.rocketacademy.co/course-logistics/course-methodology#project-presentations"
              }
            ]
          },
          "postClass": {
            "items": [
              {
                "name": "3.POCE.11: Heroku Deployment",
                "url": "https://swebootcamp.rocketacademy.co/module-2-basic-backend/day-16/post-class/3.poce.11-heroku-deployment"
              }
            ]
          }
        }
      }
    },
    "30-05-2022": {
      "courseDate": "30-05-2022",
      "courseWeek": 10,
      "weekDay": 1,
      "dayNumber": 1,
      "meetingDateTimeUTC": "2022-05-30T02:00:00.000Z",
      "courseDay": 33,
      "dateTypes": {
        "module": "Module 3: Advanced Backend and Full Stack",
        "general": {
          "type": "general",
          "preClass": {
            "items": [
              {
                "name": "4.0: Module 4 Overview",
                "url": "https://swebootcamp.rocketacademy.co/module-3-advanced-backend-and-full-stack/day-1/pre-class/4.0-module-4-overview"
              },
              {
                "name": "4.1: ORM, Sequelize",
                "url": "https://swebootcamp.rocketacademy.co/module-3-advanced-backend-and-full-stack/day-1/pre-class/4.1-orm-sequelize"
              },
              {
                "name": "4.1.1: Intro to Sequelize",
                "url": "https://swebootcamp.rocketacademy.co/module-3-advanced-backend-and-full-stack/day-1/pre-class/4.1.1-intro-to-sequelize"
              },
              {
                "name": "4.1.2: Sequelize One-to-Many",
                "url": "https://swebootcamp.rocketacademy.co/module-3-advanced-backend-and-full-stack/day-1/pre-class/4.1.2-sequelize-one-to-many-relationships"
              }
            ]
          },
          "inClass": {
            "items": [
              {
                "name": "3.ICE.13: DB Schema Design - Airbnb",
                "url": "https://swebootcamp.rocketacademy.co/module-3-advanced-backend-and-full-stack/day-1/in-class/3.ice.13-db-schema-design-airbnb"
              }
            ]
          },
          "postClass": {
            "items": [
              {
                "name": "4.POCE.1: Sequelize CLI App - Travel Itinerary",
                "url": "https://swebootcamp.rocketacademy.co/module-3-advanced-backend-and-full-stack/day-1/post-class/4.poce.1-sequelize-cli-app-travel-itinerary"
              }
            ]
          }
        }
      }
    },
    "31-05-2022": {
      "courseDate": "31-05-2022",
      "courseWeek": 10,
      "weekDay": 2,
      "dayNumber": 2,
      "meetingDateTimeUTC": "2022-05-31T02:00:00.000Z",
      "courseDay": 34,
      "dateTypes": {
        "module": "Module 3: Advanced Backend and Full Stack",
        "general": {
          "type": "general",
          "preClass": {
            "items": [
              {
                "name": "0.8.2: Try Catch",
                "url": "https://swebootcamp.rocketacademy.co/module-3-advanced-backend-and-full-stack/day-2/pre-class/0.8.2-try-catch"
              },
              {
                "name": "0.8.3: Async/Await",
                "url": "https://swebootcamp.rocketacademy.co/module-3-advanced-backend-and-full-stack/day-2/pre-class/0.8.3-async-await"
              },
              {
                "name": "4.1.3: Async/Await with Sequelize",
                "url": "https://swebootcamp.rocketacademy.co/module-3-advanced-backend-and-full-stack/day-2/pre-class/4.1.3-async-await-with-sequelize"
              },
              {
                "name": "Algo Day 1",
                "url": "https://swebootcamp.rocketacademy.co/algorithms/algos/day-1"
              },
              {
                "name": "A.0: Algorithms Overview",
                "url": "https://swebootcamp.rocketacademy.co/algorithms/algos/day-1/a.0-algorithms-overview"
              },
              {
                "name": "A.1: Intro to SWE Interviews",
                "url": "https://swebootcamp.rocketacademy.co/algorithms/algos/day-1/a.1-intro-to-swe-interviews"
              },
              {
                "name": "A.2: Intro to Python (Exercises 1-8)",
                "url": "https://swebootcamp.rocketacademy.co/algorithms/algos/day-1/a.2-intro-to-python"
              }
            ]
          },
          "inClass": {
            "items": [
              {
                "name": "4.POCE.1: Sequelize CLI App - Travel Itinerary (Pair Programming)",
                "url": "https://swebootcamp.rocketacademy.co/module-3-advanced-backend-and-full-stack/day-2/in-class/4.poce.1-sequelize-cli-app-travel-itinerary"
              }
            ]
          },
          "postClass": {
            "items": [
              {
                "name": "4.POCE.1: Sequelize CLI App - Travel Itinerary",
                "url": "https://swebootcamp.rocketacademy.co/module-3-advanced-backend-and-full-stack/day-2/post-class/4.poce.1-sequelize-cli-app-travel-itinerary"
              }
            ]
          }
        }
      }
    },
    "01-06-2022": {
      "courseDate": "01-06-2022",
      "courseWeek": 10,
      "weekDay": 3,
      "dayNumber": 3,
      "meetingDateTimeUTC": "2022-06-01T02:00:00.000Z",
      "courseDay": 35,
      "dateTypes": {
        "module": "Module 3: Advanced Backend and Full Stack",
        "general": {
          "type": "general",
          "preClass": {
            "items": [
              {
                "name": "4.2 MVC",
                "url": "https://swebootcamp.rocketacademy.co/module-3-advanced-backend-and-full-stack/day-3/pre-class/4.2-mvc"
              },
              {
                "name": "4.2.1: RESTful Routes",
                "url": "https://swebootcamp.rocketacademy.co/module-3-advanced-backend-and-full-stack/day-3/pre-class/4.2.1-restful-routes"
              },
              {
                "name": "Algo Day 2",
                "url": "https://swebootcamp.rocketacademy.co/algorithms/algos/day-2"
              },
              {
                "name": "A.2: Intro to Python (Exercise 9-11)",
                "url": "https://swebootcamp.rocketacademy.co/algorithms/algos/day-2/a.2-intro-to-python"
              }
            ]
          },
          "inClass": {
            "items": [
              {
                "name": "4.POCE.2: Drummers for Hire",
                "url": "https://swebootcamp.rocketacademy.co/module-3-advanced-backend-and-full-stack/day-3/in-class/4.poce.2-drummers-for-hire"
              }
            ]
          },
          "postClass": {
            "items": [
              {
                "name": "4.POCE.2: Drummers for Hire",
                "url": "https://swebootcamp.rocketacademy.co/module-3-advanced-backend-and-full-stack/day-3/post-class/4.poce.2-drummers-for-hire"
              }
            ]
          }
        }
      }
    },
    "02-06-2022": {
      "courseDate": "02-06-2022",
      "courseWeek": 10,
      "weekDay": 4,
      "dayNumber": 4,
      "meetingDateTimeUTC": "2022-06-02T02:00:00.000Z",
      "courseDay": 36,
      "dateTypes": {
        "module": "Module 3: Advanced Backend and Full Stack",
        "general": {
          "type": "general",
          "preClass": {
            "items": [
              {
                "name": "4.1.4: Sequelize Many-to-Many",
                "url": "https://swebootcamp.rocketacademy.co/module-3-advanced-backend-and-full-stack/day-4/pre-class/4.1.4-sequelize-many-to-many"
              }
            ]
          },
          "inClass": {
            "items": [
              {
                "name": "4.POCE.3: Project 2 MVC Refactor Demonstration",
                "url": "https://swebootcamp.rocketacademy.co/module-3-advanced-backend-and-full-stack/day-4/in-class/4.poce.3-project-2-mvc-refactor"
              }
            ]
          },
          "postClass": {
            "items": [
              {
                "name": "4.POCE.2: Drummers for Hire",
                "url": "https://swebootcamp.rocketacademy.co/module-3-advanced-backend-and-full-stack/day-4/post-class/4.poce.2-drummers-for-hire"
              }
            ]
          }
        }
      }
    },
    "06-06-2022": {
      "courseDate": "06-06-2022",
      "courseWeek": 11,
      "weekDay": 1,
      "dayNumber": 1,
      "meetingDateTimeUTC": "2022-06-06T02:00:00.000Z",
      "courseDay": 37,
      "dateTypes": {
        "module": "Module 3: Advanced Backend and Full Stack",
        "general": {
          "type": "general",
          "preClass": {
            "items": [
              {
                "name": "4.1.5: Sequelize Many-to-Many with Non-FK Attributes in \"Through Table\"",
                "url": "https://swebootcamp.rocketacademy.co/module-3-advanced-backend-and-full-stack/day-5/pre-class/4.1.5-sequelize-many-to-many-with-non-fk-attributes-in-through-table"
              },
              {
                "name": "5.0: Module 5 Overview",
                "url": "https://swebootcamp.rocketacademy.co/module-3-advanced-backend-and-full-stack/day-5/pre-class/5.0-module-5-overview"
              },
              {
                "name": "5.1: DOM Manipulation with Express App",
                "url": "https://swebootcamp.rocketacademy.co/module-3-advanced-backend-and-full-stack/day-5/pre-class/5.1-dom-manipulation-with-express-app"
              },
              {
                "name": "Algo Day 3",
                "url": "https://swebootcamp.rocketacademy.co/algorithms/algos/day-3"
              },
              {
                "name": "A.3: Complexity Analysis, Big-O Notation",
                "url": "https://swebootcamp.rocketacademy.co/algorithms/algos/day-3/a.3-complexity-analysis-big-o-notation"
              },
              {
                "name": "A.4: Interview Strategies",
                "url": "https://swebootcamp.rocketacademy.co/algorithms/algos/day-3/a.4-interview-strategies"
              },
              {
                "name": "A.4.1: Introduction to Algorithm Problems",
                "url": "https://swebootcamp.rocketacademy.co/algorithms/algos/day-3/a.4.1-introduction-to-algorithm-problems"
              }
            ]
          },
          "inClass": {
            "items": [
              {
                "name": "5.ICE.1: Full-Stack Modal",
                "url": "https://swebootcamp.rocketacademy.co/module-3-advanced-backend-and-full-stack/day-5/in-class/5.ice.1-full-stack-modal"
              }
            ]
          },
          "postClass": {
            "items": [
              {
                "name": "4.POCE.3: Project 2 MVC Refactor",
                "url": "https://swebootcamp.rocketacademy.co/module-3-advanced-backend-and-full-stack/day-5/post-class/4.poce.3-project-2-mvc-refactor"
              }
            ]
          }
        }
      }
    },
    "07-06-2022": {
      "courseDate": "07-06-2022",
      "courseWeek": 11,
      "weekDay": 2,
      "dayNumber": 2,
      "meetingDateTimeUTC": "2022-06-07T02:00:00.000Z",
      "courseDay": 38,
      "dateTypes": {
        "module": "Module 3: Advanced Backend and Full Stack",
        "general": {
          "type": "general",
          "preClass": {
            "items": [
              {
                "name": "4.1.6: Sequelize Validations",
                "url": "https://swebootcamp.rocketacademy.co/module-3-advanced-backend-and-full-stack/day-6/pre-class/4.1.6-sequelize-validations"
              },
              {
                "name": "5.2: AJAX",
                "url": "https://swebootcamp.rocketacademy.co/module-3-advanced-backend-and-full-stack/day-6/pre-class/5.2-ajax"
              },
              {
                "name": "Algo Day 4",
                "url": "https://swebootcamp.rocketacademy.co/algorithms/algos/day-4"
              },
              {
                "name": "A.5.1: Arrays - Pre-Class",
                "url": "https://swebootcamp.rocketacademy.co/algorithms/algos/day-4/a.5.1-arrays"
              }
            ]
          },
          "inClass": {
            "items": [
              {
                "name": "5.ICE.2: AJAX",
                "url": "https://swebootcamp.rocketacademy.co/module-3-advanced-backend-and-full-stack/day-6/in-class/5.ice.2-ajax"
              }
            ]
          },
          "postClass": {
            "items": [
              {
                "name": "4.POCE.3: Project 2 MVC Refactor",
                "url": "https://swebootcamp.rocketacademy.co/module-3-advanced-backend-and-full-stack/day-6/post-class/4.poce.3-project-2-mvc-refactor"
              }
            ]
          }
        }
      }
    },
    "08-06-2022": {
      "courseDate": "08-06-2022",
      "courseWeek": 11,
      "weekDay": 3,
      "dayNumber": 3,
      "meetingDateTimeUTC": "2022-06-08T02:00:00.000Z",
      "courseDay": 39,
      "dateTypes": {
        "module": "Module 3: Advanced Backend and Full Stack",
        "general": {
          "type": "general",
          "preClass": {
            "items": [
              {
                "name": "4.1.7: Sequelize Eager Loading",
                "url": "https://swebootcamp.rocketacademy.co/module-3-advanced-backend-and-full-stack/day-7/pre-class/4.1.7-sequelize-eager-loading"
              },
              {
                "name": "5.2.1: AJAX POST Requests",
                "url": "https://swebootcamp.rocketacademy.co/module-3-advanced-backend-and-full-stack/day-7/pre-class/5.2.1-ajax-post-requests"
              }
            ]
          },
          "inClass": {
            "items": [
              {
                "name": "5.ICE.3: Bug Reports AJAX",
                "url": "https://swebootcamp.rocketacademy.co/module-3-advanced-backend-and-full-stack/day-7/in-class/5.ice.3-bug-reports-ajax"
              }
            ]
          },
          "postClass": {
            "items": [
              {
                "name": "5.POCE.1: Bug Reports AJAX",
                "url": "https://swebootcamp.rocketacademy.co/module-3-advanced-backend-and-full-stack/day-7/post-class/5.poce.1-bug-reports-ajax"
              }
            ]
          }
        }
      }
    },
    "09-06-2022": {
      "courseDate": "09-06-2022",
      "courseWeek": 11,
      "weekDay": 4,
      "dayNumber": 4,
      "meetingDateTimeUTC": "2022-06-09T02:00:00.000Z",
      "courseDay": 40,
      "dateTypes": {
        "module": "Module 3: Advanced Backend and Full Stack",
        "general": {
          "type": "general",
          "preClass": {
            "items": [
              {
                "name": "4.1.8: Multiple FK Columns Referencing Same Table",
                "url": "https://swebootcamp.rocketacademy.co/module-3-advanced-backend-and-full-stack/day-8/pre-class/4.1.8-multiple-foreign-key-columns-referencing-same-table"
              }
            ]
          },
          "inClass": {
            "items": [
              {
                "name": "5.ICE.4: Cross-Domain AJAX",
                "url": "https://swebootcamp.rocketacademy.co/module-3-advanced-backend-and-full-stack/day-8/in-class/5.ice.4-cross-domain-ajax"
              }
            ]
          },
          "postClass": {
            "items": [
              {
                "name": "5.POCE.2: Bug Reports AJAX Users",
                "url": "https://swebootcamp.rocketacademy.co/module-3-advanced-backend-and-full-stack/day-8/post-class/5.poce.2-bug-reports-ajax-users"
              }
            ]
          }
        }
      }
    },
    "13-06-2022": {
      "courseDate": "13-06-2022",
      "courseWeek": 12,
      "weekDay": 1,
      "dayNumber": 1,
      "meetingDateTimeUTC": "2022-06-13T02:00:00.000Z",
      "courseDay": 41,
      "dateTypes": {
        "module": "Module 3: Advanced Backend and Full Stack",
        "projects": {
          "type": "projects",
          "projectStart": {
            "items": [
              {
                "name": "Start: Project 3 Ideation Phase 1",
                "url": "https://swebootcamp.rocketacademy.co/module-3-advanced-backend-and-full-stack/day-9/post-class/project-3-full-stack-game"
              }
            ]
          }
        },
        "general": {
          "type": "general",
          "preClass": {
            "items": [
              {
                "name": "5.2.2: AJAX Cards",
                "url": "https://swebootcamp.rocketacademy.co/module-3-advanced-backend-and-full-stack/day-9/pre-class/5.2.2-ajax-cards"
              },
              {
                "name": "6.0: Module 6 Overview",
                "url": "https://swebootcamp.rocketacademy.co/module-3-advanced-backend-and-full-stack/day-9/pre-class/6.0-module-6-overview"
              },
              {
                "name": "6.1: Webpack",
                "url": "https://swebootcamp.rocketacademy.co/module-3-advanced-backend-and-full-stack/day-9/pre-class/6.1-webpack"
              },
              {
                "name": "6.1.1: Webpack with Local Modules",
                "url": "https://swebootcamp.rocketacademy.co/module-3-advanced-backend-and-full-stack/day-9/pre-class/6.1.1-webpack-with-local-modules"
              },
              {
                "name": "Algo Day 6"
              },
              {
                "name": "A.5.1: Arrays - Part 2",
                "url": "https://swebootcamp.rocketacademy.co/algorithms/algos/day-6/a.5.1-arrays"
              }
            ]
          },
          "inClass": {
            "items": [
              {
                "name": "Bug Reports (5.POCE.1, 2) Redux",
                "url": "https://swebootcamp.rocketacademy.co/module-3-advanced-backend-and-full-stack/day-9/in-class/course-methodology"
              }
            ]
          },
          "postClass": {
            "items": [
              {
                "name": "5.POCE.3: AJAX Cards",
                "url": "https://swebootcamp.rocketacademy.co/module-3-advanced-backend-and-full-stack/day-9/post-class/5.poce.3-ajax-cards"
              },
              {
                "name": "Project 3 Ideation Phase 1",
                "url": "https://swebootcamp.rocketacademy.co/module-3-advanced-backend-and-full-stack/day-9/post-class/project-3-full-stack-game"
              }
            ]
          }
        }
      }
    },
    "14-06-2022": {
      "courseDate": "14-06-2022",
      "courseWeek": 12,
      "weekDay": 2,
      "dayNumber": 2,
      "meetingDateTimeUTC": "2022-06-14T02:00:00.000Z",
      "courseDay": 42,
      "dateTypes": {
        "module": "Module 3: Advanced Backend and Full Stack",
        "general": {
          "type": "general",
          "preClass": {
            "items": [
              {
                "name": "6.1.2: Webpack with NPM Modules",
                "url": "https://swebootcamp.rocketacademy.co/module-3-advanced-backend-and-full-stack/day-10/pre-class/6.1.2-webpack-with-npm-modules"
              },
              {
                "name": "6.1.5: Webpack with Express",
                "url": "https://swebootcamp.rocketacademy.co/module-3-advanced-backend-and-full-stack/day-10/pre-class/6.1.5-webpack-with-express"
              },
              {
                "name": "Group Work (for project management",
                "url": "https://swebootcamp.rocketacademy.co/module-3-advanced-backend-and-full-stack/day-10/pre-class/group-work"
              },
              {
                "name": "Algo Day 7",
                "url": "https://swebootcamp.rocketacademy.co/algorithms/algos/day-7"
              },
              {
                "name": "A.5.2: Hash Tables - Pre-Class",
                "url": "https://swebootcamp.rocketacademy.co/algorithms/algos/day-7/a.5.2-hash-tables"
              }
            ]
          },
          "inClass": {
            "items": [
              {
                "name": "6.ICE.1: NPM Webpack",
                "url": "https://swebootcamp.rocketacademy.co/module-3-advanced-backend-and-full-stack/day-10/in-class/6.ice.1-npm-webpack"
              }
            ]
          },
          "postClass": {
            "items": [
              {
                "name": "5.POCE.3: AJAX Cards",
                "url": "https://swebootcamp.rocketacademy.co/module-3-advanced-backend-and-full-stack/day-10/post-class/5.poce.3-ajax-cards"
              },
              {
                "name": "Project 3 Ideation Phase 1",
                "url": "https://swebootcamp.rocketacademy.co/module-3-advanced-backend-and-full-stack/day-10/post-class/project-3-full-stack-game"
              }
            ]
          }
        }
      }
    },
    "15-06-2022": {
      "courseDate": "15-06-2022",
      "courseWeek": 12,
      "weekDay": 3,
      "dayNumber": 3,
      "meetingDateTimeUTC": "2022-06-15T02:00:00.000Z",
      "courseDay": 43,
      "dateTypes": {
        "module": "Module 3: Advanced Backend and Full Stack",
        "general": {
          "type": "general",
          "preClass": {
            "items": [
              {
                "name": "6.1.2: Webpack with NPM Modules",
                "url": "https://swebootcamp.rocketacademy.co/module-3-advanced-backend-and-full-stack/day-10/pre-class/6.1.2-webpack-with-npm-modules"
              },
              {
                "name": "6.1.5: Webpack with Express",
                "url": "https://swebootcamp.rocketacademy.co/module-3-advanced-backend-and-full-stack/day-10/pre-class/6.1.5-webpack-with-express"
              },
              {
                "name": "Group Work (for project management",
                "url": "https://swebootcamp.rocketacademy.co/module-3-advanced-backend-and-full-stack/day-10/pre-class/group-work"
              },
              {
                "name": "Algo Day 7"
              },
              {
                "name": "A.5.2: Hash Tables - Pre-Class",
                "url": "https://swebootcamp.rocketacademy.co/algorithms/algos/day-7/a.5.2-hash-tables"
              }
            ]
          },
          "inClass": {
            "items": [
              {
                "name": "6.ICE.1: NPM Webpack",
                "url": "https://swebootcamp.rocketacademy.co/module-3-advanced-backend-and-full-stack/day-10/in-class/6.ice.1-npm-webpack"
              }
            ]
          },
          "postClass": {
            "items": [
              {
                "name": "5.POCE.3: AJAX Cards",
                "url": "https://swebootcamp.rocketacademy.co/module-3-advanced-backend-and-full-stack/day-10/post-class/5.poce.3-ajax-cards"
              },
              {
                "name": "Project 3 Ideation Phase 1",
                "url": "https://swebootcamp.rocketacademy.co/module-3-advanced-backend-and-full-stack/day-10/post-class/project-3-full-stack-game"
              }
            ]
          }
        }
      }
    },
    "16-06-2022": {
      "courseDate": "16-06-2022",
      "courseWeek": 12,
      "weekDay": 4,
      "dayNumber": 4,
      "meetingDateTimeUTC": "2022-06-16T02:00:00.000Z",
      "courseDay": 44,
      "dateTypes": {
        "module": "Module 3: Advanced Backend and Full Stack",
        "general": {
          "type": "general",
          "preClass": {
            "items": [
              {
                "name": "4.1.10: Deploy Sequelize App to Heroku",
                "url": "https://swebootcamp.rocketacademy.co/module-3-advanced-backend-and-full-stack/day-12/pre-class/4.1.10-deploy-sequelize-app-to-heroku"
              },
              {
                "name": "6.1.6 Deploy Webpack App to Heroku",
                "url": "https://swebootcamp.rocketacademy.co/module-3-advanced-backend-and-full-stack/day-12/pre-class/6.1.6-express-mvc-webpack-and-heroku"
              },
              {
                "name": "Algo Day 8"
              },
              {
                "name": "A.5.2: Hash Tables - Part 2",
                "url": "https://swebootcamp.rocketacademy.co/algorithms/algos/day-8/a.5.2-hash-tables"
              }
            ]
          },
          "inClass": {},
          "postClass": {
            "items": [
              {
                "name": "Project 3 Implementation",
                "url": "https://swebootcamp.rocketacademy.co/module-3-advanced-backend-and-full-stack/day-12/post-class/project-3-full-stack-game"
              }
            ]
          }
        }
      }
    },
    "20-06-2022": {
      "courseDate": "20-06-2022",
      "courseWeek": 13,
      "weekDay": 1,
      "dayNumber": 1,
      "meetingDateTimeUTC": "2022-06-20T02:00:00.000Z",
      "courseDay": 45,
      "dateTypes": {
        "module": "Module 3: Advanced Backend and Full Stack",
        "general": {
          "type": "general",
          "preClass": {},
          "inClass": {},
          "postClass": {
            "items": [
              {
                "name": "Project 3 Implementation",
                "url": "https://swebootcamp.rocketacademy.co/module-3-advanced-backend-and-full-stack/day-12/post-class/project-3-full-stack-game"
              }
            ]
          }
        }
      }
    },
    "21-06-2022": {
      "courseDate": "21-06-2022",
      "courseWeek": 13,
      "weekDay": 2,
      "dayNumber": 2,
      "meetingDateTimeUTC": "2022-06-21T02:00:00.000Z",
      "courseDay": 46,
      "dateTypes": {
        "module": "Module 3: Advanced Backend and Full Stack",
        "general": {
          "type": "general",
          "preClass": {
            "items": [
              {
                "name": "Algo Day 9"
              },
              {
                "name": "A.8 Object-Oriented Programming",
                "url": "https://swebootcamp.rocketacademy.co/algorithms/algos/day-9/a.8-intro-to-object-oriented-programming"
              }
            ]
          },
          "inClass": {},
          "postClass": {
            "items": [
              {
                "name": "Project 3 Implementation",
                "url": "https://swebootcamp.rocketacademy.co/module-3-advanced-backend-and-full-stack/day-12/post-class/project-3-full-stack-game"
              }
            ]
          }
        }
      }
    },
    "22-06-2022": {
      "courseDate": "22-06-2022",
      "courseWeek": 13,
      "weekDay": 3,
      "dayNumber": 3,
      "meetingDateTimeUTC": "2022-06-22T02:00:00.000Z",
      "courseDay": 47,
      "dateTypes": {
        "module": "Module 3: Advanced Backend and Full Stack",
        "general": {
          "type": "general",
          "preClass": {
            "items": [
              {
                "name": "Algo Day 10"
              },
              {
                "name": "A.5.3: Stacks - Pre-Class",
                "url": "https://swebootcamp.rocketacademy.co/algorithms/algos/day-10/a.5.3-stacks"
              }
            ]
          },
          "inClass": {},
          "postClass": {
            "items": [
              {
                "name": "Project 3 Implementation",
                "url": "https://swebootcamp.rocketacademy.co/module-3-advanced-backend-and-full-stack/day-12/post-class/project-3-full-stack-game"
              }
            ]
          }
        }
      }
    },
    "23-06-2022": {
      "courseDate": "23-06-2022",
      "courseWeek": 13,
      "weekDay": 4,
      "dayNumber": 4,
      "meetingDateTimeUTC": "2022-06-23T02:00:00.000Z",
      "courseDay": 48,
      "dateTypes": {
        "module": "Module 3: Advanced Backend and Full Stack",
        "general": {
          "type": "general",
          "preClass": {},
          "inClass": {},
          "postClass": {
            "items": [
              {
                "name": "Project 3 Post-Mortems",
                "url": "https://swebootcamp.rocketacademy.co/module-3-advanced-backend-and-full-stack/day-16/post-class/course-methodology"
              },
              {
                "name": "Project 3 Video Demo",
                "url": "https://swebootcamp.rocketacademy.co/module-3-advanced-backend-and-full-stack/day-16/post-class/project-3-full-stack-game"
              }
            ]
          }
        }
      }
    },
    "27-06-2022": {
      "courseDate": "27-06-2022",
      "courseWeek": 14,
      "weekDay": 1,
      "dayNumber": 1,
      "meetingDateTimeUTC": "2022-06-27T02:00:00.000Z",
      "courseDay": 49,
      "dateTypes": {
        "module": "Module 4: Frontend Framework - React",
        "general": {
          "type": "general",
          "preClass": {
            "items": [
              {
                "name": "7.0: Module 7 Overview",
                "url": "https://swebootcamp.rocketacademy.co/module-4-frontend-framework-react/day-1/pre-class/7.0-module-7-overview"
              },
              {
                "name": "7.1: JSX Intro",
                "url": "https://swebootcamp.rocketacademy.co/module-4-frontend-framework-react/day-1/pre-class/7.1-jsx-intro"
              },
              {
                "name": "7.1.1: Conditional Rendering",
                "url": "https://swebootcamp.rocketacademy.co/module-4-frontend-framework-react/day-1/pre-class/7.1.1-conditional-rendering"
              },
              {
                "name": "7.1.2: Rendering in a Loop",
                "url": "https://swebootcamp.rocketacademy.co/module-4-frontend-framework-react/day-1/pre-class/7.1.2-rendering-in-a-loop"
              },
              {
                "name": "Algo Day 11"
              },
              {
                "name": "A.5.3: Stacks - Part 2",
                "url": "https://swebootcamp.rocketacademy.co/algorithms/algos/day-11/a.5.3-stacks"
              }
            ]
          },
          "inClass": {
            "items": [
              {
                "name": "7.ICE.1: JSX Products Items",
                "url": "https://swebootcamp.rocketacademy.co/module-4-frontend-framework-react/day-1/in-class/7.ice.1-product-rendering"
              }
            ]
          },
          "postClass": {
            "items": [
              {
                "name": "7.POCE.1: JSX Bug Reports",
                "url": "https://swebootcamp.rocketacademy.co/module-4-frontend-framework-react/day-1/post-class/7.poce.1-bugs"
              },
              {
                "name": "Project 3 Video Demo",
                "url": "https://swebootcamp.rocketacademy.co/module-4-frontend-framework-react/day-1/post-class/project-3-full-stack-game"
              }
            ]
          }
        }
      }
    },
    "28-06-2022": {
      "courseDate": "28-06-2022",
      "courseWeek": 14,
      "weekDay": 2,
      "dayNumber": 2,
      "meetingDateTimeUTC": "2022-06-28T02:00:00.000Z",
      "courseDay": 50,
      "dateTypes": {
        "module": "Module 4: Frontend Framework - React",
        "general": {
          "type": "general",
          "preClass": {
            "items": [
              {
                "name": "7.2 React Components",
                "url": "https://swebootcamp.rocketacademy.co/module-4-frontend-framework-react/day-2/pre-class/7.2-react-components"
              },
              {
                "name": "7.2.1: Props",
                "url": "https://swebootcamp.rocketacademy.co/module-4-frontend-framework-react/day-2/pre-class/7.2.1-props"
              },
              {
                "name": "7.2.2: Generating Components from a List",
                "url": "https://swebootcamp.rocketacademy.co/module-4-frontend-framework-react/day-2/pre-class/7.2.2-generating-components-from-a-list"
              },
              {
                "name": "7.2.3: Class Components",
                "url": "https://swebootcamp.rocketacademy.co/module-4-frontend-framework-react/day-2/pre-class/7.2.3-class-components"
              },
              {
                "name": "Algo Day 12"
              },
              {
                "name": "A.5.5: Linked Lists - Pre-Class",
                "url": "https://swebootcamp.rocketacademy.co/algorithms/algos/day-12/a.5.5-linked-lists"
              }
            ]
          },
          "inClass": {
            "items": [
              {
                "name": "7.ICE.2: React Pokedex",
                "url": "https://swebootcamp.rocketacademy.co/module-4-frontend-framework-react/day-2/in-class/7.ice.2-pokedex"
              }
            ]
          },
          "postClass": {
            "items": [
              {
                "name": "7.ICE.2: React Pokedex",
                "url": "https://swebootcamp.rocketacademy.co/module-4-frontend-framework-react/day-2/in-class/7.ice.2-pokedex"
              }
            ]
          }
        }
      }
    },
    "29-06-2022": {
      "courseDate": "29-06-2022",
      "courseWeek": 14,
      "weekDay": 3,
      "dayNumber": 3,
      "meetingDateTimeUTC": "2022-06-29T02:00:00.000Z",
      "courseDay": 51,
      "dateTypes": {
        "module": "Module 4: Frontend Framework - React",
        "general": {
          "type": "general",
          "preClass": {
            "items": [
              {
                "name": "7.3: Using React with Express and Webpack",
                "url": "https://swebootcamp.rocketacademy.co/module-4-frontend-framework-react/day-3/pre-class/7.3-using-react-with-express-and-webpack"
              },
              {
                "name": "7.4: React State",
                "url": "https://swebootcamp.rocketacademy.co/module-4-frontend-framework-react/day-3/pre-class/7.4-react-state"
              }
            ]
          },
          "inClass": {
            "items": [
              {
                "name": "7.ICE.3: React Cards",
                "url": "https://swebootcamp.rocketacademy.co/module-4-frontend-framework-react/day-3/in-class/7.ice.3-react-cards"
              }
            ]
          },
          "postClass": {
            "items": [
              {
                "name": "7.ICE.2: React Tic Tac Toe",
                "url": "https://swebootcamp.rocketacademy.co/module-4-frontend-framework-react/day-3/post-class/7.poce.2-react-tic-tac-toe"
              }
            ]
          }
        }
      }
    },
    "30-06-2022": {
      "courseDate": "30-06-2022",
      "courseWeek": 14,
      "weekDay": 4,
      "dayNumber": 4,
      "meetingDateTimeUTC": "2022-06-30T02:00:00.000Z",
      "courseDay": 52,
      "dateTypes": {
        "module": "Module 4: Frontend Framework - React",
        "general": {
          "type": "general",
          "preClass": {
            "items": [
              {
                "name": "7.5: Controlled Forms",
                "url": "https://swebootcamp.rocketacademy.co/module-4-frontend-framework-react/day-4/pre-class/7.5-controlled-forms"
              },
              {
                "name": "7.6: Passing Data BEtween Sibling Components",
                "url": "https://swebootcamp.rocketacademy.co/module-4-frontend-framework-react/day-4/pre-class/7.6-passing-data-between-sibling-components"
              },
              {
                "name": "Algo Day 13"
              },
              {
                "name": "A.5.5: Linked Lists - Part 2",
                "url": "https://swebootcamp.rocketacademy.co/algorithms/algos/day-13/a.5.5-linked-lists"
              }
            ]
          },
          "inClass": {
            "items": [
              {
                "name": "7.ICE.4: Guess the Word",
                "url": "https://swebootcamp.rocketacademy.co/module-4-frontend-framework-react/day-4/in-class/7.ice.4-guess-the-word"
              }
            ]
          },
          "postClass": {
            "items": [
              {
                "name": "7.POCE.3: Read Later",
                "url": "https://swebootcamp.rocketacademy.co/module-4-frontend-framework-react/day-4/post-class/7.poce.3-read-later"
              }
            ]
          }
        }
      }
    },
    "04-07-2022": {
      "courseDate": "04-07-2022",
      "courseWeek": 15,
      "weekDay": 1,
      "dayNumber": 1,
      "meetingDateTimeUTC": "2022-07-04T02:00:00.000Z",
      "courseDay": 53,
      "dateTypes": {
        "module": "Module 4: Frontend Framework - React",
        "general": {
          "type": "general",
          "preClass": {
            "items": [
              {
                "name": "7.7: Designing Component Hierarchy",
                "url": "https://swebootcamp.rocketacademy.co/module-4-frontend-framework-react/day-5/pre-class/7.7-designing-component-hierarchy"
              },
              {
                "name": "7.7.1: AJAX Requests from Components",
                "url": "https://swebootcamp.rocketacademy.co/module-4-frontend-framework-react/day-5/pre-class/7.7.1-ajax-requests-from-components"
              },
              {
                "name": "7.9: React Dev Tools",
                "url": "https://swebootcamp.rocketacademy.co/module-4-frontend-framework-react/day-5/pre-class/7.9-react-dev-tools"
              },
              {
                "name": "Algo Day 14"
              },
              {
                "name": "A.5.5: Linked Lists - Part 3",
                "url": "https://swebootcamp.rocketacademy.co/algorithms/algos/day-14/a.5.5-linked-lists"
              }
            ]
          },
          "inClass": {
            "items": [
              {
                "name": "7.ICE.5: Create Item",
                "url": "https://swebootcamp.rocketacademy.co/module-4-frontend-framework-react/day-5/in-class/7.ice.5-create-item"
              }
            ]
          },
          "postClass": {
            "items": [
              {
                "name": "7.POCE.3: Read Later",
                "url": "https://swebootcamp.rocketacademy.co/module-4-frontend-framework-react/day-5/post-class/7.poce.3-read-later"
              }
            ]
          }
        }
      }
    },
    "05-07-2022": {
      "courseDate": "05-07-2022",
      "courseWeek": 15,
      "weekDay": 2,
      "dayNumber": 2,
      "meetingDateTimeUTC": "2022-07-05T02:00:00.000Z",
      "courseDay": 54,
      "dateTypes": {
        "module": "Module 4: Frontend Framework - React",
        "projects": {
          "type": "projects",
          "projectStart": {
            "items": [
              {
                "name": "Start: Project 4 Ideation Phase 1",
                "url": "https://swebootcamp.rocketacademy.co/module-4-frontend-framework-react/day-6/post-class/project-4-full-stack-react-app"
              }
            ]
          }
        },
        "general": {
          "type": "general",
          "preClass": {},
          "inClass": {
            "items": [
              {
                "name": "Review 7.POCE.3: Read Later",
                "url": "https://swebootcamp.rocketacademy.co/module-4-frontend-framework-react/day-6/in-class/7.poce.3-read-later"
              }
            ]
          },
          "postClass": {
            "items": [
              {
                "name": "7.POCE.4: Hot Pot Bill Splitter",
                "url": "https://swebootcamp.rocketacademy.co/module-4-frontend-framework-react/day-6/post-class/7.poce.4-hot-pot-bill-splitter"
              },
              {
                "name": "Start: Project 4 Ideation Phase 1",
                "url": "https://swebootcamp.rocketacademy.co/module-4-frontend-framework-react/day-6/post-class/project-4-full-stack-react-app"
              }
            ]
          }
        }
      }
    },
    "06-07-2022": {
      "courseDate": "06-07-2022",
      "courseWeek": 15,
      "weekDay": 3,
      "dayNumber": 3,
      "meetingDateTimeUTC": "2022-07-06T02:00:00.000Z",
      "courseDay": 55,
      "dateTypes": {
        "module": "Module 4: Frontend Framework - React",
        "general": {
          "type": "general",
          "preClass": {
            "items": [
              {
                "name": "7.7.2: useEffect",
                "url": "https://swebootcamp.rocketacademy.co/module-4-frontend-framework-react/day-7/pre-class/7.7.2-useeffect"
              },
              {
                "name": "Algo Day 15"
              },
              {
                "name": "A.6: Binary Search - Pre-Class",
                "url": "https://swebootcamp.rocketacademy.co/algorithms/algos/day-15/a.6-binary-search"
              }
            ]
          },
          "inClass": {},
          "postClass": {
            "items": [
              {
                "name": "7.POCE.4: Hot Pot Bill Splitter",
                "url": "https://swebootcamp.rocketacademy.co/module-4-frontend-framework-react/day-6/post-class/7.poce.4-hot-pot-bill-splitter"
              },
              {
                "name": "Start: Project 4 Ideation Phase 1",
                "url": "https://swebootcamp.rocketacademy.co/module-4-frontend-framework-react/day-6/post-class/project-4-full-stack-react-app"
              }
            ]
          }
        }
      }
    },
    "07-07-2022": {
      "courseDate": "07-07-2022",
      "courseWeek": 15,
      "weekDay": 4,
      "dayNumber": 4,
      "meetingDateTimeUTC": "2022-07-07T02:00:00.000Z",
      "courseDay": 56,
      "dateTypes": {
        "module": "Module 4: Frontend Framework - React",
        "general": {
          "type": "general",
          "preClass": {
            "items": [
              {
                "name": "7.8: Error Boundaries",
                "url": "https://swebootcamp.rocketacademy.co/module-4-frontend-framework-react/day-8/pre-class/7.8-error-boundaries"
              },
              {
                "name": "Algo Day 16"
              },
              {
                "name": "A.6: Binary Search - Part 1",
                "url": "https://swebootcamp.rocketacademy.co/algorithms/algos/day-16/a.6-binary-search"
              }
            ]
          },
          "inClass": {},
          "postClass": {
            "items": [
              {
                "name": "7.POCE.4: Hot Pot Bill Splitter",
                "url": "https://swebootcamp.rocketacademy.co/module-4-frontend-framework-react/day-6/post-class/7.poce.4-hot-pot-bill-splitter"
              },
              {
                "name": "Project 4 Ideation Phase 1",
                "url": "https://swebootcamp.rocketacademy.co/module-4-frontend-framework-react/day-6/post-class/project-4-full-stack-react-app"
              }
            ]
          }
        }
      }
    },
    "11-07-2022": {
      "courseDate": "11-07-2022",
      "courseWeek": 16,
