{
  "daysOfWeek": [2, 6],
  "courseStartIndex": 1,
  "totalCourseDays": 13,
  "courseType": "Basics",
  "days": {
    "03-07-2021": {
      "courseDate": "03-07-2021",
      "courseWeek": 1,
      "weekDay": 1,
      "dayNumber": 6,
      "meetingDateTimeUTC": "2021-07-03T08:00:00.000Z",
      "courseDay": 0,
      "dateTypes": {
        "title": "Pre-Course Briefing",
        "general": {
          "type": "general",
          "preClass": {
            "mdText": "{% hint style=\"warning\" %}\nDay 0's pre-course briefing will run from 4-5pm instead of the usual 1-3pm. This is because the previous batch will be having their last class session from 1-3pm. Thank you for your understanding!\n{% endhint %}\n1. Instructor introductions\n2. Learning goals\n3. Learning format\n   1. [Pre-Class vs In-Class material](course-methodology.md#self-learning)\n   2. [Base vs More Comfortable](course-methodology.md#base-more-comfortable)\n4. Deliverables for Day 1\n   1. [Required Hardware and Software](required-hardware-and-software.md)\n   2. Pre-Class Material\n5. Slack tutorial\n   1. How to send monospaced code and code snippets in Slack\n6. Class photo\n7. Break into sections\n8. Section introductions and icebreakers\n   1. What do you do for work?\n   2. Why do you want to learn coding?\n   3. What are your career goals?\n   4. Fun fact?\n",
            "items": []
          },
          "inClass": { "items": [] },
          "postClass": { "items": [] },
          "projectStart": { "items": [] },
          "projectDue": { "items": [] }
        }
      }
    },
    "06-07-2021": {
      "courseDate": "06-07-2021",
      "courseWeek": 2,
      "weekDay": 1,
      "dayNumber": 2,
      "meetingDateTimeUTC": "2021-07-06T11:00:00.000Z",
      "courseDay": 1,
      "dateTypes": {
        "title": "Coding Tools ",
        "general": {
          "type": "general",
          "preClass": {
            "mdText": "Total Video Watch Time: **~48 mins**\n{% hint style=\"warning\" %}\nCoding Basics used to be called SWE101 and some of our videos were made before the name change and still reference the old name of SWE101. Please take note!\n{% endhint %}\n",
            "items": [
              {
                "name": "1.1: What is coding?",
                "url": "https://basics.rocketacademy.co/1-introduction/1.1-what-is-coding"
              },
              {
                "name": "1.2: Web Browsers",
                "url": "https://basics.rocketacademy.co/1-introduction/1.2-web-browsers"
              },
              {
                "name": "2.1: Command Line",
                "url": "https://basics.rocketacademy.co/2-organising-and-managing-code-files/2.1-command-line"
              },
              {
                "name": "2.2: Git",
                "url": "https://basics.rocketacademy.co/2-organising-and-managing-code-files/2.2-git"
              },
              {
                "name": "3.1: Operations",
                "url": "https://basics.rocketacademy.co/3-basic-data-manipulation/3.1-operations"
              },
              {
                "name": "3.2: Variables",
                "url": "https://basics.rocketacademy.co/3-basic-data-manipulation/3.2-variables"
              },
              {
                "name": "4.1: Introduction to Github",
                "url": "https://basics.rocketacademy.co/4-getting-started-with-code/4.1-intro-to-github"
              },
              {
                "name": "4.2: Our First Program",
                "url": "https://basics.rocketacademy.co/4-getting-started-with-code/4.2-our-first-program"
              }
            ]
          },
          "inClass": {
            "mdText": [
              "Total Video Watch Time: **~48 mins**\n{% hint style=\"warning\" %}\nPlease **do not** attempt in-class material before class for all course days, so that you and your partner can both attempt the problems for the first time during class. If you are looking for more material to work on, we suggest attempting the More Comfortable sections of previous days' exercises. If that is not enough, please message your section leader for more exercises.{% endhint %}\n"
            ],
            "items": [
              {
                "name": "Day 1: Basic File and Data Manipulation",
                "url": "https://basics.rocketacademy.co/in-class-exercises/day-1-basic-file-and-data-manipulation"
              }
            ]
          },
          "postClass": { "items": [] },
          "projectStart": { "items": [] },
          "projectDue": { "items": [] }
        }
      }
    },
    "10-07-2021": {
      "courseDate": "10-07-2021",
      "courseWeek": 2,
      "weekDay": 2,
      "dayNumber": 6,
      "meetingDateTimeUTC": "2021-07-10T05:00:00.000Z",
      "courseDay": 2,
      "dateTypes": {
        "title": "Functions",
        "general": {
          "type": "general",
          "preClass": {
            "mdText": ["Total Video Watch Time: **~25 mins**\n"],
            "items": [
              {
                "name": "Review Social Rules",
                "url": "https://basics.rocketacademy.co/course-logistics/love-social-rules"
              },
              {
                "name": "5.1: Functions",
                "url": "https://basics.rocketacademy.co/5-structuring-and-debugging-code/5.1-functions"
              },
              {
                "name": "5.2: Errors",
                "url": "https://basics.rocketacademy.co/5-structuring-and-debugging-code/5.2-errors"
              }
            ]
          },
          "inClass": {
            "items": [
              {
                "name": "Day 2: Functions",
                "url": "https://basics.rocketacademy.co/in-class-exercises/day-2-functions"
              }
            ]
          },
          "postClass": { "items": [] },
          "projectStart": { "items": [] },
          "projectDue": { "items": [] }
        }
      }
    },
    "13-07-2021": {
      "courseDate": "13-07-2021",
      "courseWeek": 3,
      "weekDay": 1,
      "dayNumber": 2,
      "meetingDateTimeUTC": "2021-07-13T11:00:00.000Z",
      "courseDay": 3,
      "dateTypes": {
        "title": "Logic 1",
        "general": {
          "type": "general",
          "preClass": {
            "mdText": "Total Video Watch Time: **~40 mins**\n",
            "items": [
              {
                "name": "6.1: Introduction to Logic",
                "url": "https://basics.rocketacademy.co/6-conditional-logic/6.1-intro-to-logic"
              },
              {
                "name": "6.2: Pseudo Code, Boolean \"Or\" ",
                "url": "https://basics.rocketacademy.co/6-conditional-logic/6.2-pseudo-code-boolean-or"
              },
              {
                "name": "6.3: Boolean \"And\", Boolean \"Not\" ",
                "url": "https://basics.rocketacademy.co/6-conditional-logic/6.3-boolean-and-not"
              }
            ]
          },
          "inClass": {
            "items": [
              {
                "name": "Day 3: If Statements, Boolean \"Or\", Boolean \"And\" ",
                "url": "https://basics.rocketacademy.co/in-class-exercises/day-3-if-statements-boolean-or"
              }
            ]
          },
          "postClass": { "items": [] },
          "projectStart": {
            "mdText": "{% hint style=\"warning\" %}\nWe may want to review [7.1: GitHub Fork and Pull Request](https://basics.rocketacademy.co/7-github/7.1-github-fork-and-pull-request) before starting the project.\n{% endhint %}\n",
            "items": [
              {
                "name": "Project 1: Scissors Paper Stone (Part 1)",
                "url": "https://basics.rocketacademy.co/projects/project-1-scissors-paper-stone/project-1-scissors-paper-stone-part-1"
              }
            ]
          },
          "projectDue": { "items": [] }
        }
      }
    },
    "17-07-2021": {
      "courseDate": "17-07-2021",
      "courseWeek": 3,
      "weekDay": 2,
      "dayNumber": 6,
      "meetingDateTimeUTC": "2021-07-17T05:00:00.000Z",
      "courseDay": 4,
      "dateTypes": {
        "title": "Logic 2, State 1",
        "general": {
          "type": "general",
          "preClass": {
            "mdText": "Total Video Watch Time: **~41 mins**\n",
            "items": [
              {
                "name": "7.1: Github Fork and Pull Request",
                "url": "https://basics.rocketacademy.co/7-github/7.1-github-fork-and-pull-request"
              },
              {
                "name": "7.2: Github Navigation",
                "url": "https://basics.rocketacademy.co/7-github/7.2-github-repo-browsing"
              },
              {
                "name": "8.1: Program Lifecycle and Global State",
                "url": "https://basics.rocketacademy.co/8-managing-state-and-input-validation/8.1-program-lifecycle-and-state"
              }
            ]
          },
          "inClass": {
            "items": [
              {
                "name": "Day 4: Boolean \"And\", GitHub, Program State",
                "url": "https://basics.rocketacademy.co/in-class-exercises/day-4-boolean-and-program-state"
              }
            ]
          },
          "postClass": { "items": [] },
          "projectStart": {
            "mdText": "{% hint style=\"warning\" %}\nWe may want to review 8.2: Program State for Game Modes before completing the More Comfortable section of SPS Part 2.\n{% endhint %}\n",
            "items": [
              {
                "name": "Project 1: Scissors Paper Stone (Part 2)",
                "url": "https://basics.rocketacademy.co/projects/project-1-scissors-paper-stone/project-1-scissors-paper-stone-part-2"
              }
            ]
          },
          "projectDue": {
            "items": [
              {
                "name": "Project 1: Scissors Paper Stone (Part 1)",
                "url": "https://basics.rocketacademy.co/projects/project-1-scissors-paper-stone/project-1-scissors-paper-stone-part-1"
              }
            ]
          }
        }
      }
    },
    "20-07-2021": {
      "courseDay": null,
      "courseDate": "20-07-2021",
      "courseWeek": 4,
      "dayNumber": 2,
      "dateTypes": {
        "holidayType": "Public Holiday",
        "date": "20-07-2021",
        "location": "SG",
        "name": "Hari Raya Haji"
      }
    },
    "24-07-2021": {
      "courseDate": "24-07-2021",
      "courseWeek": 4,
      "weekDay": 1,
      "dayNumber": 6,
      "meetingDateTimeUTC": "2021-07-24T05:00:00.000Z",
      "courseDay": 5,
      "dateTypes": {
        "title": "State 2",
        "general": {
          "type": "general",
          "preClass": {
            "mdText": "Total Video Watch Time: **~17 mins**\n",
            "items": [
              {
                "name": "8.2: Program State for Game Modes",
                "url": "https://basics.rocketacademy.co/8-managing-state-and-input-validation/8.2-program-state-for-game-modes"
              },
              {
                "name": "8.3: Input Validation",
                "url": "https://basics.rocketacademy.co/8-managing-state-and-input-validation/8.3-input-validation"
              }
            ]
          },
          "inClass": {
            "items": [
              {
                "name": "Day 5: Scissors Paper Stone Redux",
                "url": "https://basics.rocketacademy.co/in-class-exercises/day-5-scissors-paper-stone-redux"
              }
            ]
          },
          "postClass": { "items": [] },
          "projectStart": {
            "items": [
              {
                "name": "Project 2: Beat That!",
                "url": "https://basics.rocketacademy.co/projects/project-2-beat-that"
              }
            ]
          },
          "projectDue": { "items": [] }
        }
      }
    },
    "27-07-2021": {
      "courseDate": "27-07-2021",
      "courseWeek": 5,
      "weekDay": 1,
      "dayNumber": 2,
      "meetingDateTimeUTC": "2021-07-27T11:00:00.000Z",
      "courseDay": 6,
      "dateTypes": {
        "title": "Arrays, Loops 1",
        "general": {
          "type": "general",
          "preClass": {
            "mdText": "Total Video Watch Time: **~41 mins**\n",
            "items": [
              {
                "name": "Coding Strategies",
                "url": "https://basics.rocketacademy.co/course-logistics/coding-strategies"
              },
              {
                "name": "9.1: Arrays",
                "url": "https://basics.rocketacademy.co/9-arrays-and-iteration/9.1-arrays"
              },
              {
                "name": "9.2: Loops",
                "url": "https://basics.rocketacademy.co/9-arrays-and-iteration/9.2-loops"
              }
            ]
          },
          "inClass": {
            "items": [
              {
                "name": "Loops",
                "url": "https://basics.rocketacademy.co/in-class-exercises/day-6-loops"
              }
            ]
          },
          "postClass": { "items": [] },
          "projectStart": { "items": [] },
          "projectDue": { "items": [] }
        }
      }
    },
    "31-07-2021": {
      "courseDate": "31-07-2021",
      "courseWeek": 5,
      "weekDay": 2,
      "dayNumber": 6,
      "meetingDateTimeUTC": "2021-07-31T05:00:00.000Z",
      "courseDay": 7,
      "dateTypes": {
        "title": "Loops 2",
        "general": {
          "type": "general",
          "preClass": {
            "mdText": "Total Video Watch Time: **~11 mins**\n",
            "items": [
              {
                "name": "9.3: Loops with Arrays",
                "url": "https://basics.rocketacademy.co/9-arrays-and-iteration/9.3-loops-with-arrays"
              }
            ]
          },
          "inClass": {
            "items": [
              {
                "name": "Day 7: Loops and Arrays",
                "url": "https://basics.rocketacademy.co/in-class-exercises/day-7-arrays-and-loops"
              }
            ]
          },
          "postClass": { "items": [] },
          "projectStart": { "items": [] },
          "projectDue": { "items": [] }
        }
      }
    },
    "03-08-2021": {
      "courseDate": "03-08-2021",
      "courseWeek": 6,
      "weekDay": 1,
      "dayNumber": 2,
      "meetingDateTimeUTC": "2021-08-03T11:00:00.000Z",
      "courseDay": 8,
      "dateTypes": {
        "title": "Objects",
        "general": {
          "type": "general",
          "preClass": {
            "mdText": "Total Video Watch Time: **~15 mins**\n",
            "items": [
              {
                "name": "10.1: Javascript Objects",
                "url": "https://basics.rocketacademy.co/10-javascript-objects/10.1-javascript-objects"
              }
            ]
          },
          "inClass": {
            "items": [
              {
                "name": "Day 8: Beat That Redux",
                "url": "https://basics.rocketacademy.co/in-class-exercises/day-8-beat-that-redux"
              }
            ]
          },
          "postClass": { "items": [] },
          "projectStart": {
            "items": [
              {
                "name": "Project 3: Blackjack",
                "url": "https://basics.rocketacademy.co/projects/project-3-blackjack"
              }
            ]
          },
          "projectDue": {
            "items": [
              {
                "name": "Project 2: Beat That!",
                "url": "https://basics.rocketacademy.co/projects/project-2-beat-that"
              }
            ]
          }
        }
      }
    },
    "07-08-2021": {
      "courseDate": "07-08-2021",
      "courseWeek": 6,
      "weekDay": 2,
      "dayNumber": 6,
      "meetingDateTimeUTC": "2021-08-07T05:00:00.000Z",
      "courseDay": 9,
      "dateTypes": {
        "title": "Card Logic",
        "general": {
          "type": "general",
          "preClass": {
            "mdText": "Total Video Watch Time: **~16 mins**\n",
            "items": [
              {
                "name": "10.2: Card Deck Generation with Loops ",
                "url": "https://basics.rocketacademy.co/10-javascript-objects/10.2-card-deck-generation-with-loops"
              }
            ]
          },
          "inClass": {
            "items": [
              {
                "name": "Day 9: Moar Cards",
                "url": "https://basics.rocketacademy.co/in-class-exercises/day-9-moar-cards"
              }
            ]
          },
          "postClass": { "items": [] },
          "projectStart": { "items": [] },
          "projectDue": { "items": [] }
        }
      }
    },
    "10-08-2021": {
      "courseDate": "10-08-2021",
      "courseWeek": 7,
      "weekDay": 1,
      "dayNumber": 2,
      "meetingDateTimeUTC": "2021-08-10T11:00:00.000Z",
      "courseDay": 10,
      "dateTypes": {
        "title": "Coding Strategies",
        "general": {
          "type": "general",
          "preClass": {
            "mdText": "Total Video Watch Time: **~60 mins**\n",
            "items": [
              {
                "name": "10.3: War Card Game Sample Implementation",
                "url": "https://basics.rocketacademy.co/10-javascript-objects/10.3-card-game-example-war"
              }
            ]
          },
          "inClass": {
            "items": [
              {
                "name": "Day 10: Chat Bot",
                "url": "https://basics.rocketacademy.co/in-class-exercises/day-10-chat-bot"
              }
            ]
          },
          "postClass": { "items": [] },
          "projectStart": { "items": [] },
          "projectDue": { "items": [] }
        }
      }
    },
    "14-08-2021": {
      "courseDate": "14-08-2021",
      "courseWeek": 7,
      "weekDay": 2,
      "dayNumber": 6,
      "meetingDateTimeUTC": "2021-08-14T05:00:00.000Z",
      "courseDay": 11,
      "dateTypes": {
        "title": "Debugger",
        "general": {
          "type": "general",
          "preClass": {
            "mdText": "Total Video Watch Time: **~18 mins**\n",
            "items": [
              {
                "name": "11.1: Advanced Debugging with Sources Tab",
                "url": "https://basics.rocketacademy.co/11-advanced-debugging/11.1-advanced-debugging-with-sources-tab"
              },
              {
                "name": "12.3: Project Deployment",
                "url": "https://basics.rocketacademy.co/12-next-steps/12.3-deployment"
              }
            ]
          },
          "inClass": {
            "items": [
              {
                "name": "Day 11: Blackjack Redux and Debugger",
                "url": "https://basics.rocketacademy.co/in-class-exercises/day-11-blackjack-redux-debugger"
              }
            ]
          },
          "postClass": { "items": [] },
          "projectStart": {
            "items": [
              {
                "name": "Project 3: Blackjack (More Comfortable)",
                "url": "https://basics.rocketacademy.co/projects/project-3-blackjack#more-comfortable"
              }
            ]
          },
          "projectDue": {
            "items": [
              {
                "name": "Project 3: Blackjack",
                "url": "https://basics.rocketacademy.co/projects/project-3-blackjack"
              }
            ]
          }
        }
      }
    },
    "16-08-2021": {
      "courseDate": "16-08-2021",
      "courseWeek": 8,
      "weekDay": 3,
      "dayNumber": 1,
      "meetingDateTimeUTC": "2021-08-16T11:00:00.000Z",
      "courseDay": 12,
      "dateTypes": {
        "title": "Project Presentations",
        "general": {
          "type": "general",
          "preClass": {
            "mdText": "Total Video Watch Time: **~22 mins**\n",
            "items": [
              {
                "name": "12.1: Browser Applications with DOM",
                "url": "https://basics.rocketacademy.co/12-next-steps/12.1-browser-applications-with-dom"
              },
              {
                "name": "12.2: HTML, CSS Review",
                "url": "https://basics.rocketacademy.co/12-next-steps/12.2-html-css-review"
              }
            ]
          },
          "inClass": {
            "items": [
              { "name": "Course Feedback and Reviews" },
              {
                "name": "Project presentations",
                "url": "https://basics.rocketacademy.co/course-logistics/course-methodology#project-presentations"
              },
              { "name": "LinkedIn certificate presentations" },
              { "name": "Class Photo 🥳" }
            ]
          },
          "postClass": { "items": [] },
          "projectStart": { "items": [] },
          "projectDue": {
            "items": [
              {
                "name": "Project 3: Blackjack (More Comfortable)",
                "url": "https://basics.rocketacademy.co/projects/project-3-blackjack#more-comfortable"
              },
              {
                "name": "Deploy Blackjack to the internet with instructions from Module 12.3: Deployment",
                "url": "https://basics.rocketacademy.co/12-next-steps/12.3-deployment"
              }
            ]
          }
        }
      }
    }
  },
  "courseName": "03-07-2021_16-08-2021_BATCH9"
}
